id,title,description,date,url,source,country,category
180,New nature health scheme aims to boost well-being,"The RSPB, which helped draw up the scheme, says it has been a success in other parts of the UK.","Wed, 28 May 2025 16:49:23 GMT",https://www.bbc.com/news/articles/cgr54r2kky8o,BBC,United Kingdom,health
181,Horse charity calls on NHS to fund equine services,"Horses for Wellbeing says the funding would see children get help before they ""hit crisis point"".","Thu, 22 May 2025 04:58:16 GMT",https://www.bbc.com/news/articles/cy8d927xllzo,BBC,Syria,health
182,Nature festival launched at national Park,"Events included wildlife walks, art sessions and the chance to meet an Exmoor pony. ","Sat, 17 May 2025 13:57:17 GMT",https://www.bbc.com/news/articles/cn5y21yg9l9o,BBC,South Africa,health
183,Helping on the farm reaps mental health benefits,"Farm Care has ""seen an impact"" on youngsters' mental health on east Surrey farms.","Wed, 14 May 2025 05:43:03 GMT",https://www.bbc.com/news/articles/c9895v7j9q0o,BBC,Unknown,health
184,Inside Health,James explores the science of a sweet tooth and then gets tips on how to brush like a pro.,"Tue, 15 Apr 2025 09:00:00 GMT",https://www.bbc.co.uk/sounds/play/m0029yy8,BBC,United States,health
185,Voices from both sides of debate on  assisted dying bill,Protesters gathered outside of parliament as MPs vote on legalising assisted dying,"Fri, 20 Jun 2025 11:32:06 GMT",https://www.bbc.com/news/videos/cm20m4zvee8o,BBC,Unknown,health
186,Heston: My Life with Bipolar,Chef Heston Blumenthal looks back at how bipolar disorder has impacted his life.,"Thu, 19 Jun 2025 05:00:00 GMT",https://www.bbc.co.uk/iplayer/episode/m0029k2h,BBC,Unknown,health
187,"Iran, Israel trade missiles as US bombing of nuclear sites escalates crisis","Air raid sirens heard across Israel as Iran launches two volleys of missiles in rapid succession, targeting key sites.","Sun, 22 Jun 2025 09:47:46 +0000",https://www.aljazeera.com/news/2025/6/22/iran-israel-trade-missiles-as-us-bombing-of-nuclear-sites-escalates-crisis?traffic_source=rss,Al Jazeera,United States,Technology
188,US strikes “not about any kind of threat from Iran”,"Professor Stephen Zunes says Donald Trump is not threatened by Iran&#039;s nuclear programme, but the challenge to US power.","Sun, 22 Jun 2025 09:39:14 +0000",https://www.aljazeera.com/video/quotable/2025/6/22/us-strikes-not-about-any-kind-of-threat-from?traffic_source=rss,Al Jazeera,United States,Politics
189,US bombs Iran’s nuclear sites: What we know so far,"Trump has warned of more attacks on Iran after bombing some of its key nuclear energy sites, including Fordow.","Sun, 22 Jun 2025 09:34:49 +0000",https://www.aljazeera.com/news/2025/6/22/us-bombs-irans-nuclear-sites-what-we-know-so-far?traffic_source=rss,Al Jazeera,United States,General
190,Can the Global South stop genocide? Gandikota Nellutla and Ken Roth,"Former head of Human Rights Watch interviews Hague Group founder on human rights, Israel and Western hypocrisy.","Sun, 22 Jun 2025 08:36:25 +0000",https://www.aljazeera.com/video/reframe/2025/6/22/can-the-global-south-stop-genocide-gandikota-nellutla-and-ken-roth?traffic_source=rss,Al Jazeera,Israel,Politics
191,India says it will ‘never’ restore Indus Waters Treaty with Pakistan,New Delhi put into &#039;abeyance&#039; its participation in the 1960 treaty after 26 people were killed in Kashmir in April.,"Sun, 22 Jun 2025 08:10:04 +0000",https://www.aljazeera.com/news/2025/6/22/india-says-it-will-never-restore-indus-waters-treaty-with-pakistan?traffic_source=rss,Al Jazeera,United States,General
192,Jon Jones retires; Tom Aspinall crowned UFC’s undisputed heavyweight champ,"&#039;Jon Jones is officially retired. Tom Aspinall is the heavyweight champion,&#039; UFC chief Dana White confirms in Baku.","Sun, 22 Jun 2025 07:33:57 +0000",https://www.aljazeera.com/sports/2025/6/22/tom-aspinall-is-ufcs-undisputed-heavyweight-champ-as-jon-jones-retires?traffic_source=rss,Al Jazeera,Unknown,Politics
193,Iranian missiles hit Israel after US bombs Iran’s nuclear sites,"Sirens rang in Israeli cities, with rescue services and media reports saying at least 20 people were injured.","Sun, 22 Jun 2025 07:20:47 +0000",https://www.aljazeera.com/gallery/2025/6/22/iranian-missiles-hit-israel-after-us-bombs-irans-nuclear-sites?traffic_source=rss,Al Jazeera,United States,General
194,Iran launches barrage of missiles at Israel in retaliation for US bombing,Iran has launched retaliatory missile strikes against Israel after an unprecedented US attack on Iranian nuclear sites.,"Sun, 22 Jun 2025 06:59:16 +0000",https://www.aljazeera.com/video/newsfeed/2025/6/22/iran-launches-barrage-of-missiles-at-israel-in-retaliation-for-us-bombing?traffic_source=rss,Al Jazeera,United States,Technology
195,Netanyahu thanks Trump for ‘historic’ US strikes on Iran’s nuclear sites,Israel’s Prime Minister Benjamin Netanyahu has praised US President Donald Trump’s decision to bomb three nuclear sites ,"Sun, 22 Jun 2025 06:50:56 +0000",https://www.aljazeera.com/video/newsfeed/2025/6/22/netanyahu-thanks-trump-for-historic-us-strikes-on-irans-nuclear-sites?traffic_source=rss,Al Jazeera,United States,Technology
196,FIFA Club World Cup: Dortmund edge Sundowns 4-3 as Inter knock out Urawa,Dortmund break South African hearts in Cincinnati &#039;sauna&#039; before Inter and Fluminense record easy wins on matchday two.,"Sun, 22 Jun 2025 06:18:06 +0000",https://www.aljazeera.com/sports/2025/6/22/fifa-club-world-cup-dortmund-edge-sundowns-4-3-as-inter-knock-out-urawa?traffic_source=rss,Al Jazeera,South Africa,Politics
197,World reacts to US attacks on Iran,A roundup of reactions as US joins Israel&#039;s war and attacks three Iranian nuclear sites.,"Sun, 22 Jun 2025 06:12:39 +0000",https://www.aljazeera.com/news/2025/6/22/everlasting-consequences-world-reacts-to-us-attacks-on-iran?traffic_source=rss,Al Jazeera,United States,Politics
198,Full speech: Donald Trump’s address to nation after attack on Iran,US president warns Iran that it must now &#039;make peace&#039; or face future US attacks.,"Sun, 22 Jun 2025 04:09:55 +0000",https://www.aljazeera.com/news/2025/6/22/full-speech-donald-trumps-address-to-nation-after-attack-on-iran?traffic_source=rss,Al Jazeera,United States,General
199,"US joins Israel in attacking Iran, strikes Fordow, Isfahan, Natanz sites",IAEA says it has not detected any increase in radiation levels at key nuclear sites in Iran following US air strikes.,"Sun, 22 Jun 2025 03:51:26 +0000",https://www.aljazeera.com/news/2025/6/22/us-joins-israel-in-attacks-against-iran-strikes-key-nuclear-sites?traffic_source=rss,Al Jazeera,United States,Technology
200,Trump threatens Iran with ‘either peace or tragedy’ after US strikes,US President Donald Trump thanked Israeli PM Benjamin Netanyahu and God after the US conducted strikes on Iran.,"Sun, 22 Jun 2025 02:31:35 +0000",https://www.aljazeera.com/video/newsfeed/2025/6/22/trump-threatens-iran-with-either-peace-or-tragedy-after-us-strikes?traffic_source=rss,Al Jazeera,United States,General
201,The Netherlands returns 119 stolen sculptures to Nigeria,"The Benin Bronzes were artefacts stolen during the UK&#039;s imperial plunder of Benin, modern-day southern Nigeria.","Sat, 21 Jun 2025 21:56:31 +0000",https://www.aljazeera.com/news/2025/6/21/the-netherlands-returns-119-stolen-sculptures-to-nigeria?traffic_source=rss,Al Jazeera,United Kingdom,Politics
202,What is the cost of the war between Israel and Iran?,Continuing strikes from both countries are draining their economies.,"Sat, 21 Jun 2025 20:50:25 +0000",https://www.aljazeera.com/video/inside-story/2025/6/21/what-is-the-cost-of-the-war-between-israel-and-iran?traffic_source=rss,Al Jazeera,Iran,Technology
203,Mahmoud Khalil vows to continue to ‘speak up for Palestine’ after release,Former Columbia University student was released from a detention centre after being held for more than three months.,"Sat, 21 Jun 2025 20:09:12 +0000",https://www.aljazeera.com/news/2025/6/21/mahmoud-khalil-vows-to-continue-to-speak-up-for-palestine-after-release?traffic_source=rss,Al Jazeera,Unknown,Politics
204,Pope century leads England fightback against India at Headingley,England&#039;s Ollie Pope scores a century in second day fightback of first Test against India.,"Sat, 21 Jun 2025 19:56:05 +0000",https://www.aljazeera.com/sports/2025/6/21/pope-century-leads-england-fightback-against-india-at-headingley?traffic_source=rss,Al Jazeera,United Kingdom,Technology
205,"Israel-Iran conflict: List of key events, June 21, 2025",Here are the key events on day nine of the Israel-Iran conflict.,"Sat, 21 Jun 2025 19:44:57 +0000",https://www.aljazeera.com/news/2025/6/21/israel-iran-conflict-list-of-key-events-june-21-2025?traffic_source=rss,Al Jazeera,Iran,Politics
206,Netanyahu wants to fight Iran because “he can stay in office”,"Benjamin Netanyahu wants war with Iran to stay in power, not peace with Palestinians, says Bill Clinton","Sat, 21 Jun 2025 19:09:12 +0000",https://www.aljazeera.com/video/quotable/2025/6/21/netanyahu-wants-to-fight-iran-because-he-can-stay-in-office?traffic_source=rss,Al Jazeera,United States,General
207,"Eight killed after hot air balloon catches fire, crashes in Brazil","The tourism balloon carrying 21 people went up in flames in the early hours of Saturday, crashing in Praia Grande.","Sat, 21 Jun 2025 17:36:48 +0000",https://www.aljazeera.com/news/2025/6/21/eight-dead-after-hot-air-balloon-crashes-in-brazil?traffic_source=rss,Al Jazeera,Brazil,Technology
208,"Iranian, Israeli economies “under stress” because of war","Economic pain is spreading in Iran and Israel as conflict escalates, said professor Nader Habibi.","Sat, 21 Jun 2025 16:42:41 +0000",https://www.aljazeera.com/video/quotable/2025/6/21/iranian-israeli-economies-under-stress-because-of-war?traffic_source=rss,Al Jazeera,United States,Technology
209,Aid seekers in Gaza continue to be targeted as Israeli attacks kill 26,"Gaza’s Health Ministry says that in the last 48 hours, 202 people have been killed in Israeli attacks.","Sat, 21 Jun 2025 15:49:01 +0000",https://www.aljazeera.com/news/2025/6/21/aid-seekers-in-gaza-continue-to-be-targeted-as-israeli-attacks-kill-26?traffic_source=rss,Al Jazeera,Israel,Technology
210,"Belarus opposition leader Siarhei Tsikhanouski freed from jail, says wife","Tsikhanousk&#039;s arrest and activism sparked unprecedented protests in Belarus, challenging Lukashenko&#039;s decades-long rule.","Sat, 21 Jun 2025 15:31:28 +0000",https://www.aljazeera.com/news/2025/6/21/belarus-opposition-leader-syarhei-tikhanovsky-freed-from-jail-says-wife?traffic_source=rss,Al Jazeera,United Kingdom,Technology
211,"Real Madrid vs Pachuca: FIFA Club World Cup – start, team news, lineups",Five-time winners Real Madrid take on Mexico&#039;s Pachuca in the group stage of FIFA Club World Cup in Charlotte.,"Sat, 21 Jun 2025 14:58:25 +0000",https://www.aljazeera.com/sports/2025/6/21/real-madrid-vs-pachuca-fifa-club-world-cup-start-team-news-lineups?traffic_source=rss,Al Jazeera,Mexico,Sports
212," Israel-Iran live updates: US attack 'outrageous,' Tehran says, vowing response",President Donald Trump said the U.S. attacked three sites in Iran related to the country's nuclear program.,"Sun, 22 Jun 2025 06:08:11 -0400",https://abcnews.go.com/International/live-updates/israel-iran-live-updates/?id=122881565,ABC,United States,Technology
213,LIVE:  ABC News Live,24/7 coverage of breaking news and live events,"Sat, 21 Jun 2025 23:04:01 -0400",https://abcnews.go.com/Live/video/abcnews-live-41463246,ABC,Unknown,General
214, Trump said he was giving Iran a window to come to the table. He struck 2 days later.,"He said Friday it would give time for Iranians to ""come to their senses.""","Sat, 21 Jun 2025 23:30:54 -0400",https://abcnews.go.com/Politics/trump-giving-iran-window-table-struck-2-days/story?id=123081689,ABC,United States,Technology
215, Transcript: President Donald Trump addresses nation after US strikes on Iran,President Donald Trump addressed the nation after the United States struck three nuclear sites in Iran on Saturday.,"Sat, 21 Jun 2025 22:23:30 -0400",https://abcnews.go.com/Politics/transcript-donald-trump-addresses-nation-after-iran-strikes/story?id=123084288,ABC,United States,Politics
216,"WATCH:  US attack on Iran ‘a spectacular military success,’ Trump says",President Donald Trump addresses the nation from the White House.,"Sat, 21 Jun 2025 22:40:45 -0400",https://abcnews.go.com/Politics/video/us-attack-iran-spectacular-military-success-trump-123085176,ABC,United States,General
217,"WATCH:  Baby elephant attempts a charge, takes a tumble","A FOR EFFORT: A very tough (and very adorable) baby elephant attempted to charge a family of tourists visiting Kruger National Park in South Africa, only to take a tumble.","Fri, 20 Jun 2025 12:47:45 -0400",https://abcnews.go.com/International/video/baby-elephant-attempts-charge-takes-tumble-123046446,ABC,South Africa,General
218,WATCH:  Mother meets boy with late son’s heart in emotional gathering,"Kaci Wilson’s son, Myles Godfrey, died from brain injuries sustained in a car accident. His organs saved the lives of multiple children, including 7-year-old Saleh Ahmad.","Fri, 20 Jun 2025 07:15:30 -0400",https://abcnews.go.com/US/video/mother-meets-boy-late-sons-heart-123032364,ABC,United States,Technology
219,WATCH:  ‘I’m pretty lucky’: Teen struck by lightning as thunderstorms hit Northeast,"In New York City, a teenager was struck by lightning in Central Park Thursday afternoon, police said. The boy is alert and conscious, police said.","Fri, 20 Jun 2025 16:24:13 -0400",https://abcnews.go.com/US/video/im-pretty-lucky-teen-struck-lightning-thunderstorms-hit-123036563,ABC,United States,Technology
220,WATCH:  Beyoncé brings out Miley Cyrus during ‘Cowboy Carter’ stop in Paris,Cyrus rose up onto the Stade de France stage to perform the Grammy-winning duet “2 Most Wanted” with Beyoncé on Thursday night.,"Fri, 20 Jun 2025 11:22:28 -0400",https://abcnews.go.com/GMA/Culture/video/beyonc-brings-miley-cyrus-cowboy-carter-stop-paris-123033993,ABC,United States,General
221,WATCH:  Congressman nearly ‘run off road’ raises political violence concerns,"Rep. Max Miller, R-Ohio, said he was ""run off the road"" by a driver with a Palestinian flag, amid a disturbing increase in political violence nationwide.","Fri, 20 Jun 2025 11:59:34 -0400",https://abcnews.go.com/Politics/video/congressman-run-off-road-raises-political-violence-concerns-123032251,ABC,Unknown,Technology
222,WATCH:  Terrifying moment silverback gorilla charges toward trekkers in Uganda,"""This was a rare occurrence and no one, gorilla or human, got hurt,"" the wildlife conservationist who shot the video said.","Thu, 19 Jun 2025 11:02:46 -0400",https://abcnews.go.com/International/video/terrifying-moment-silverback-gorilla-charges-trekkers-uganda-123011406,ABC,Unknown,Technology
223,WATCH:  Why every American should celebrate Juneteenth,"Darrin Anderson, CEO of the Urban League of Greater Philadelphia, discusses the importance of the holiday, and how people can celebrate.","Thu, 19 Jun 2025 10:48:33 -0400",https://abcnews.go.com/US/video/american-celebrate-juneteenth-123010417,ABC,United States,Politics
224,WATCH:  SpaceX Starship explodes in huge fireball,A SpaceX Starship rocket being tested in Texas exploded after the craft “experienced a major anomaly.”,"Thu, 19 Jun 2025 07:41:15 -0400",https://abcnews.go.com/Technology/video/spacex-starship-explodes-huge-fireball-123003758,ABC,Unknown,General
225,WATCH:  Dallas Cowboys cheerleaders get 400% raise,Sam Champion reports the buzziest news of the day in “GMA” Pop News.,"Thu, 19 Jun 2025 10:51:25 -0400",https://abcnews.go.com/GMA/Culture/video/dallas-cowboys-cheerleaders-400-raise-123005533,ABC,Unknown,Technology
226,"WATCH:  How ‘Jaws’ changed movies, beach visits",An upcoming National Geographic documentary takes viewers behind the scenes of “Jaws” and looks at the movie’s cultural legacy on its 50th anniversary.,"Thu, 19 Jun 2025 11:27:08 -0400",https://abcnews.go.com/GMA/Culture/video/jaws-movies-beach-visits-123004949,ABC,Unknown,General
227,WATCH:  Daughter surprises dad on wedding day with recording of great grandfather singing,David Muir reports on the woman who found an old recording of her great grandfather singing decided to save the music for just the right moment – years later during her father-daughter dance.,"Wed, 18 Jun 2025 20:42:58 -0400",https://abcnews.go.com/WNT/video/daughter-surprises-dad-wedding-day-recording-great-grandfather-122990442,ABC,United States,Politics
228," US hits 3 Iranian nuclear sites, Trump says, plunging America into conflict","The United States struck three nuclear sites in Iran on Saturday, plunging the U.S. into a battle waged over the past several days between Israel and Iran.","Sat, 21 Jun 2025 23:18:56 -0400",https://abcnews.go.com/Politics/us-hits-3-iranian-nuclear-sites-trump-plunging/story?id=123081409,ABC,United States,Politics
229, What was in the Iran nuclear deal and why did Trump withdraw the US from it?,"Known as the Joint Comprehensive Plan of Action, or JCPOA, the deal followed two years of negotiations during the Obama administration.","Sat, 21 Jun 2025 21:02:18 -0400",https://abcnews.go.com/Politics/iran-nuclear-deal-trump-united-states/story?id=123020009,ABC,United States,General
230," Trump vowed to be a 'peacemaker' but Iran, other conflicts ramping up on his watch","President Trump said he wanted his legacy to be that of a ""peacemaker and a unifier."" Six months into his term, conflicts are raging on three fronts.","Sat, 21 Jun 2025 22:27:25 -0400",https://abcnews.go.com/Politics/trump-vowed-peacemaker-foreign-conflicts-ramping-watch/story?id=122937241,ABC,United States,Technology
231, Trump admin live updates: JD Vance visits LA amid tension over immigration policies,Trump took to Truth Social Friday morning to again make unverified claims that the 2020 election was fraudulent and called for a special prosecutor.,"Sat, 21 Jun 2025 23:07:48 -0400",https://abcnews.go.com/Politics/live-updates/trump-admin-live-updates/?id=122881881,ABC,United States,Technology
232, Justice Ketanji Brown Jackson blasts 'narrow-minded' judging on SCOTUS: ANALYSIS,"Justice Ketanji Brown Jackson unloaded on her Supreme Court colleagues in a series of sharp dissents, castigating a ""pure textualism"" approach to interpreting laws.","Fri, 20 Jun 2025 17:34:27 -0400",https://abcnews.go.com/Politics/justice-ketanji-brown-jackson-blasts-narrow-minded-judging/story?id=123056694,ABC,United States,Politics
233, ICE raids and their uncertainty scare off workers and baffle businesses,"Farmers, cattle ranchers and hotel and restaurant managers breathed a sigh of relief last week when President Donald Trump ordered a pause to immigration raids that were disrupting those industries and scaring foreign-born workers off the job","Thu, 19 Jun 2025 06:30:16 -0400",https://abcnews.go.com/Politics/wireStory/ice-raids-uncertainty-scare-off-workers-baffle-businesses-123002025,ABC,United States,Technology
234, Trump threats to withdraw from Ukraine war could imperil 30% of Kyiv's weapons,President Donald Trump -- clearly frustrated by the failure of his diplomatic efforts to date -- has raised the prospect of entirely abandoning American engagement.,"Thu, 19 Jun 2025 05:41:24 -0400",https://abcnews.go.com/International/trumps-threats-abandon-ukraine-war-pose-battlefield-conundrums/story?id=122624970,ABC,United Kingdom,Technology
235, 'Any illegal immigrants?' Trump questions workers installing White House flagpoles,"The president's comments came as workers erected two 88-foot-tall flagpoles, one on the North Lawn and one on the South Lawn, at the White House on Wednesday.","Thu, 19 Jun 2025 05:57:07 -0400",https://abcnews.go.com/US/illegal-immigrants-trump-questions-workers-installing-white-house/story?id=122996015,ABC,United States,Politics
236, Court denies Trump's bid to delay appeal of $83M judgment in E. Jean Carroll case,President Trump has asked an appeals court to delay arguments scheduled for next week in his appeal of the $83 million defamation case brought by E. Jean Carroll.,"Fri, 20 Jun 2025 15:06:09 -0400",https://abcnews.go.com/US/trump-seeks-delay-appeal-83-million-judgment-jean/story?id=123047927,ABC,United States,General
237," Musk bets cabs will give Tesla a lift after boycotts, sales plunge","Elon Musk has long promised to put a fleet of driverless Tesla &ldquo;robotaxis&quot; on the roads, but fans and shareholders have been kept waiting","Sun, 22 Jun 2025 06:19:52 -0400",https://abcnews.go.com/Technology/wireStory/hail-robotaxi-musk-bets-cabs-give-tesla-lift-123089713,ABC,United States,Technology
238, Man whose parents were kidnapped after $245M Bitcoin theft pleads guilty to charges,A Connecticut man whose parents were kidnapped after he took part in a $245 million Bitcoin theft has pleaded guilty to fraud and money laundering conspiracy charges and has agreed to testify against his co-defendants,"Fri, 20 Jun 2025 17:42:48 -0400",https://abcnews.go.com/Technology/wireStory/man-parents-kidnapped-after-245m-bitcoin-theft-pleaded-123058427,ABC,Unknown,Technology
239," Billions of login credentials have been leaked online, Cybernews researchers say","Researchers at cybersecurity outlet Cybernews say that billions of login credentials have been leaked and compiled into datasets online, giving cybercriminals &ldquo;unprecedented access&rdquo; to accounts consumers use each day","Fri, 20 Jun 2025 13:46:54 -0400",https://abcnews.go.com/Technology/wireStory/billions-login-credentials-leaked-online-cybernews-researchers-123047090,ABC,United States,Technology
240," Iran's internet blackout leaves public in dark, creates uneven picture of the war","As the war between Israel and Iran hits the one-week mark, Iranians have spent nearly half of the conflict in a near-communication blackout, unable to connect not only with the outside world but also with their neighbors and loved ones across the country","Fri, 20 Jun 2025 07:04:14 -0400",https://abcnews.go.com/Technology/wireStory/irans-internet-blackout-leaves-public-dark-creates-uneven-123032458,ABC,Iran,Technology
241, UK lawmakers to vote on allowing terminally ill adults to end their lives,U.K. lawmakers have backed a bill to allow terminally ill adults in England and Wales to choose to end their lives in a historic vote in Parliament that takes it a step nearer to becoming law,"Fri, 20 Jun 2025 11:02:24 -0400",https://abcnews.go.com/Technology/wireStory/uk-lawmakers-vote-allowing-terminally-ill-adults-end-123030080,ABC,United Kingdom,Technology
242, Sunshine abounds as the summer solstice arrives,Summer gets its official start in the Northern Hemisphere with the arrival of the summer solstice,"Fri, 20 Jun 2025 00:14:27 -0400",https://abcnews.go.com/Technology/wireStory/sunshine-abounds-summer-solstice-arrives-123028711,ABC,Unknown,Technology
243, One Tech Tip: No more lost cats and dogs. Use tech to track your pet,"If your cat likes to prowl outdoors for long stretches, or your dog has a tendency to run off, it can be distressing when they don&rsquo;t return as expected","Thu, 19 Jun 2025 06:14:26 -0400",https://abcnews.go.com/Technology/wireStory/tech-tip-lost-cats-dogs-tech-track-pet-123001430,ABC,United States,Technology
244," Tried and tested in war: For European drone manufacturers, Ukraine is the place to be","For European drone manufacturers, being able to say that their equipment has been tried in war by Ukrainian forces is becoming a sales pitch","Thu, 19 Jun 2025 05:42:20 -0400",https://abcnews.go.com/Technology/wireStory/tested-war-european-drone-manufacturers-ukraine-place-123000537,ABC,United Kingdom,Technology
245," SpaceX rocket being tested in Texas explodes, but no injuries reported","A SpaceX rocket being tested in Texas has exploded, sending a dramatic fireball high into the sky","Thu, 19 Jun 2025 03:06:58 -0400",https://abcnews.go.com/Technology/wireStory/spacex-rocket-tested-texas-explodes-injuries-reported-123000064,ABC,Unknown,Technology
246, Government says Harvard researcher accused of smuggling frog embryos brought 'biological materials',"Attorneys argued over whether a Harvard University researcher accused of smuggling frog embryos brought &ldquo;biological materials&rdquo; into the U.S. Kseniia Petrova, a Russian-born scientist conducting cancer research for Harvard Medical School, appeared in Ma...","Wed, 18 Jun 2025 22:06:19 -0400",https://abcnews.go.com/Technology/wireStory/government-harvard-researcher-accused-smuggling-frog-embryos-brought-122996013,ABC,United States,Technology
247, Amazon begins to ramp up its Zoox robotaxi factory as it gears up to challenge Waymo,"Amazon is gearing up to make as 10,000 robotaxis annually at a sprawling plant near Silicon Valley as it prepares to challenge self-driving cab leader Waymo","Wed, 18 Jun 2025 11:34:40 -0400",https://abcnews.go.com/Technology/wireStory/amazon-begins-ramp-zoox-robotaxi-factory-gears-challenge-122972311,ABC,Brazil,Technology
248, Early humans adapting to extreme habitats set stage for global migration: Researchers,"Humans are the only animal that lives in virtually every possible environment, from rainforests to deserts to tundra","Wed, 18 Jun 2025 11:42:14 -0400",https://abcnews.go.com/Technology/wireStory/early-humans-adapted-extreme-habitats-researchers-set-stage-122971688,ABC,Unknown,Technology
249, This Australian moth uses the stars as a compass to travel hundreds of miles,"A new study finds an Australian moth follows the stars during its yearly migration, using the night sky as a guiding compass","Wed, 18 Jun 2025 11:26:15 -0400",https://abcnews.go.com/Technology/wireStory/australian-moth-stars-compass-travel-hundreds-miles-122971690,ABC,United States,Technology
