title,description,date,url,source,country,category
"Covid was like a daily terror attack, doctor tells inquiry",Covid inquiry hears harrowing testimony from ex-adviser in emergency preparedness at NHS England.,"Thu, 26 Sep 2024 14:06:37 GMT",https://www.bbc.com/news/articles/cz9py388z17o,BBC,United Kingdom,health
Covid inquiry rejects clinicians’ anonymity plea,The UK Health Security Agency argued naming the junior officials could put them at risk of abuse.,"Thu, 26 Sep 2024 00:11:07 GMT",https://www.bbc.com/news/articles/c07n8zp9zp0o,BBC,United Kingdom,health
Calls for more support for endometriosis patients ,A campaign group hosts a special event to raise awareness about how the disease affects women.,"Thu, 19 Jun 2025 05:27:55 GMT",https://www.bbc.com/news/articles/cp3lwjq2x24o,BBC,Unknown,health
Cervical screening changes set to start in Jersey,New testing methods which are more accurate than previous tests lead to the changes.,"Mon, 16 Jun 2025 05:26:44 GMT",https://www.bbc.com/news/articles/ced2dv6531do,BBC,United States,health
Event for chats about menopause and women's health,"The free Wolverhampton session is aimed at showing women what support is available, organisers say.","Mon, 16 Jun 2025 05:26:09 GMT",https://www.bbc.com/news/articles/c3v5qke2xkno,BBC,United States,health
"Wales is UK worst for surgical abortions, says charity","Doctors call it ""astonishing"" Wales is behind Northern Ireland where abortion became legal in 2019.","Sat, 14 Jun 2025 06:21:28 GMT",https://www.bbc.com/news/articles/c9890ld7dmjo,BBC,United Kingdom,health
Menstrual tracking app users cautioned about risks,"Women deserve better than to have their menstrual data treated as consumer data, say researchers.","Wed, 11 Jun 2025 05:20:32 GMT",https://www.bbc.com/news/articles/cgj8eq01vdxo,BBC,United States,health
New nature health scheme aims to boost well-being,"The RSPB, which helped draw up the scheme, says it has been a success in other parts of the UK.","Wed, 28 May 2025 16:49:23 GMT",https://www.bbc.com/news/articles/cgr54r2kky8o,BBC,United Kingdom,health
Horse charity calls on NHS to fund equine services,"Horses for Wellbeing says the funding would see children get help before they ""hit crisis point"".","Thu, 22 May 2025 04:58:16 GMT",https://www.bbc.com/news/articles/cy8d927xllzo,BBC,Unknown,health
Nature festival launched at national Park,"Events included wildlife walks, art sessions and the chance to meet an Exmoor pony. ","Sat, 17 May 2025 13:57:17 GMT",https://www.bbc.com/news/articles/cn5y21yg9l9o,BBC,South Africa,health
Helping on the farm reaps mental health benefits,"Farm Care has ""seen an impact"" on youngsters' mental health on east Surrey farms.","Wed, 14 May 2025 05:43:03 GMT",https://www.bbc.com/news/articles/c9895v7j9q0o,BBC,Unknown,health
Inside Health,James explores the science of a sweet tooth and then gets tips on how to brush like a pro.,"Tue, 15 Apr 2025 09:00:00 GMT",https://www.bbc.co.uk/sounds/play/m0029yy8,BBC,United States,health
Inside Health,James Gallagher and the panel consider if an assisted death can guarantee a peaceful end.,"Tue, 08 Apr 2025 09:00:00 GMT",https://www.bbc.co.uk/sounds/play/m0029q5v,BBC,Unknown,health
Inside Health,James Gallagher and the panel discuss the safeguarding implications of the proposed bill,"Tue, 01 Apr 2025 09:00:00 GMT",https://www.bbc.co.uk/sounds/play/m0029hlk,BBC,United States,health
Inside Health,In the first of our mini-series we discuss who could get an assisted death under the rules,"Tue, 25 Mar 2025 10:00:00 GMT",https://www.bbc.co.uk/sounds/play/m00298nh,BBC,United States,health
Voices from both sides of debate on  assisted dying bill,Protesters gathered outside of parliament as MPs vote on legalising assisted dying,"Fri, 20 Jun 2025 11:32:06 GMT",https://www.bbc.com/news/videos/cm20m4zvee8o,BBC,Unknown,health
Heston: My Life with Bipolar,Chef Heston Blumenthal looks back at how bipolar disorder has impacted his life.,"Thu, 19 Jun 2025 05:00:00 GMT",https://www.bbc.co.uk/iplayer/episode/m0029k2h,BBC,Unknown,health
Iranian missile strikes building in Israel’s Haifa,"This is the moment an Iranian missile struck a building in Israel’s Haifa, seriously injuring several people.","Fri, 20 Jun 2025 14:44:06 +0000",https://www.aljazeera.com/video/newsfeed/2025/6/20/iranian-missile-strikes-building-in-israels-haifa?traffic_source=rss,Al Jazeera,United States,Technology
Has Trump put off joining the Israel-Iran conflict for two weeks?,"Trump appeared to delay US action on Iran for two weeks on Thursday, but is it just a negotiation tactic?","Fri, 20 Jun 2025 14:43:06 +0000",https://www.aljazeera.com/news/2025/6/20/has-trump-put-off-joining-the-israel-iran-conflict-for-two-weeks?traffic_source=rss,Al Jazeera,United States,General
Armenian PM in Turkiye for ‘historic’ visit aimed at normalising ties,Nikol Pashinyan&#039;s visit marks Ankara and Yerevan’s second attempt at reconciliation.,"Fri, 20 Jun 2025 13:45:47 +0000",https://www.aljazeera.com/news/2025/6/20/armenian-pm-in-turkiye-for-historic-visit-aimed-at-normalising-ties?traffic_source=rss,Al Jazeera,Turkey,Technology
"Iran, Israel trade air attacks as conflict enters second week","Iranian nuclear scientist killed, third hospital damaged in Tehran as Israeli defence chief vows more intensified raids.","Fri, 20 Jun 2025 13:45:20 +0000",https://www.aljazeera.com/news/2025/6/20/iran-israel-trade-air-attacks-as-conflict-enters-second-week?traffic_source=rss,Al Jazeera,Iran,Technology
Trump now finds himself “hostage to Netanyahu’s agenda”,"“President Trump can make different decisions, depending on who is talking to him.”","Fri, 20 Jun 2025 13:25:40 +0000",https://www.aljazeera.com/video/quotable/2025/6/20/trump-now-finds-himself-hostage-to-netanyahus?traffic_source=rss,Al Jazeera,United States,General
African manhood is broken – and it’s costing women their lives,"Femicide is surging across the continent. Without cultural reform led by men themselves, more lives will be lost.","Fri, 20 Jun 2025 13:06:41 +0000",https://www.aljazeera.com/opinions/2025/6/20/african-manhood-is-broken-and-its-costing-women-their-lives?traffic_source=rss,Al Jazeera,South Africa,General
Project 2025: Governance reform or Culture War battle plan?,"How has Project 2025 shaped Trump’s second term? Marc Lamont Hill speaks to its former director, Paul Dans.","Fri, 20 Jun 2025 13:00:00 +0000",https://www.aljazeera.com/video/upfront/2025/6/20/project-2025-governance-reform-or-culture-war-battle-plan?traffic_source=rss,Al Jazeera,United States,General
Pro-Palestine activists spray red paint on military plane at UK airbase,Pro-Palestine activists breached security at a UK airbase and vandalised a military plane.,"Fri, 20 Jun 2025 12:54:19 +0000",https://www.aljazeera.com/video/newsfeed/2025/6/20/pro-palestine-activists-spray-red-paint-on-military-plane-at-uk-airbase?traffic_source=rss,Al Jazeera,United Kingdom,Technology
At least 35 killed in new Israeli attack on Gaza aid seekers,Palestinians seeking aid continue to be killed near distribution sites operated by the Gaza Humanitarian Foundation.,"Fri, 20 Jun 2025 12:36:36 +0000",https://www.aljazeera.com/news/2025/6/20/at-least-35-killed-in-new-israeli-attack-on-gaza-aid-seekers?traffic_source=rss,Al Jazeera,Israel,Technology
‘Thithi president!’: Supporters rally for banned Ivorian opposition hopeful,"Tensions are rising in the country ahead of October polls, with many wary of a repeat of election violence seen in 2011.","Fri, 20 Jun 2025 11:25:18 +0000",https://www.aljazeera.com/news/2025/6/20/thithi-president-supporters-rally-for-banned-ivorian-presidential-candidate?traffic_source=rss,Al Jazeera,Unknown,Politics
EU squeezes Russia financially to reach ‘peace through strength’ in Ukraine,"After banning Russian oil in 2022, the EU proposes phasing out Russian gas and maximising profits from Russian assets.","Fri, 20 Jun 2025 11:16:43 +0000",https://www.aljazeera.com/news/2025/6/20/eu-squeezes-russia-financially-to-reach-peace-through-strength-in-ukraine?traffic_source=rss,Al Jazeera,United Kingdom,Technology
Pro-Palestinian activists break into UK military base,Prime Minister Keir Starmer condemns &#039;vandalism&#039; after activists spray red paint into engines of two Voyager planes.,"Fri, 20 Jun 2025 10:58:19 +0000",https://www.aljazeera.com/news/2025/6/20/pro-palestinian-activists-break-into-uk-military-base?traffic_source=rss,Al Jazeera,United Kingdom,Technology
Is Trump planning an ‘Africa visa ban’?,African countries make up the bulk of a list of countries that could face new visa bans from August.,"Fri, 20 Jun 2025 10:58:07 +0000",https://www.aljazeera.com/news/2025/6/20/is-trump-planning-an-africa-visa-ban?traffic_source=rss,Al Jazeera,United States,Politics
Fires and destruction after Iranian attack in southern Israel,Iranian missiles struck Beersheba in southern Israel for the second consecutive day. ,"Fri, 20 Jun 2025 10:46:16 +0000",https://www.aljazeera.com/video/newsfeed/2025/6/20/fires-and-destruction-after-iranian-attack-in-southern-israel?traffic_source=rss,Al Jazeera,Iran,General
See inside newly found smuggling tunnel under Mexico-US border,Mexican security forces have uncovered a secret tunnel under the US border that they say was used to transport drugs.,"Fri, 20 Jun 2025 10:46:06 +0000",https://www.aljazeera.com/video/newsfeed/2025/6/20/see-inside-newly-found-smuggling-tunnel-under-mexico-us-border?traffic_source=rss,Al Jazeera,United States,Politics
US appeals court rules Trump can keep control of California National Guard,"President Donald Trump hails decision as &#039;big win&#039;, but Governor Gavin Newsom vows to pursue legal challenge.","Fri, 20 Jun 2025 09:55:19 +0000",https://www.aljazeera.com/news/2025/6/20/us-appeals-court-rules-trump-can-keep-control-of-california-national-guard?traffic_source=rss,Al Jazeera,United States,Technology
US police use tear gas on protesters at immigration facility,Police in the US city of Portland used tear gas and stun grenades to disperse protesters outside an ICE building.,"Fri, 20 Jun 2025 09:07:52 +0000",https://www.aljazeera.com/video/newsfeed/2025/6/20/us-police-use-tear-gas-on-protesters-at-immigration-facility?traffic_source=rss,Al Jazeera,United States,Politics
Taiwan detects dozens of Chinese aircraft near island after UK ship patrol,Taipei says an estimated 15 Chinese aircraft crossed the median line of the Taiwan Strait on Friday.,"Fri, 20 Jun 2025 09:02:30 +0000",https://www.aljazeera.com/news/2025/6/20/taiwan-detects-dozens-of-chinese-aircraft-near-island-after-uk-ship-patrol?traffic_source=rss,Al Jazeera,United Kingdom,Technology
Israel again included in UN blacklist for grave violations against children,"Violence against children in conflicts hit &#039;unprecedented levels&#039; in 2024, with most abuses committed in Gaza, UN says.","Fri, 20 Jun 2025 08:48:00 +0000",https://www.aljazeera.com/news/2025/6/20/israel-again-included-in-un-blacklist-for-grave-violations-against-children?traffic_source=rss,Al Jazeera,United States,Technology
Botafogo upset PSG 1-0 at FIFA Club World Cup,Igor Jesus&#039; 36th minute goal was enough for Botafago to defeat the Europeans champions PSG at the Rose Bowl in LA.,"Fri, 20 Jun 2025 08:37:47 +0000",https://www.aljazeera.com/sports/2025/6/20/botafogo-upset-ucl-champs-psg-at-fifa-club-world-cup?traffic_source=rss,Al Jazeera,United States,Sports
"Iran, European officials to hold first meeting since Israel conflict began","Iran, UK, Germany, France and EU foreign ministers to meet in bid to avoid further escalation between Israel and Iran.","Fri, 20 Jun 2025 08:26:27 +0000",https://www.aljazeera.com/news/2025/6/20/iran-europe-set-for-first-talks-since-israel-launched-attacks-on-tehran?traffic_source=rss,Al Jazeera,United Kingdom,General
A simple visual guide to Iran and its people,"With a population of 92 million, Iran is the 17-th largest country in the world by population and land area.","Fri, 20 Jun 2025 08:14:22 +0000",https://www.aljazeera.com/news/2025/6/20/a-simple-visual-guide-to-iran-and-its-people?traffic_source=rss,Al Jazeera,Iran,Politics
"Russia-Ukraine war: List of key events, day 1,212","Here are the key events on day 1,212 of Russia’s war on Ukraine.","Fri, 20 Jun 2025 07:49:32 +0000",https://www.aljazeera.com/news/2025/6/20/russia-ukraine-war-list-of-key-events-day-1212?traffic_source=rss,Al Jazeera,United Kingdom,Technology
Are Israel’s attacks against Iran legal?,International law proscribes the use of force except in self-defence - but what constitutes self-defence?,"Fri, 20 Jun 2025 07:47:19 +0000",https://www.aljazeera.com/news/2025/6/20/are-israels-attacks-against-iran-legal?traffic_source=rss,Al Jazeera,United States,Technology
Pacers vs Thunder: Indiana defeats OKC in Game 6 of the NBA Finals,Indiana Pacers dominate Oklahoma City Thunder to push NBA Finals to a decisive Game 7 for the first time in nine years.,"Fri, 20 Jun 2025 07:36:44 +0000",https://www.aljazeera.com/sports/2025/6/20/pacers-vs-thunder-indiana-defeats-okc-in-game-6-of-the-nba-finals?traffic_source=rss,Al Jazeera,United States,Politics
 Israel-Iran live updates: Israel strikes 3rd hospital in Iran,"The U.S. did not provide any military assistance or have any involvement in Israel's Friday strike, a U.S. official told ABC News.","Fri, 20 Jun 2025 09:59:13 -0400",https://abcnews.go.com/International/live-updates/israel-iran-live-updates/?id=122881565,ABC,South Africa,Health
LIVE:  ABC News Live,24/7 coverage of breaking news and live events,"Wed, 18 Jun 2025 16:08:51 -0400",https://abcnews.go.com/Live/video/abcnews-live-41463246,ABC,Unknown,General
 Alleged trespasser at Memphis mayor's home charged with attempted kidnapping,"The suspect was apprehended and charged after police investigated ""suspicious activity"" in Mayor Paul Young's neighborhood, the Memphis Police Department said Wednesday.","Fri, 20 Jun 2025 10:48:43 -0400",https://abcnews.go.com/US/memphis-mayor-home-alleged-trespasser-attempted-kidnapping/story?id=123014102,ABC,United States,Technology
 Singer Chris Brown pleads not guilty to London nightclub assault,Singer Chris Brown has pleaded not guilty in London after being charged in a serious assault at a London nightclub two years ago.,"Fri, 20 Jun 2025 09:49:31 -0400",https://abcnews.go.com/International/singer-chris-brown-pleads-guilty-london-nightclub-assault/story?id=123031882,ABC,United Kingdom,General
WATCH:  ‘I’m pretty lucky’: Teen struck by lightning as thunderstorms hit Northeast,"In New York City, a teenager was struck by lightning in Central Park Thursday afternoon, police said. The boy is alert and conscious, police said.","Fri, 20 Jun 2025 08:52:15 -0400",https://abcnews.go.com/US/video/im-pretty-lucky-teen-struck-lightning-thunderstorms-hit-123036563,ABC,United States,Technology
WATCH:  Beyoncé brings out Miley Cyrus during ‘Cowboy Carter’ stop in Paris,Cyrus rose up onto the Stade de France stage to perform the Grammy-winning duet “2 Most Wanted” with Beyoncé on Thursday night,"Fri, 20 Jun 2025 10:43:47 -0400",https://abcnews.go.com/GMA/Culture/video/beyonc-brings-miley-cyrus-cowboy-carter-stop-paris-123033993,ABC,United States,General
WATCH:  Mother meets boy with late son’s heart in emotional gathering,"Kaci Wilson’s son, Myles Godfrey, died from brain injuries sustained in a car accident. His organs saved the lives of multiple children, including 7-year-old Saleh Ahmad.","Fri, 20 Jun 2025 07:15:30 -0400",https://abcnews.go.com/US/video/mother-meets-boy-late-sons-heart-123032364,ABC,United States,Technology
WATCH:  Congressman nearly ‘run off road’ raises political violence concerns,"Rep. Max Miller, R-Ohio, said he was ""run off the road"" by a driver with a Palestinian flag, amid a disturbing increase in political violence nationwide.","Fri, 20 Jun 2025 06:54:23 -0400",https://abcnews.go.com/Politics/video/congressman-run-off-road-raises-political-violence-concerns-123032251,ABC,Unknown,Technology
WATCH:  Terrifying moment silverback gorilla charges toward trekkers in Uganda,"""This was a rare occurrence and no one, gorilla or human, got hurt,"" the wildlife conservationist who shot the video said.","Thu, 19 Jun 2025 11:02:46 -0400",https://abcnews.go.com/International/video/terrifying-moment-silverback-gorilla-charges-trekkers-uganda-123011406,ABC,Unknown,Technology
WATCH:  Why every American should celebrate Juneteenth,"Darrin Anderson, CEO of the Urban League of Greater Philadelphia, discusses the importance of the holiday, and how people can celebrate.","Thu, 19 Jun 2025 10:48:33 -0400",https://abcnews.go.com/US/video/american-celebrate-juneteenth-123010417,ABC,United States,Politics
WATCH:  SpaceX Starship explodes in huge fireball,A SpaceX Starship rocket being tested in Texas exploded after the craft “experienced a major anomaly.”,"Thu, 19 Jun 2025 07:41:15 -0400",https://abcnews.go.com/Technology/video/spacex-starship-explodes-huge-fireball-123003758,ABC,Unknown,General
WATCH:  Dallas Cowboys cheerleaders get 400% raise,Sam Champion reports the buzziest news of the day in “GMA” Pop News.,"Thu, 19 Jun 2025 10:51:25 -0400",https://abcnews.go.com/GMA/Culture/video/dallas-cowboys-cheerleaders-400-raise-123005533,ABC,Unknown,Technology
"WATCH:  How ‘Jaws’ changed movies, beach visits",An upcoming National Geographic documentary takes viewers behind the scenes of “Jaws” and looks at the movie’s cultural legacy on its 50th anniversary.,"Thu, 19 Jun 2025 11:27:08 -0400",https://abcnews.go.com/GMA/Culture/video/jaws-movies-beach-visits-123004949,ABC,Unknown,General
WATCH:  Daughter surprises dad on wedding day with recording of great grandfather singing,David Muir reports on the woman who found an old recording of her great grandfather singing decided to save the music for just the right moment – years later during her father-daughter dance.,"Wed, 18 Jun 2025 20:42:58 -0400",https://abcnews.go.com/WNT/video/daughter-surprises-dad-wedding-day-recording-great-grandfather-122990442,ABC,United States,Politics
WATCH:   The story behind the viral video of the graduation walk of a lifetime,Zoey Ngu was born with “bones like glass” and risked fractures with every step she took across the stage for her high school graduation.,"Wed, 18 Jun 2025 16:25:08 -0400",https://abcnews.go.com/GMA/Living/video/story-viral-video-graduation-walk-lifetime-122985751,ABC,Unknown,General
WATCH:  Raccoon rescues young cub,"A couple in Franklin, Pennsylvania captured video of a mother raccoon, hanging from her back paws and pulling her kit to safety.","Wed, 18 Jun 2025 11:45:07 -0400",https://abcnews.go.com/GMA/News/video/raccoon-rescues-young-cub-122962323,ABC,Unknown,Politics
 White House says Iran could produce a nuclear weapon in 'a couple of weeks',"The White House says Iran has all it needed to produce a nuclear weapon in ""a couple of weeks"" once given the go-ahead from Ayatollah Ali Khamenei.","Thu, 19 Jun 2025 18:31:19 -0400",https://abcnews.go.com/Politics/iran-produce-nuclear-weapon-couple-weeks-white-house/story?id=123016638,ABC,United States,General
" Bombing Iran's underground nuclear plant might not be effective, one expert says","A U.S. attack on Iran's key underground nuclear facility would not be a guaranteed success, according to a national security expert.","Fri, 20 Jun 2025 07:40:12 -0400",https://abcnews.go.com/Politics/bombing-irans-underground-fordo-nuclear-plant-effective-expert/story?id=123013773,ABC,Iran,Politics
 Trump vowed to be a 'peacemaker' but foreign conflicts only ramping up on his watch,"President Trump said he wanted his legacy to be that of a ""peacemaker and a unifier."" Six months into his term, conflicts are raging on three fronts.","Thu, 19 Jun 2025 05:56:54 -0400",https://abcnews.go.com/Politics/trump-vowed-peacemaker-foreign-conflicts-ramping-watch/story?id=122937241,ABC,United States,Technology
 Trump admin live updates: Appeals court keeps Calif. National Guard in Trump's hands,President Donald Trump called up the guard amid protests in Los Angeles over immigration raids.,"Fri, 20 Jun 2025 10:46:36 -0400",https://abcnews.go.com/Politics/live-updates/trump-admin-live-updates/?id=122881881,ABC,United States,Technology
 How Black conservative leaders aim to build the next generation in Washington,"The Black Conservative Federation is launching a two-day summit in Washington, D.C., next month aimed at uniting and elevating Black conservatives.","Thu, 19 Jun 2025 22:32:37 -0400",https://abcnews.go.com/Politics/black-conservative-leaders-aim-build-generation-washington/story?id=123024284,ABC,United States,Technology
 ICE raids and their uncertainty scare off workers and baffle businesses,"Farmers, cattle ranchers and hotel and restaurant managers breathed a sigh of relief last week when President Donald Trump ordered a pause to immigration raids that were disrupting those industries and scaring foreign-born workers off the job","Thu, 19 Jun 2025 06:30:16 -0400",https://abcnews.go.com/Politics/wireStory/ice-raids-uncertainty-scare-off-workers-baffle-businesses-123002025,ABC,United States,Technology
 Trump threats to withdraw from Ukraine war could imperil 30% of Kyiv's weapons,President Donald Trump -- clearly frustrated by the failure of his diplomatic efforts to date -- has raised the prospect of entirely abandoning American engagement.,"Thu, 19 Jun 2025 05:41:24 -0400",https://abcnews.go.com/International/trumps-threats-abandon-ukraine-war-pose-battlefield-conundrums/story?id=122624970,ABC,United Kingdom,Technology
 'Any illegal immigrants?' Trump questions workers installing White House flagpoles,"The president's comments came as workers erected two 88-foot-tall flagpoles, one on the North Lawn and one on the South Lawn, at the White House on Wednesday.","Thu, 19 Jun 2025 05:57:07 -0400",https://abcnews.go.com/US/illegal-immigrants-trump-questions-workers-installing-white-house/story?id=122996015,ABC,United States,Politics
 Authorities investigating pizzas anonymously sent to lawmakers: Sources,"Anonymous pizza deliveries have lawmakers worried and are stoking fears of potential attacks, sources tell ABC News.","Thu, 19 Jun 2025 05:54:33 -0400",https://abcnews.go.com/Politics/authorities-investigating-pizzas-anonymously-lawmakers-us-capitol-police/story?id=122987993,ABC,United States,Politics
" Iran's internet blackout leaves public in dark, creates uneven picture of the war","As the war between Israel and Iran hits the one-week mark, Iranians have spent nearly half of the conflict in a near-communication blackout, unable to connect not only with the outside world but also with their neighbors and loved ones across the country","Fri, 20 Jun 2025 07:04:14 -0400",https://abcnews.go.com/Technology/wireStory/irans-internet-blackout-leaves-public-dark-creates-uneven-123032458,ABC,Iran,Technology
 UK lawmakers to vote on allowing terminally ill adults to end their lives,British lawmakers are set to vote on whether to back a bill to help terminally ill adults end their lives in England and Wales,"Fri, 20 Jun 2025 05:15:47 -0400",https://abcnews.go.com/Technology/wireStory/uk-lawmakers-vote-allowing-terminally-ill-adults-end-123030080,ABC,United Kingdom,Technology
 Sunshine abounds as the summer solstice arrives,Summer gets its official start in the Northern Hemisphere with the arrival of the summer solstice,"Fri, 20 Jun 2025 00:14:27 -0400",https://abcnews.go.com/Technology/wireStory/sunshine-abounds-summer-solstice-arrives-123028711,ABC,Unknown,Technology
 One Tech Tip: No more lost cats and dogs. Use tech to track your pet,"If your cat likes to prowl outdoors for long stretches, or your dog has a tendency to run off, it can be distressing when they don&rsquo;t return as expected","Thu, 19 Jun 2025 06:14:26 -0400",https://abcnews.go.com/Technology/wireStory/tech-tip-lost-cats-dogs-tech-track-pet-123001430,ABC,United States,Technology
" Tried and tested in war: For European drone manufacturers, Ukraine is the place to be","For European drone manufacturers, being able to say that their equipment has been tried in war by Ukrainian forces is becoming a sales pitch","Thu, 19 Jun 2025 05:42:20 -0400",https://abcnews.go.com/Technology/wireStory/tested-war-european-drone-manufacturers-ukraine-place-123000537,ABC,United Kingdom,Technology
" SpaceX rocket being tested in Texas explodes, but no injuries reported","A SpaceX rocket being tested in Texas has exploded, sending a dramatic fireball high into the sky","Thu, 19 Jun 2025 03:06:58 -0400",https://abcnews.go.com/Technology/wireStory/spacex-rocket-tested-texas-explodes-injuries-reported-123000064,ABC,Unknown,Technology
 Government says Harvard researcher accused of smuggling frog embryos brought 'biological materials',"Attorneys argued over whether a Harvard University researcher accused of smuggling frog embryos brought &ldquo;biological materials&rdquo; into the U.S. Kseniia Petrova, a Russian-born scientist conducting cancer research for Harvard Medical School, appeared in Ma...","Wed, 18 Jun 2025 22:06:19 -0400",https://abcnews.go.com/Technology/wireStory/government-harvard-researcher-accused-smuggling-frog-embryos-brought-122996013,ABC,United States,Technology
 Amazon begins to ramp up its Zoox robotaxi factory as it gears up to challenge Waymo,"Amazon is gearing up to make as 10,000 robotaxis annually at a sprawling plant near Silicon Valley as it prepares to challenge self-driving cab leader Waymo","Wed, 18 Jun 2025 11:34:40 -0400",https://abcnews.go.com/Technology/wireStory/amazon-begins-ramp-zoox-robotaxi-factory-gears-challenge-122972311,ABC,Brazil,Technology
