title,description,date,url,source,country,category
 Early humans adapting to extreme habitats set stage for global migration: Researchers,"Humans are the only animal that lives in virtually every possible environment, from rainforests to deserts to tundra","Wed, 18 Jun 2025 11:42:14 -0400",https://abcnews.go.com/Technology/wireStory/early-humans-adapted-extreme-habitats-researchers-set-stage-122971688,ABC,Unknown,Technology
 This Australian moth uses the stars as a compass to travel hundreds of miles,"A new study finds an Australian moth follows the stars during its yearly migration, using the night sky as a guiding compass","Wed, 18 Jun 2025 11:26:15 -0400",https://abcnews.go.com/Technology/wireStory/australian-moth-stars-compass-travel-hundreds-miles-122971690,ABC,United States,Technology
 Astronomers create dazzling map of nearby galaxy in thousands of colors,"Astronomers have revealed a nearby spiral galaxy in all its brilliant glory, shining in thousands of colors","Wed, 18 Jun 2025 13:42:17 -0400",https://abcnews.go.com/Technology/wireStory/astronomers-create-dazzling-elaborate-map-nearby-galaxy-thousands-122962932,ABC,United States,Technology
 Volcanic eruption in Indonesia forces evacuations and flight cancelations,"Indonesia&rsquo;s Mount Lewotobi Laki Laki has erupted with giant ash and smoke plumes again after forcing evacuations of villages and flight cancelations, including to and from the resort island of Bali","Wed, 18 Jun 2025 02:47:11 -0400",https://abcnews.go.com/Technology/wireStory/volcanic-eruption-indonesia-forces-evacuations-flight-cancelations-122957765,ABC,South Africa,Technology
 Musk's X sues New York over requirement to show how social media platforms handle problematic posts,Elon Musk&rsquo;s X has sued to try to stop New York from requiring reports on how social media platforms define and handle problematic posts,"Tue, 17 Jun 2025 18:46:29 -0400",https://abcnews.go.com/Technology/wireStory/musks-sues-new-york-requirement-show-social-media-122950444,ABC,United States,Technology
 Senate Republicans double down and target clean energy in draft tax bill,A proposal by Senate Republicans would adjust the pace at which some crucial home energy efficiency and electric vehicle tax credits are phased out in timelines different from what House Republicans proposed in the multitrillion-dollar tax bill they pa...,"Tue, 17 Jun 2025 20:30:29 -0400",https://abcnews.go.com/Technology/wireStory/senate-republicans-double-target-clean-energy-draft-tax-122942601,ABC,United States,Technology
 Iran asks its people to delete WhatsApp from their devices,"Iranian state television has urged people to remove WhatsApp from their smart phones, alleging without specific evidence that the messaging app gathered user information to send to Israel","Tue, 17 Jun 2025 22:06:21 -0400",https://abcnews.go.com/Technology/wireStory/iran-asks-people-delete-whatsapp-devices-122941626,ABC,United States,Technology
 Eruption of Indonesia's Mount Lewotobi Laki Laki volcano creates ash plume visible 90 miles away,"Mount Lewotobi Laki Laki volcano in south-central Indonesia has erupted, spewing towering columns of hot ash","Wed, 18 Jun 2025 00:06:16 -0400",https://abcnews.go.com/Technology/wireStory/eruption-indonesias-mount-lewotobi-laki-laki-volcano-creates-122952933,ABC,Indonesia,Technology
 Danish military using robotic sailboats for surveillance in Baltic and North seas,Four uncrewed robotic sailboats known as &ldquo;Voyagers&rdquo; have been put into service by the Danish Armed Forces for a three-month trial,"Tue, 17 Jun 2025 06:54:20 -0400",https://abcnews.go.com/Technology/wireStory/danish-military-robotic-sailboats-surveillance-baltic-north-seas-122892796,ABC,United States,Technology
 WhatsApp to start showing ads to users in some parts of the messaging app,"WhatsApp says that users will start seeing ads in some parts of the app, as owner Meta Platforms moves to a cultivate a new revenue stream by tapping the billions of people that use the messaging service","Mon, 16 Jun 2025 11:12:53 -0400",https://abcnews.go.com/Technology/wireStory/whatsapp-start-showing-ads-users-parts-messaging-app-122891842,ABC,United States,Technology
 How two satellites are mimicking total solar eclipses in space,A pair of European satellites have created the first artificial solar eclipses through precise and fancy formation flying,"Mon, 16 Jun 2025 10:38:36 -0400",https://abcnews.go.com/Technology/wireStory/satellites-mimicking-total-solar-eclipses-space-122891224,ABC,South Africa,Technology
" Trump family announces another venture, a mobile phone company","The Trump family company says it's launching a mobile phone company, the latest in a string of ventures that have been announced while Donald Trump is in the White House","Mon, 16 Jun 2025 09:17:20 -0400",https://abcnews.go.com/Technology/wireStory/trump-family-announces-venture-mobile-phone-company-122887548,ABC,United States,Technology
 How Prime Video's 'Burn Bar' is changing the way we watch NASCAR,"NASCAR fans have grown accustomed to seeing speed, throttle and braking on broadcasts for years","Sat, 14 Jun 2025 06:30:26 -0400",https://abcnews.go.com/Technology/wireStory/prime-videos-burn-bar-changing-watch-nascar-122839816,ABC,United States,Technology
" Republican enthusiasm for Musk cools after his feud with Trump, a new poll finds",A new poll finds Elon Musk has lost some of his luster with Republicans since his public falling-out with President Donald Trump,"Fri, 13 Jun 2025 08:02:03 -0400",https://abcnews.go.com/Technology/wireStory/republican-enthusiasm-musk-cools-after-feud-trump-new-122807132,ABC,United States,Technology
 Meta invests in AI firm Scale and recruits its CEO for 'superintelligence' team,Meta is making a $14.3 billion investment in artificial intelligence company Scale and recruiting its CEO Alexandr Wang to join a team developing &ldquo;superintelligence&rdquo; at the tech giant,"Thu, 12 Jun 2025 22:34:59 -0400",https://abcnews.go.com/Technology/wireStory/meta-invests-143b-ai-firm-scale-recruits-ceo-122799843,ABC,Unknown,Technology
" Shooting on Las Vegas Strip near Bellagio that killed 2 was livestreamed, police say",A new police report released Thursday says two people killed in a shooting over the weekend on the Las Vegas Strip captured it on video while livestreaming to their shared YouTube channel,"Fri, 13 Jun 2025 06:55:23 -0400",https://abcnews.go.com/Technology/wireStory/shooting-las-vegas-strip-bellagio-killed-2-livestreamed-122797764,ABC,Unknown,Technology
" Space station leak concerns will delay visit by astronauts from India, Poland and Hungary","A chartered spaceflight for India, Poland and Hungary's first astronauts in decades has been delayed indefinitely because of leak concerns at the International Space Station","Thu, 12 Jun 2025 11:18:35 -0400",https://abcnews.go.com/Technology/wireStory/space-station-leak-concerns-delay-visit-astronauts-india-122776609,ABC,United States,Technology
