id,title,description,date,url,source,country,category
84,1 in 5 Indigenous people reported discrimination or racism in health care. This clinic offers an alternative,A new clinic in Montreal aims to close gaps in care for Indigenous patients and help overcome their patients' deep-rooted mistrust in the health-care system. Staff say the clinic is a sign there's been some progress on the Truth and Reconciliation Commission's calls to action.,"Sat, 21 Jun 2025 04:00:09 EDT",https://www.cbc.ca/news/health/montreal-clinic-1.7567251?cmp=rss,CBC,United States,Technology
85,"Ukraine still holds ground inside Russia's Kursk, commander says",Commander-in-chief Oleksandr Syrsky disputed Russian claims that Ukraine had been pushed out of Kursk.,"Sun, 22 Jun 2025 08:53:33 GMT",https://www.bbc.com/news/articles/cvgepevvn47o,BBC,United Kingdom,International
86,Israel says it killed Iran's military co-ordinator with Hamas,Saeed Izadi had been in charge of the Iranian Revolutionary Guards Corps's ties with Palestinian armed groups.,"Sat, 21 Jun 2025 13:20:24 GMT",https://www.bbc.com/news/articles/cn9yxrxwzzzo,BBC,Iran,International
87,Hot air balloon incident kills eight in Brazil,"Police say a fire reportedly broke out aboard the balloon, prompting the pilot to try to lower it.    ","Sat, 21 Jun 2025 23:26:02 GMT",https://www.bbc.com/news/articles/c17w04wxwpxo,BBC,Brazil,International
88,Belarus opposition leader's husband freed from prison,"Sergei Tikhanovsky had planned to challenge Alexander Lukashenko in the 2020 election, but was detained before the vote.","Sat, 21 Jun 2025 20:30:56 GMT",https://www.bbc.com/news/articles/c9397rrkwedo,BBC,United Kingdom,International
89,Rosenberg: Russian government clearly nervous as country faces economic challenges,"Russian minister Maxim Reshetnikov has warned that the country's economy was teetering ""on the brink of recession"".","Sat, 21 Jun 2025 20:45:21 GMT",https://www.bbc.com/news/articles/cdr30jx6x0vo,BBC,United States,International
90,Panama declares emergency over banana region unrest,Constitutional rights are suspended for five days in the Bocas del Toro province after mass looting.,"Sat, 21 Jun 2025 00:12:28 GMT",https://www.bbc.com/news/articles/cql0r430qglo,BBC,United States,International
91,Armani to miss Milan Fashion Week for first time after hospital stay,"The 90-year-old Italian designer is recovering at home after a hospital stay, his company reports.","Sat, 21 Jun 2025 07:27:34 GMT",https://www.bbc.com/news/articles/cx2k8dynrr0o,BBC,Italy,International
92,Zambian ex-president to be buried in South Africa after funeral row,Edgar Lungu's family has been engaged in a bitter dispute with the government over his funeral plans.,"Fri, 20 Jun 2025 13:44:18 GMT",https://www.bbc.com/news/articles/cy8k7x32z1eo,BBC,South Africa,International
93,Tristan Tate faces probe over alleged Romanian election interference,"Tate, 36, is the younger brother of controversial influencer Andrew Tate.","Fri, 20 Jun 2025 20:31:54 GMT",https://www.bbc.com/news/articles/cdez7r0dgy7o,BBC,Unknown,International
94,'Everyone is scared': Iranians head to Armenia to escape conflict with Israel,"Some said they had seen the sites of Israeli bombardment, others said they had heard the sound of explosions.","Fri, 20 Jun 2025 15:49:10 GMT",https://www.bbc.com/news/articles/c4ge7ej6824o,BBC,Iran,International
95,Two butchers closed after girl dies in French food poisoning outbreak,Eight children have been admitted to hospital as officials investigate the root of the outbreak.,"Fri, 20 Jun 2025 08:58:24 GMT",https://www.bbc.com/news/articles/cql0rd407zwo,BBC,France,International
96,India to decide on overseas analysis of Air India crash flight recorders ,Media reports in India have suggested that the flight's recorders will be sent overseas for analysis.,"Fri, 20 Jun 2025 06:09:27 GMT",https://www.bbc.com/news/articles/clyn2227jlyo,BBC,India,International
97,BBC shelves Gaza doc over impartiality concerns,"Gaza: Doctors Under Attack, which was due to air in February, was made by an independent company.","Fri, 20 Jun 2025 13:49:02 GMT",https://www.bbc.com/news/articles/crenz9d3181o,BBC,Israel,International
98,China criticises UK warship's patrol in Taiwan Strait,"China said the HMS Spey's transit ""undermines peace and stability"" in the region.","Fri, 20 Jun 2025 04:57:53 GMT",https://www.bbc.com/news/articles/ckg3rrz94nzo,BBC,United Kingdom,International
99,Niger military leaders to nationalise uranium firm,"The company is majority French-owned, while the junta wants more local control of Niger's mineral wealth.","Fri, 20 Jun 2025 16:02:50 GMT",https://www.bbc.com/news/articles/cdx5v2x8yejo,BBC,Myanmar,International
100,Search for 34 missing cockfighting gamblers points to volcanic lake,Filipino authorities are studying a new lead in a case that gripped the nation.,"Fri, 20 Jun 2025 07:20:11 GMT",https://www.bbc.com/news/articles/cwyq1149w94o,BBC,Philippines,International
101,US basketball training for Senegal cancelled after visas rejected,"Players will train in Dakar instead ""in a sovereign and conducive setting"", says the prime minister.","Fri, 20 Jun 2025 14:40:34 GMT",https://www.bbc.com/news/articles/cwyq1evnd0go,BBC,United States,International
102,Mexico begins clean-up after hurricane Erick hits southern coast,"Category 3 storm causes power cuts, some damage and floods, with forecasters predicting it will dissipate by Friday.","Thu, 19 Jun 2025 12:19:26 GMT",https://www.bbc.com/news/articles/cvg9wprprxyo,BBC,United States,International
103,Nobody can stop talking about the self-styled knight giving away cars,"Some are beguiled by the Zimbabwean tycoon's generosity, others alarmed about the source of his wealth.","Sun, 22 Jun 2025 01:31:32 GMT",https://www.bbc.com/news/articles/cn81ynyjy8no,BBC,Unknown,International
104,"For 50 years, Sydney Opera House has had one man on speed dial",Terry Harper has been tuning pianos in the iconic venue since he was a teen - a family legacy started by his dad.,"Sat, 21 Jun 2025 21:20:36 GMT",https://www.bbc.com/news/articles/ckg6zzxq3v2o,BBC,United States,International
105,When Dubai almost became a part of India ,"It's now largely forgotten that in the early 1900s, nearly a third of the Arabian Peninsula was under British India.","Sat, 21 Jun 2025 21:25:32 GMT",https://www.bbc.com/news/articles/cgq3wlp22j9o,BBC,United Kingdom,International
106,Giant Michael Jackson statues popped up 30 years ago. Where have they gone?,"The King Of Pop had 10 statues made in his image in 1995, but where can they be seen three decade later?","Sat, 21 Jun 2025 23:35:37 GMT",https://www.bbc.com/news/articles/cn0q2krypkro,BBC,Unknown,International
107,The presidential feud that even death couldn't end,What should have been a time for Zambia to come together has exposed old enmities.,"Fri, 20 Jun 2025 23:54:08 GMT",https://www.bbc.com/news/articles/c86gqjv2zjdo,BBC,Unknown,International
108,Israel-Iran conflict unleashes wave of AI disinformation,"Fake AI videos relating to the conflict have gained over 100 million views online, BBC Verify finds. ","Fri, 20 Jun 2025 23:43:19 GMT",https://www.bbc.com/news/articles/c0k78715enxo,BBC,Iran,International
109,China has millions of single men - could dating camp help them find love?,The film The Dating Game explores how a dating coach tries to help China's single men find love. ,"Fri, 20 Jun 2025 21:11:06 GMT",https://www.bbc.com/news/articles/c1e0p9eg6gyo,BBC,China,International
110,Watch: Sunken British superyacht raised from seabed,"The cause of the sinking, which killed seven of the 22 people onboard, is still under investigation.","Fri, 20 Jun 2025 17:54:37 GMT",https://www.bbc.com/news/videos/c74zl9eleezo,BBC,United Kingdom,International
111,Hurricane Erick hits Mexico resort towns killing two,Video shows communities in the affected areas dealing with flood waters and a messy clean-up.,"Fri, 20 Jun 2025 17:47:42 GMT",https://www.bbc.com/news/videos/cy4yn04g783o,BBC,Mexico,International
112,Watch: Man gets stuck driving car down Rome's Spanish Steps,"The 81-year-old man and his car got stuck on the way down, before a crane lifted the car away.","Thu, 19 Jun 2025 23:01:23 GMT",https://www.bbc.com/news/videos/c70rw09z6z2o,BBC,Italy,International
113,Watch Indonesian volcano spew ash over 11km into the sky,The twin-peaked Lewotobi Laki-Laki volcano erupted on Tuesday creating a vast plume.,"Wed, 18 Jun 2025 06:16:44 GMT",https://www.bbc.com/news/videos/c0rvwrqgqljo,BBC,Indonesia,International
114,Stop telling me to lower my cortisol - it's making me stressed!,Can social media hacks really help bring down your cortisol levels?,"Sat, 21 Jun 2025 23:30:41 GMT",https://www.bbc.com/news/articles/cg5z6l19rv6o,BBC,Unknown,health
115,Leeds maternity units downgraded to 'inadequate',Trust told to take immediate action to improve after unannounced inspections prompted by parent concerns.,"Thu, 19 Jun 2025 23:46:20 GMT",https://www.bbc.com/news/articles/cdx5rp4y42yo,BBC,United States,health
116,'I was poisoned by fake Botox' ,In recent weeks 28 cases of botulism caused by fake Botox are recorded in the north-east of England.,"Fri, 20 Jun 2025 05:03:29 GMT",https://www.bbc.com/news/articles/cn0q2z725llo,BBC,United Kingdom,health
117,Breakthrough Alzheimer's drugs too pricey for NHS,"Two breakthrough Alzheimer's drugs cost too much and have too little benefit for NHS use, review finds. ","Wed, 18 Jun 2025 23:57:48 GMT",https://www.bbc.com/news/articles/cq8zxx9kk0ko,BBC,United States,health
118,British woman dies from rabies after puppy scratch,"Yvonne Ford had light contact with the stray dog while on holiday in Morocco, her family says.","Wed, 18 Jun 2025 16:36:36 GMT",https://www.bbc.com/news/articles/c98wyllp170o,BBC,United Kingdom,health
119,What does hot weather do to the body?,"Hot weather during the summer can affect anyone, but some people run a greater risk of serious harm.","Thu, 19 Jun 2025 07:44:08 GMT",https://www.bbc.com/news/articles/cy7n6m7y6yvo,BBC,United States,health
120,Why are pollen levels making hay fever so bad this year?,"As pollen levels rise, what are the best ways to treat hay fever symptoms, and other useful advice.","Tue, 17 Jun 2025 09:17:40 GMT",https://www.bbc.com/news/articles/cx2jevn2d1eo,BBC,United States,health
121,What to do if you think someone has heat exhaustion or heatstroke,Know the signs and what to do if someone is unwell in hot weather.,"Thu, 19 Jun 2025 07:54:12 GMT",https://www.bbc.com/news/articles/ckgl51jjp3jo,BBC,United States,health
122,Hot weather: How to sleep in the heat,Simple tips to help you get a good night's sleep during hot weather. ,"Thu, 19 Jun 2025 07:38:09 GMT",https://www.bbc.com/news/articles/cpw7gp2ky70o,BBC,Unknown,health
123,Six ways to keep your home and yourself cool in hot weather,Six simple things you can do to help keep your house cool when temperatures rise. ,"Thu, 19 Jun 2025 14:09:28 GMT",https://www.bbc.com/news/articles/cz6gxe61p70o,BBC,United States,health
124,Why today's assisted dying vote is so significant,The debate around assisted dying has been a polarised one - and there are still hurdles to cross before it will be a reality here.,"Fri, 20 Jun 2025 15:11:29 GMT",https://www.bbc.com/news/articles/c79qzdpl144o,BBC,Unknown,health
125,MPs vote to decriminalise abortion for women in England and Wales,The vote to decriminalise the procedure is the biggest change to abortion laws in England and Wales for nearly 60 years.,"Tue, 17 Jun 2025 20:32:08 GMT",https://www.bbc.com/news/articles/c2le12114j9o,BBC,United Kingdom,health
126,How does a £1.6m fine affect an NHS trust?,How will the largest fine over maternity deaths impact the NHS and the families it failed?,"Fri, 20 Jun 2025 05:25:33 GMT",https://www.bbc.com/news/articles/ckgrjr7emlgo,BBC,United States,health
127,My dad gave me a kidney - now I can have my dream wedding,Kieran Innes was worried he would have to curtail his future plans when his kidneys failed.,"Sun, 15 Jun 2025 08:09:18 GMT",https://www.bbc.com/news/articles/cm2yvk5zd2yo,BBC,Unknown,health
128,Mood swings fuelled Heston Blumenthal's genius. But the highs got higher and the lows got darker,A new BBC documentary looks at how a diagnosis of bipolar disorder at 57 changed the celebrity chef's life.,"Fri, 13 Jun 2025 23:02:10 GMT",https://www.bbc.com/news/articles/cy5e6l06rlvo,BBC,United States,health
129,I'm an NHS leader - but mum still suffered at hands of health service because she was black,NHS Confederation chair Lord Adebowale says his mother's death illustrates inequalities in the system.,"Fri, 13 Jun 2025 23:06:47 GMT",https://www.bbc.com/news/articles/c3v5q2n4gpxo,BBC,United States,health
130,We always joked dad looked nothing like his parents - then we found out why,Matthew's father died late last year - before learning the truth about his family history.,"Sat, 07 Jun 2025 04:41:41 GMT",https://www.bbc.com/news/articles/c4gexw7l7rwo,BBC,Unknown,health
131,World-first blood cancer therapy to be given on NHS,It sneaks toxic drugs inside cancer cells to hit them hard while minimising side-effects.,"Fri, 13 Jun 2025 00:05:15 GMT",https://www.bbc.com/news/articles/ckg4kj2nxjgo,BBC,South Africa,health
132,Handwritten notes reveal Churchill's penicillin concern ahead of D-Day,Handwritten notes show the wartime prime minister's frustration over slow penicillin production.,"Fri, 06 Jun 2025 00:17:55 GMT",https://www.bbc.com/news/articles/cj09v52l8v4o,BBC,United States,health
133,Hospital backlog drops to lowest level in two years,But the NHS in England is still well below its target for seeing patients within 18 weeks.,"Thu, 12 Jun 2025 11:00:09 GMT",https://www.bbc.com/news/articles/c9dqzv316pvo,BBC,United Kingdom,health
134,MPs set to vote on decriminalising abortion in England and Wales,Women would never be prosecuted for terminating a pregnancy under proposed new laws.,"Tue, 10 Jun 2025 15:50:41 GMT",https://www.bbc.com/news/articles/cg5v900v1y6o,BBC,United Kingdom,health
135,"We quit our jobs, sold our home twice and spent 10 years fighting for the truth",A NHS trust and hospital manager have been found guilty of health and safety failings over the death of Alice Figueiredo.,"Mon, 09 Jun 2025 23:53:15 GMT",https://www.bbc.com/news/articles/cdxn5d4dzrwo,BBC,United States,health
136,Cervical screening invites to change in England,"Invitations be sent out by the NHS every five years instead of every three for women aged 25-49 in England, if they have a negative test.","Tue, 10 Jun 2025 16:24:51 GMT",https://www.bbc.com/news/articles/c4g7rkly5z2o,BBC,United Kingdom,health
137,Martha doctor's failings 'particularly grave',A medical tribunal has found a senior doctor's failings amounted to gross negligence and misconduct.,"Wed, 11 Jun 2025 16:05:34 GMT",https://www.bbc.com/news/articles/cn9jnwvgenjo,BBC,Unknown,health
138,Why food firms are scrambling to cut down on ingredients,"Food firms are marketing ranges with fewer ingredients, but are they healthier?","Fri, 06 Jun 2025 14:05:19 GMT",https://www.bbc.com/news/articles/creqge8xgx4o,BBC,Unknown,health
139,"Exercise improves colon cancer survival, major study shows",Risk of dying was cut by a third after colon cancer patients dialled up exercise levels.,"Mon, 02 Jun 2025 10:04:32 GMT",https://www.bbc.com/news/articles/c8xgyw7k7veo,BBC,South Africa,health
140,Disposable vape ban begins - but will it have an impact? ,Retailers will no longer be able to sell single-use vapes as new laws come into force across the UK.,"Sat, 31 May 2025 23:12:11 GMT",https://www.bbc.com/news/articles/c80kxx2xr77o,BBC,United Kingdom,health
141,Syphilis and drug-resistant gonorrhoea increasing,Experts say the gonorrhoea figures are a worry. although the actual number of drug-resistant cases is low.,"Tue, 03 Jun 2025 12:56:42 GMT",https://www.bbc.com/news/articles/cg5v4vrm9lzo,BBC,Unknown,health
142,People say cola and fries are helping their migraines - but there's a twist,Migraines are one of the most complex neurological disorders. What is the science behind the latest hack?,"Sun, 01 Jun 2025 00:36:31 GMT",https://www.bbc.com/news/articles/c23mrl5x53ro,BBC,Spain,health
143,The English neighbourhood that claims to hold the secret to fixing the NHS,"With public satisfaction in the NHS just 21%, one area has a plan to shake up its services that could reduce GP waiting lists, as well as unblock hospital beds - but can it really work nationwide?","Mon, 07 Apr 2025 23:04:10 GMT",https://www.bbc.com/news/articles/cn4w2p79v9eo,BBC,United States,health
144,Why are disposable vapes being banned and how harmful is vaping? ,It will be illegal to sell or supply disposable vapes from 1 June 2025.,"Fri, 30 May 2025 09:37:32 GMT",https://www.bbc.com/news/articles/czxyny0w7wdo,BBC,Unknown,health
145,Labour's plan for benefits throws up a bigger dilemma,The debate has sparked a wider dilemma about the broader purpose of welfare,"Mon, 17 Mar 2025 06:06:29 GMT",https://www.bbc.com/news/articles/cvgev3dvz3jo,BBC,Unknown,health
146,First place in British Isles set to approve right to die,Laws in the Isle of Man to let terminally ill adults end their own lives are in the last stages of debate.,"Tue, 25 Feb 2025 13:02:21 GMT",https://www.bbc.com/news/articles/c78ed70qep7o,BBC,United Kingdom,health
147,Generation K: The disturbing rise of ketamine abuse among young people,"Increasing numbers of young people are using the drug, experts say. The health impacts can be catastrophic.","Tue, 25 Feb 2025 06:00:36 GMT",https://www.bbc.com/news/articles/c5y0g2gnjrqo,BBC,United States,health
148,Assisted dying bill: What is in proposed law?,The proposed law would allow some terminally ill adults to end their own lives. But there are requirements.,"Fri, 29 Nov 2024 15:30:26 GMT",https://www.bbc.com/news/articles/cx2l7m6r55do,BBC,Unknown,health
149,'My first cervical screening was over before I knew it',"The BBC speaks to six people about their first cervical screening, and what they wish they'd known beforehand.","Sun, 02 Feb 2025 01:06:51 GMT",https://www.bbc.com/news/articles/cd0jkk3nnrlo,BBC,Unknown,health
150,Is the system letting down people who were harmed by Covid vaccines?,People affected by rare blood clots say they feel they have been airbrushed out of the pandemic.,"Wed, 23 Oct 2024 05:48:59 GMT",https://www.bbc.com/news/articles/c1d5d6nng67o,BBC,United States,health
151,How will weight-loss drugs change our relationship with food?,"The rise of these treatments has major implications for how we think about obesity, says James Gallagher.","Sat, 19 Oct 2024 03:10:13 GMT",https://www.bbc.com/news/articles/c4g518d5j5lo,BBC,Unknown,health
152,"NHS needs better plan around weight loss jabs, warn experts",Experts call for an urgent review of obesity treatment services amid booming demand for weight loss jabs.,"Wed, 16 Oct 2024 07:27:18 GMT",https://www.bbc.com/news/articles/c5y03p4xlx8o,BBC,Unknown,health
153,How many of us will end up being diagnosed with ADHD?,Experts suggest that the number of people with ADHD is actually going to remain steady.,"Sun, 15 Sep 2024 00:36:40 GMT",https://www.bbc.com/news/articles/c3ejky0dy47o,BBC,United States,health
154,The junior doctors' strikes may be over. But is trouble ahead?,The end of the pay dispute sounded too good to be true. And now some are wondering if it might be.,"Fri, 02 Aug 2024 00:43:02 GMT",https://www.bbc.com/news/articles/c19kdyyxzr3o,BBC,Unknown,health
155,Why we might never know the truth about ultra-processed foods,Experts can’t agree how exactly they affect us and it’s not clear that science will give us an answer.,"Sat, 27 Jul 2024 23:33:23 GMT",https://www.bbc.com/news/articles/cpe3pppw1z7o,BBC,United States,health
156,Are weight-loss injections the answer to obesity?,The appeal is clear - but should we be turning to appetite-suppressing injections?,"Sun, 19 Mar 2023 00:52:45 GMT",https://www.bbc.co.uk/news/health-64677915,BBC,Unknown,health
157,The Covid Inquiry Podcast: 'I wasn't the decision maker',The Inquiry hears from the lead of the test and trace unit,"Sat, 31 May 2025 06:00:00 GMT",https://www.bbc.co.uk/sounds/play/p0lfjj18,BBC,Unknown,health
158,Cash to isolate 'would have cut Covid deaths',Baroness Dido Harding tells Covid inquiry Rishi Sunak blocked higher support payments.,"Wed, 28 May 2025 15:05:43 GMT",https://www.bbc.com/news/articles/cy8nvl37zkdo,BBC,United Kingdom,health
159,"Johnson wanted tighter Covid rules, inquiry hears","In his diaries, Lord Vallance wrote that ex-PM thought rules were not ruthless enough.","Thu, 22 May 2025 19:11:38 GMT",https://www.bbc.com/news/articles/c5y82pll0epo,BBC,South Africa,health
160,Hancock criticises 'wholly naive' Covid inquiry,The former health secretary was giving evidence about medical equipment deals during the pandemic.,"Wed, 19 Mar 2025 17:14:53 GMT",https://www.bbc.com/news/articles/cd65ev8z7z6o,BBC,South Africa,health
161,Mone accuses Covid inquiry of 'cover-up',"She says husband Doug Barrowman and her are targets of a ""politically motivated witch hunt"".","Thu, 13 Mar 2025 19:10:36 GMT",https://www.bbc.com/news/articles/ce8mr2kz222o,BBC,United States,health
162,Michael Gove denies trying to circumvent Dyson ventilator checks,Former cabinet minister says it would be ludicrous to suggest he tried to shortcut safety checks in the pandemic.,"Tue, 11 Mar 2025 12:29:20 GMT",https://www.bbc.com/news/articles/czrnkv4rz5vo,BBC,United States,health
163,How does the Covid inquiry work?,"The inquiry has heard from politicians, civil servants, public health experts and bereaved families.","Thu, 16 Jan 2025 09:58:17 GMT",https://www.bbc.co.uk/news/explainers-57085964,BBC,Unknown,health
164,Michelle Mone-linked PPE firm evidence to be heard in private,"Covid inquiry says hearings into the firm, led by Michelle Mone's husband, must be held in closed session.","Wed, 26 Feb 2025 00:00:16 GMT",https://www.bbc.com/news/articles/c8rkj8pv684o,BBC,United States,health
165,Large UK-wide pandemic preparedness tests planned this year,The stress test will involve thousands of people to help the UK prepare for potential future threats.,"Thu, 16 Jan 2025 16:36:01 GMT",https://www.bbc.com/news/articles/cj910k8g4l0o,BBC,United Kingdom,health
166,Families failed by Covid jabs tell inquiry of pain,They said there was no support after the death and harm suffered by their loved ones.,"Wed, 15 Jan 2025 18:39:40 GMT",https://www.bbc.com/news/articles/c4gzleyydp8o,BBC,Unknown,health
167,NHS hours from PPE running out in Covid - Hancock,"Former health secretary tells inquiry some healthcare settings did run out - ""and it was awful"".  ","Thu, 21 Nov 2024 16:58:34 GMT",https://www.bbc.com/news/articles/ce89k5j27z1o,BBC,South Africa,health
168,Covid inquiry told Treasury blocked NHS bed request,"NHS England chief executive Amanda Pritchard says the decision, in July 2020, was very disappointing.","Mon, 11 Nov 2024 18:06:48 GMT",https://www.bbc.com/news/articles/c4gpwz3qyr0o,BBC,United Kingdom,health
169,Covid inquiry told top NHS doctor was terrified,Sir Stephen Powis says points-based tool was drawn up should need to prioritise patients have arisen.,"Thu, 07 Nov 2024 17:34:34 GMT",https://www.bbc.com/news/articles/cd0gdzdv53yo,BBC,Unknown,health
170,How close were hospitals to collapse in Covid?,"The Covid inquiry restarts its live hearings this week, after senior staff in the NHS revealed just how close some hospitals were to collapse ","Mon, 28 Oct 2024 00:06:04 GMT",https://www.bbc.com/news/articles/c78dl0xv7y2o,BBC,United States,health
171,Covid inquiry told of trust do-not-resuscitate rule,Patients' families were “horrified but not surprised” when told the blanket policy had been in place.,"Thu, 10 Oct 2024 16:54:11 GMT",https://www.bbc.com/news/articles/cd98vpxgp7ko,BBC,United States,health
172,"We were not treated as parents, Covid inquiry told",Mum of premature twins says rigid restrictions on birthing wards during Covid were traumatic.  ,"Mon, 07 Oct 2024 14:11:38 GMT",https://www.bbc.com/news/articles/c70z1ppyv5eo,BBC,Unknown,health
173,Covid ambulance crews faced 'crucial PPE delays',Crews say they faced crucial delays trying to save dying patients because of the time it took to put on equipment.,"Tue, 01 Oct 2024 14:39:04 GMT",https://www.bbc.com/news/articles/cvgw0vrrqnno,BBC,United States,health
174,"Covid was like a daily terror attack, doctor tells inquiry",Covid inquiry hears harrowing testimony from ex-adviser in emergency preparedness at NHS England.,"Thu, 26 Sep 2024 14:06:37 GMT",https://www.bbc.com/news/articles/cz9py388z17o,BBC,United Kingdom,health
175,Covid inquiry rejects clinicians’ anonymity plea,The UK Health Security Agency argued naming the junior officials could put them at risk of abuse.,"Thu, 26 Sep 2024 00:11:07 GMT",https://www.bbc.com/news/articles/c07n8zp9zp0o,BBC,United Kingdom,health
176,'Endometriosis is so much more than painful periods',Mia Rose Harrison says more awareness of the condition is needed.,"Sat, 21 Jun 2025 06:18:37 GMT",https://www.bbc.com/news/articles/cn842ly7q38o,BBC,Unknown,health
177,Calls for more support for endometriosis patients ,A campaign group hosts a special event to raise awareness about how the disease affects women.,"Thu, 19 Jun 2025 05:27:55 GMT",https://www.bbc.com/news/articles/cp3lwjq2x24o,BBC,Unknown,health
178,Cervical screening changes set to start in Jersey,New testing methods which are more accurate than previous tests lead to the changes.,"Mon, 16 Jun 2025 05:26:44 GMT",https://www.bbc.com/news/articles/ced2dv6531do,BBC,United States,health
179,Event for chats about menopause and women's health,"The free Wolverhampton session is aimed at showing women what support is available, organisers say.","Mon, 16 Jun 2025 05:26:09 GMT",https://www.bbc.com/news/articles/c3v5qke2xkno,BBC,United States,health
