title,description,date,url,source,country,category
"Canada organizing flights in neighbouring countries for Canadians fleeing Israel, Iran","<img src='https://i.cbc.ca/1.7565584.1750347824!/fileImage/httpImage/image.jpg_gen/derivatives/16x9_620/turkey-iran-israel-mideast-wars.jpg' alt='A group of people with suit cases walk beside a long line up of cars and trucks.' width='620' height='349' title='Iranians arrive to cross into Iran at Gurbulak Bazargan border post, in Gurbulak, Turkey, Monday, June 16, 2025.'/><p></p>","Wed, 18 Jun 2025 12:21:22 EDT",https://www.cbc.ca/news/politics/canadians-fleeing-israel-iran-flights-1.7565467?cmp=rss,CBC,Canada,Politics
Kingston site where inmates can use smuggled drugs under supervision has only seen 1 visitor,"<img src='https://i.cbc.ca/1.6856502.1713529992!/fileImage/httpImage/image.JPG_gen/derivatives/16x9_620/collins-bay-institution.JPG' alt='A grey sign identifying the prison behind it, a stone building that looks like a castle and has a red roof.' width='620' height='349' title='A sign outside the Collins Bay Institution in Kingston, Ont. is shown in this photo from May 17, 2023.              '/><p>More than a year-and-a-half after it opened, a site at a the Collins Bay Institution where inmates can inject, snort or swallow substances under medical supervision has only had one user.</p>","Thu, 19 Jun 2025 04:00:00 EDT",https://www.cbc.ca/news/canada/ottawa/kingston-prison-overdose-prevention-service-one-drug-user-1.7562358?cmp=rss,CBC,United States,Politics
"Quebec's new trans inmate policy goes against human rights, advocates say","<img src='https://i.cbc.ca/1.5557610.1750278722!/cpImage/httpImage/image.jpg_gen/derivatives/16x9_620/covid-que-federal-inmates-20200421.jpg' alt='An overhead view of the women&apos;s prison in Joliette' width='620' height='349' title='An overhead view of the women&apos;s prison in Joliette, Que., on June 1, 2005. A federal inmate in Quebec who contracted COVID-19 has filed a class action lawsuit over Correctional Service Canada&apos;s handling of the pandemic. THE CANADIAN PRESS/'/><p>Quebec’s public security minister announced changes to how transgender inmates will be incarcerated, citing fairness and safety priorities. The move comes just after the high-profile case of Levana Ballouz, a trans woman who requested a transfer to a women’s prison after being convicted of murdering her partner and kids.</p>","Thu, 19 Jun 2025 04:00:00 EDT",https://www.cbc.ca/news/canada/montreal/incarcerated-trans-inmates-gender-quebec-1.7564771?cmp=rss,CBC,United States,Technology
Alberta companies ordered to repay almost $165K to temporary foreign workers,<img src='https://i.cbc.ca/1.7354211.1729116721!/fileImage/httpImage/image.jpg_gen/derivatives/16x9_620/rowell-pailan.jpg' alt='A man in a black ball cap rests his head on his hand and looks into the distance.' width='620' height='349' title='Rowell Pailan says he has not seen his two children in the Philippines since March 2022. He hopes he can be reunited with them in Canada.'/><p>Two Alberta-based companies are appealing a decision by the Ontario Labour Ministry that said they unlawfully charged fees to workers for jobs at an Etobicoke Canadian Tire. One of the workers says the decision sends a message that people shouldn’t “take advantage” of temporary foreign workers.</p>,"Thu, 19 Jun 2025 04:00:00 EDT",https://www.cbc.ca/news/canada/nova-scotia/alberta-companies-temporary-foreign-workers-1.7564659?cmp=rss,CBC,Canada,Technology
"Israeli military kills 23 Palestinians near aid site in Gaza, witnesses and medics say",The Hamas-run health ministry says more than 400 Palestinians have been killed in this way since late May.,"Fri, 20 Jun 2025 12:48:57 GMT",https://www.bbc.com/news/articles/cd0vgerp402o,BBC,,International
US court allows Trump to keep control of National Guard in LA,"Trump deployed the troops in response to protests in the city, despite objections from city officials and California's governor.","Fri, 20 Jun 2025 11:30:10 GMT",https://www.bbc.com/news/articles/c1e07nd7x17o,BBC,,International
India to decide on overseas analysis of Air India crash flight recorders ,Media reports in India have suggested that the flight's recorders will be sent overseas for analysis.,"Fri, 20 Jun 2025 06:09:27 GMT",https://www.bbc.com/news/articles/clyn2227jlyo,BBC,,International
Zambian ex-president to be buried in South Africa after funeral row,Edgar Lungu's family has been engaged in a bitter dispute with the government over his funeral plans.,"Fri, 20 Jun 2025 13:44:18 GMT",https://www.bbc.com/news/articles/cy8k7x32z1eo,BBC,,International
Girl dies in food poisoning outbreak in northern France,Eight children have been admitted to hospital as officials scramble to find the root of the outbreak.,"Fri, 20 Jun 2025 08:58:24 GMT",https://www.bbc.com/news/articles/cql0rd407zwo,BBC,,International
China criticises UK warship's patrol in Taiwan Strait,"China said the HMS Spey's transit ""undermines peace and stability"" in the region.","Fri, 20 Jun 2025 04:57:53 GMT",https://www.bbc.com/news/articles/ckg3rrz94nzo,BBC,,International
BBC shelves Gaza doc over impartiality concerns,"Gaza: Doctors Under Attack, which was due to air in February, was made by an independent company.","Fri, 20 Jun 2025 13:49:02 GMT",https://www.bbc.com/news/articles/crenz9d3181o,BBC,,International
Niger military leaders to nationalise uranium firm,"The company is majority French-owned, while the junta wants more local control of Niger's mineral wealth.","Fri, 20 Jun 2025 14:46:31 GMT",https://www.bbc.com/news/articles/cdx5v2x8yejo,BBC,,International
Search for 34 missing cockfighting gamblers points to volcanic lake,Filipino authorities are studying a new lead in a case that gripped the nation.,"Fri, 20 Jun 2025 07:20:11 GMT",https://www.bbc.com/news/articles/cwyq1149w94o,BBC,,International
US basketball training for Senegal cancelled after visas rejected,"Players will train in Dakar instead ""in a sovereign and conducive setting"", says the prime minister.","Fri, 20 Jun 2025 14:40:34 GMT",https://www.bbc.com/news/articles/cwyq1evnd0go,BBC,,International
Mexico begins clean-up after hurricane Erick hits southern coast,"Category 3 storm causes power cuts, some damage and floods, with forecasters predicting it will dissipate by Friday.","Thu, 19 Jun 2025 12:19:26 GMT",https://www.bbc.com/news/articles/cvg9wprprxyo,BBC,,International
"Police ban Budapest Pride march, but mayor vows it will go ahead",It's the latest twist in a cat-and-mouse confrontation between the government and Hungary's LGBTQ community.,"Thu, 19 Jun 2025 16:27:38 GMT",https://www.bbc.com/news/articles/c2k1d7dlgzko,BBC,,International
How Belarus dissidents in exile abroad are pursued and threatened,"Some receive threatening messages or phone-calls, others say their relatives are visited by authorities back home.","Thu, 19 Jun 2025 23:21:18 GMT",https://www.bbc.com/news/articles/czxeg9ql5gvo,BBC,,International
"Three decades, one leader - how Eritreans had their hopes dashed",Isaias Afwerki promised elections when he came to power in 1991 but these have still not been held.,"Thu, 19 Jun 2025 23:31:31 GMT",https://www.bbc.com/news/articles/cx2ekjvg17xo,BBC,,International
Adorable or just weird? How Labubu dolls conquered the world,"The dolls have almost tripled their maker's profits - and, according to some, energised Chinese soft power.","Fri, 20 Jun 2025 02:59:16 GMT",https://www.bbc.com/news/articles/cy4ydxlm9n9o,BBC,,International
'They sang about my family's death': Father's anger exposes divide in Israeli society,An Iranian missile killed Kasem's family in an Arab-majority town in Israel. The response shone a light on deep social issues.,"Wed, 18 Jun 2025 17:20:26 GMT",https://www.bbc.com/news/articles/c7vr51pzvm0o,BBC,,International
Trump's Iran dilemma exposes bitter split in president's circle,The conflict has pitted the isolationist and hawkish wings of the US leader's party against one another.,"Wed, 18 Jun 2025 20:52:01 GMT",https://www.bbc.com/news/articles/c1wp72224jzo,BBC,,International
Russia fears another loss in Middle East from Iran's conflict with Israel,"The longer Israel's military operation goes on, the greater the realisation that Russia has much to lose.","Tue, 17 Jun 2025 22:59:28 GMT",https://www.bbc.com/news/articles/c3w463pyj90o,BBC,,International
Tennis icon Navratilova defected to the US 50 years ago. Would she do the same today?,The tennis icon tells the BBC she doesn't think a Trump-led government would let her in.,"Tue, 17 Jun 2025 23:04:03 GMT",https://www.bbc.com/news/articles/ce9xzgg91lpo,BBC,,International
Watch: Man gets stuck driving car down Rome's Spanish Steps,"The 81-year-old man and his car got stuck on the way down, before a crane lifted the car away.","Thu, 19 Jun 2025 23:01:23 GMT",https://www.bbc.com/news/videos/c70rw09z6z2o,BBC,,International
Watch Indonesian volcano spew ash over 11km into the sky,The twin-peaked Lewotobi Laki-Laki volcano erupted on Tuesday creating a vast plume.,"Wed, 18 Jun 2025 06:16:44 GMT",https://www.bbc.com/news/videos/c0rvwrqgqljo,BBC,,International
Watch: How Trump loomed over G7 despite early departure,The BBC's James Landale highlights the role of the US president at the summit as the conflict in the Middle East overshadowed the gathering.,"Tue, 17 Jun 2025 22:08:51 GMT",https://www.bbc.com/news/videos/cd783w709d8o,BBC,,International
'Spectacular' moment an enormous tornado crosses a rainbow,"Stormchasers captured footage of the major twister swirling near Dickens, Nebraska.","Wed, 18 Jun 2025 03:21:31 GMT",https://www.bbc.com/news/videos/c5yk8nn21kpo,BBC,,International
Leeds maternity units downgraded to 'inadequate',Trust told to take immediate action to improve after unannounced inspections prompted by parent concerns.,"Thu, 19 Jun 2025 23:46:20 GMT",https://www.bbc.com/news/articles/cdx5rp4y42yo,BBC,United States,health
'I was poisoned by fake Botox' ,In recent weeks 28 cases of botulism caused by fake Botox are recorded in the north-east of England.,"Fri, 20 Jun 2025 05:03:29 GMT",https://www.bbc.com/news/articles/cn0q2z725llo,BBC,United Kingdom,health
Breakthrough Alzheimer's drugs too pricey for NHS,"Two breakthrough Alzheimer's drugs cost too much and have too little benefit for NHS use, review finds. ","Wed, 18 Jun 2025 23:57:48 GMT",https://www.bbc.com/news/articles/cq8zxx9kk0ko,BBC,United States,health
Police maternity investigation to interview staff,Police are determining if criminal action should be taken over errors at two Shropshire hospitals.,"Thu, 19 Jun 2025 05:31:55 GMT",https://www.bbc.com/news/articles/c335vd0ml02o,BBC,Unknown,health
Under-fire NHS trust recorded patient ate breakfast three days after he died,The mental health trust where Alice Figueiredo took her own life faced concerns over 20 other deaths.,"Wed, 18 Jun 2025 17:17:35 GMT",https://www.bbc.com/news/articles/cly2r0x9xwlo,BBC,United States,health
British woman dies from rabies after puppy scratch,"Yvonne Ford had light contact with the stray dog while on holiday in Morocco, her family says.","Wed, 18 Jun 2025 16:36:36 GMT",https://www.bbc.com/news/articles/c98wyllp170o,BBC,United Kingdom,health
What does hot weather do to the body?,"Hot weather during the summer can affect anyone, but some people run a greater risk of serious harm.","Thu, 19 Jun 2025 07:44:08 GMT",https://www.bbc.com/news/articles/cy7n6m7y6yvo,BBC,United States,health
Why are pollen levels making hay fever so bad this year?,"As pollen levels rise, what are the best ways to treat hay fever symptoms, and other useful advice.","Tue, 17 Jun 2025 09:17:40 GMT",https://www.bbc.com/news/articles/cx2jevn2d1eo,BBC,United States,health
What to do if you think someone has heat exhaustion or heatstroke,Know the signs and what to do if someone is unwell in hot weather.,"Thu, 19 Jun 2025 07:54:12 GMT",https://www.bbc.com/news/articles/ckgl51jjp3jo,BBC,United States,health
Hot weather: How to sleep in the heat,Simple tips to help you get a good night's sleep during hot weather. ,"Thu, 19 Jun 2025 07:38:09 GMT",https://www.bbc.com/news/articles/cpw7gp2ky70o,BBC,Unknown,health
Six ways to keep your home and yourself cool in hot weather,Six simple things you can do to help keep your house cool when temperatures rise. ,"Thu, 19 Jun 2025 14:09:28 GMT",https://www.bbc.com/news/articles/cz6gxe61p70o,BBC,United States,health
MPs vote to decriminalise abortion for women in England and Wales,The vote to decriminalise the procedure is the biggest change to abortion laws in England and Wales for nearly 60 years.,"Tue, 17 Jun 2025 20:32:08 GMT",https://www.bbc.com/news/articles/c2le12114j9o,BBC,United Kingdom,health
How does a £1.6m fine affect an NHS trust?,How will the largest fine over maternity deaths impact the NHS and the families it failed?,"Fri, 20 Jun 2025 05:25:33 GMT",https://www.bbc.com/news/articles/ckgrjr7emlgo,BBC,United States,health
My dad gave me a kidney - now I can have my dream wedding,Kieran Innes was worried he would have to curtail his future plans when his kidneys failed.,"Sun, 15 Jun 2025 08:09:18 GMT",https://www.bbc.com/news/articles/cm2yvk5zd2yo,BBC,Unknown,health
Mood swings fuelled Heston Blumenthal's genius. But the highs got higher and the lows got darker,A new BBC documentary looks at how a diagnosis of bipolar disorder at 57 changed the celebrity chef's life.,"Fri, 13 Jun 2025 23:02:10 GMT",https://www.bbc.com/news/articles/cy5e6l06rlvo,BBC,United States,health
I'm an NHS leader - but mum still suffered at hands of health service because she was black,NHS Confederation chair Lord Adebowale says his mother's death illustrates inequalities in the system.,"Fri, 13 Jun 2025 23:06:47 GMT",https://www.bbc.com/news/articles/c3v5q2n4gpxo,BBC,United States,health
Why are pollen levels making hay fever so bad this year?,"As pollen levels rise, what are the best ways to treat hay fever symptoms, and other useful advice.","Tue, 17 Jun 2025 09:17:40 GMT",https://www.bbc.com/news/articles/cx2jevn2d1eo,BBC,United States,health
We always joked dad looked nothing like his parents - then we found out why,Matthew's father died late last year - before learning the truth about his family history.,"Sat, 07 Jun 2025 04:41:41 GMT",https://www.bbc.com/news/articles/c4gexw7l7rwo,BBC,Unknown,health
World-first blood cancer therapy to be given on NHS,It sneaks toxic drugs inside cancer cells to hit them hard while minimising side-effects.,"Fri, 13 Jun 2025 00:05:15 GMT",https://www.bbc.com/news/articles/ckg4kj2nxjgo,BBC,South Africa,health
Handwritten notes reveal Churchill's penicillin concern ahead of D-Day,Handwritten notes show the wartime prime minister's frustration over slow penicillin production.,"Fri, 06 Jun 2025 00:17:55 GMT",https://www.bbc.com/news/articles/cj09v52l8v4o,BBC,United States,health
Hospital backlog drops to lowest level in two years,But the NHS in England is still well below its target for seeing patients within 18 weeks.,"Thu, 12 Jun 2025 11:00:09 GMT",https://www.bbc.com/news/articles/c9dqzv316pvo,BBC,United Kingdom,health
MPs set to vote on decriminalising abortion in England and Wales,Women would never be prosecuted for terminating a pregnancy under proposed new laws.,"Tue, 10 Jun 2025 15:50:41 GMT",https://www.bbc.com/news/articles/cg5v900v1y6o,BBC,United Kingdom,health
"We quit our jobs, sold our home twice and spent 10 years fighting for the truth",A NHS trust and hospital manager have been found guilty of health and safety failings over the death of Alice Figueiredo.,"Mon, 09 Jun 2025 23:53:15 GMT",https://www.bbc.com/news/articles/cdxn5d4dzrwo,BBC,United States,health
Cervical screening invites to change in England,"Invitations be sent out by the NHS every five years instead of every three for women aged 25-49 in England, if they have a negative test.","Tue, 10 Jun 2025 16:24:51 GMT",https://www.bbc.com/news/articles/c4g7rkly5z2o,BBC,United Kingdom,health
Martha doctor's failings 'particularly grave',A medical tribunal has found a senior doctor's failings amounted to gross negligence and misconduct.,"Wed, 11 Jun 2025 16:05:34 GMT",https://www.bbc.com/news/articles/cn9jnwvgenjo,BBC,Unknown,health
Why food firms are scrambling to cut down on ingredients,"Food firms are marketing ranges with fewer ingredients, but are they healthier?","Fri, 06 Jun 2025 14:05:19 GMT",https://www.bbc.com/news/articles/creqge8xgx4o,BBC,Unknown,health
"Exercise improves colon cancer survival, major study shows",Risk of dying was cut by a third after colon cancer patients dialled up exercise levels.,"Mon, 02 Jun 2025 10:04:32 GMT",https://www.bbc.com/news/articles/c8xgyw7k7veo,BBC,South Africa,health
Disposable vape ban begins - but will it have an impact? ,Retailers will no longer be able to sell single-use vapes as new laws come into force across the UK.,"Sat, 31 May 2025 23:12:11 GMT",https://www.bbc.com/news/articles/c80kxx2xr77o,BBC,United Kingdom,health
Syphilis and drug-resistant gonorrhoea increasing,Experts say the gonorrhoea figures are a worry. although the actual number of drug-resistant cases is low.,"Tue, 03 Jun 2025 12:56:42 GMT",https://www.bbc.com/news/articles/cg5v4vrm9lzo,BBC,Unknown,health
People say cola and fries are helping their migraines - but there's a twist,Migraines are one of the most complex neurological disorders. What is the science behind the latest hack?,"Sun, 01 Jun 2025 00:36:31 GMT",https://www.bbc.com/news/articles/c23mrl5x53ro,BBC,Spain,health
'My life was saved by a stranger on the other side of the world',An Australian man meets his stem-cell donor for the first time after travelling to the UK.,"Tue, 27 May 2025 05:01:50 GMT",https://www.bbc.com/news/articles/cpqe52pj1d2o,BBC,United Kingdom,health
The English neighbourhood that claims to hold the secret to fixing the NHS,"With public satisfaction in the NHS just 21%, one area has a plan to shake up its services that could reduce GP waiting lists, as well as unblock hospital beds - but can it really work nationwide?","Mon, 07 Apr 2025 23:04:10 GMT",https://www.bbc.com/news/articles/cn4w2p79v9eo,BBC,United States,health
Why are disposable vapes being banned and how harmful is vaping? ,It will be illegal to sell or supply disposable vapes from 1 June 2025.,"Fri, 30 May 2025 09:37:32 GMT",https://www.bbc.com/news/articles/czxyny0w7wdo,BBC,Unknown,health
Labour's plan for benefits throws up a bigger dilemma,The debate has sparked a wider dilemma about the broader purpose of welfare,"Mon, 17 Mar 2025 06:06:29 GMT",https://www.bbc.com/news/articles/cvgev3dvz3jo,BBC,Unknown,health
First place in British Isles set to approve right to die,Laws in the Isle of Man to let terminally ill adults end their own lives are in the last stages of debate.,"Tue, 25 Feb 2025 13:02:21 GMT",https://www.bbc.com/news/articles/c78ed70qep7o,BBC,United Kingdom,health
Generation K: The disturbing rise of ketamine abuse among young people,"Increasing numbers of young people are using the drug, experts say. The health impacts can be catastrophic.","Tue, 25 Feb 2025 06:00:36 GMT",https://www.bbc.com/news/articles/c5y0g2gnjrqo,BBC,United States,health
Assisted dying bill: What is in proposed law?,The proposed law would allow some terminally ill adults to end their own lives. But there are requirements.,"Fri, 29 Nov 2024 15:30:26 GMT",https://www.bbc.com/news/articles/cx2l7m6r55do,BBC,Unknown,health
'My first cervical screening was over before I knew it',"The BBC speaks to six people about their first cervical screening, and what they wish they'd known beforehand.","Sun, 02 Feb 2025 01:06:51 GMT",https://www.bbc.com/news/articles/cd0jkk3nnrlo,BBC,Unknown,health
Is the system letting down people who were harmed by Covid vaccines?,People affected by rare blood clots say they feel they have been airbrushed out of the pandemic.,"Wed, 23 Oct 2024 05:48:59 GMT",https://www.bbc.com/news/articles/c1d5d6nng67o,BBC,United States,health
How will weight-loss drugs change our relationship with food?,"The rise of these treatments has major implications for how we think about obesity, says James Gallagher.","Sat, 19 Oct 2024 03:10:13 GMT",https://www.bbc.com/news/articles/c4g518d5j5lo,BBC,Unknown,health
"NHS needs better plan around weight loss jabs, warn experts",Experts call for an urgent review of obesity treatment services amid booming demand for weight loss jabs.,"Wed, 16 Oct 2024 07:27:18 GMT",https://www.bbc.com/news/articles/c5y03p4xlx8o,BBC,Unknown,health
How many of us will end up being diagnosed with ADHD?,Experts suggest that the number of people with ADHD is actually going to remain steady.,"Sun, 15 Sep 2024 00:36:40 GMT",https://www.bbc.com/news/articles/c3ejky0dy47o,BBC,United States,health
The junior doctors' strikes may be over. But is trouble ahead?,The end of the pay dispute sounded too good to be true. And now some are wondering if it might be.,"Fri, 02 Aug 2024 00:43:02 GMT",https://www.bbc.com/news/articles/c19kdyyxzr3o,BBC,Unknown,health
Why we might never know the truth about ultra-processed foods,Experts can’t agree how exactly they affect us and it’s not clear that science will give us an answer.,"Sat, 27 Jul 2024 23:33:23 GMT",https://www.bbc.com/news/articles/cpe3pppw1z7o,BBC,United States,health
Are weight-loss injections the answer to obesity?,The appeal is clear - but should we be turning to appetite-suppressing injections?,"Sun, 19 Mar 2023 00:52:45 GMT",https://www.bbc.co.uk/news/health-64677915,BBC,Unknown,health
The Covid Inquiry Podcast: 'I wasn't the decision maker',The Inquiry hears from the lead of the test and trace unit,"Sat, 31 May 2025 06:00:00 GMT",https://www.bbc.co.uk/sounds/play/p0lfjj18,BBC,Unknown,health
Cash to isolate 'would have cut Covid deaths',Baroness Dido Harding tells Covid inquiry Rishi Sunak blocked higher support payments.,"Wed, 28 May 2025 15:05:43 GMT",https://www.bbc.com/news/articles/cy8nvl37zkdo,BBC,United Kingdom,health
"Johnson wanted tighter Covid rules, inquiry hears","In his diaries, Lord Vallance wrote that ex-PM thought rules were not ruthless enough.","Thu, 22 May 2025 19:11:38 GMT",https://www.bbc.com/news/articles/c5y82pll0epo,BBC,South Africa,health
Hancock criticises 'wholly naive' Covid inquiry,The former health secretary was giving evidence about medical equipment deals during the pandemic.,"Wed, 19 Mar 2025 17:14:53 GMT",https://www.bbc.com/news/articles/cd65ev8z7z6o,BBC,South Africa,health
Mone accuses Covid inquiry of 'cover-up',"She says husband Doug Barrowman and her are targets of a ""politically motivated witch hunt"".","Thu, 13 Mar 2025 19:10:36 GMT",https://www.bbc.com/news/articles/ce8mr2kz222o,BBC,United States,health
Michael Gove denies trying to circumvent Dyson ventilator checks,Former cabinet minister says it would be ludicrous to suggest he tried to shortcut safety checks in the pandemic.,"Tue, 11 Mar 2025 12:29:20 GMT",https://www.bbc.com/news/articles/czrnkv4rz5vo,BBC,United States,health
How does the Covid inquiry work?,"The inquiry has heard from politicians, civil servants, public health experts and bereaved families.","Thu, 16 Jan 2025 09:58:17 GMT",https://www.bbc.co.uk/news/explainers-57085964,BBC,Unknown,health
Michelle Mone-linked PPE firm evidence to be heard in private,"Covid inquiry says hearings into the firm, led by Michelle Mone's husband, must be held in closed session.","Wed, 26 Feb 2025 00:00:16 GMT",https://www.bbc.com/news/articles/c8rkj8pv684o,BBC,United States,health
Large UK-wide pandemic preparedness tests planned this year,The stress test will involve thousands of people to help the UK prepare for potential future threats.,"Thu, 16 Jan 2025 16:36:01 GMT",https://www.bbc.com/news/articles/cj910k8g4l0o,BBC,United Kingdom,health
Families failed by Covid jabs tell inquiry of pain,They said there was no support after the death and harm suffered by their loved ones.,"Wed, 15 Jan 2025 18:39:40 GMT",https://www.bbc.com/news/articles/c4gzleyydp8o,BBC,Unknown,health
NHS hours from PPE running out in Covid - Hancock,"Former health secretary tells inquiry some healthcare settings did run out - ""and it was awful"".  ","Thu, 21 Nov 2024 16:58:34 GMT",https://www.bbc.com/news/articles/ce89k5j27z1o,BBC,South Africa,health
Covid inquiry told Treasury blocked NHS bed request,"NHS England chief executive Amanda Pritchard says the decision, in July 2020, was very disappointing.","Mon, 11 Nov 2024 18:06:48 GMT",https://www.bbc.com/news/articles/c4gpwz3qyr0o,BBC,United Kingdom,health
Covid inquiry told top NHS doctor was terrified,Sir Stephen Powis says points-based tool was drawn up should need to prioritise patients have arisen.,"Thu, 07 Nov 2024 17:34:34 GMT",https://www.bbc.com/news/articles/cd0gdzdv53yo,BBC,Unknown,health
How close were hospitals to collapse in Covid?,"The Covid inquiry restarts its live hearings this week, after senior staff in the NHS revealed just how close some hospitals were to collapse ","Mon, 28 Oct 2024 00:06:04 GMT",https://www.bbc.com/news/articles/c78dl0xv7y2o,BBC,United States,health
Covid inquiry told of trust do-not-resuscitate rule,Patients' families were “horrified but not surprised” when told the blanket policy had been in place.,"Thu, 10 Oct 2024 16:54:11 GMT",https://www.bbc.com/news/articles/cd98vpxgp7ko,BBC,United States,health
"We were not treated as parents, Covid inquiry told",Mum of premature twins says rigid restrictions on birthing wards during Covid were traumatic.  ,"Mon, 07 Oct 2024 14:11:38 GMT",https://www.bbc.com/news/articles/c70z1ppyv5eo,BBC,Unknown,health
Covid ambulance crews faced 'crucial PPE delays',Crews say they faced crucial delays trying to save dying patients because of the time it took to put on equipment.,"Tue, 01 Oct 2024 14:39:04 GMT",https://www.bbc.com/news/articles/cvgw0vrrqnno,BBC,United States,health
