id,title,description,date,url,source,country,category
1,UK prepares flight from Israel for British nationals ,British nationals are being asked to register their interest in joining the flight.,"Sun, 22 Jun 2025 10:26:08 GMT",https://www.bbc.com/news/articles/c86gw0j3dzxo,BBC,United Kingdom,General
2,Starmer calls for Iran to return to negotiating table,The prime minister says in a statement that Iran can never be allowed to develop a nuclear weapon.,"Sun, 22 Jun 2025 09:32:57 GMT",https://www.bbc.com/news/articles/cq53l41gl8jo,BBC,United Kingdom,General
3,Temperatures surpass 33C as storm warning kicks in,Parts of the UK brace for thunderstorms after a Met Office yellow weather warning comes into force.,"Sat, 21 Jun 2025 19:25:37 GMT",https://www.bbc.com/news/articles/cg5z78nyglpo,BBC,United Kingdom,Politics
4,"Kneecap performing at Glastonbury 'not appropriate', PM says",He made the comments after Kneecap member Liam Óg Ó hAnnaidh appeared in court on Wednesday.,"Sat, 21 Jun 2025 22:57:49 GMT",https://www.bbc.com/news/articles/cg5z26dpgd7o,BBC,United Kingdom,Technology
5,FedEx plans expansion at two of its UK sites,The delivery company says it is looking to increase its operations in Bedfordshire and Warwickshire.,"Fri, 09 May 2025 15:04:02 GMT",https://www.bbc.com/news/articles/cvgn5m2y63qo,BBC,United Kingdom,General
6,Blackmail victims told 'don't suffer in silence',"Students are being targeted by romance scams on dating apps, but talking to a friend can help avoid the danger.","Sat, 21 Jun 2025 23:13:38 GMT",https://www.bbc.com/news/articles/cyvjy0871dqo,BBC,United Kingdom,Technology
7,Former England fast bowler Lawrence dies aged 61,Former England and Gloucestershire fast bowler David 'Syd' Lawrence dies at the age of 61 following a Motor Neurone Disease diagnosis last year.,"Sun, 22 Jun 2025 09:00:17 GMT",https://www.bbc.com/sport/cricket/articles/c07d973k0zzo,BBC,United Kingdom,Health
8,"Give new recruits £10,000 to join army, says Davey ","The Lib Dems argue Britain needs to become ""war-ready"" to deal in an increasingly unpredictable world.","Sat, 21 Jun 2025 23:07:33 GMT",https://www.bbc.com/news/articles/c70x451xpx5o,BBC,United Kingdom,Technology
9,Seven charged with GBH after Iran embassy protest,Seven people are charged with grievous bodily harm following disorder outside the Iranian embassy. ,"Sun, 22 Jun 2025 07:40:44 GMT",https://www.bbc.com/news/articles/c994x4yxer5o,BBC,United Kingdom,General
10,Palestine Action member tells BBC plan to ban group 'absurd',The BBC understands the home secretary will move to proscribe the group in the coming weeks.,"Sat, 21 Jun 2025 22:17:53 GMT",https://www.bbc.com/news/articles/cq6m24v7910o,BBC,United Kingdom,Politics
11,British tourist catches Legionnaires' disease in Greece,"Donna Jobling, who is 57 years old, is in an intensive care unit in a hospital in Heraklion.","Sat, 21 Jun 2025 20:58:07 GMT",https://www.bbc.com/news/articles/cpvjnyw47kro,BBC,United Kingdom,Technology
12,Esther Rantzen urges Lords not to block assisted dying,"Some critics, including disability rights campaigner Lord Shinkwin, indicate they will try to amend a bill, backed by MPs, to legalise assisted dying.","Sat, 21 Jun 2025 09:29:35 GMT",https://www.bbc.com/news/articles/cx23nd10295o,BBC,United Kingdom,Technology
13,British man arrested in Cyprus suspected of spying and terror offences,The Foreign Office says it is in contact with Cypriot authorities after the arrest.,"Sat, 21 Jun 2025 17:04:49 GMT",https://www.bbc.com/news/articles/c628jy5rg78o,BBC,United Kingdom,General
14,NHS plans to DNA test all babies to assess disease risk,Scheme is part of the government's 10-year plan for the NHS in England aimed at easing pressure on services.,"Sat, 21 Jun 2025 09:59:30 GMT",https://www.bbc.com/news/articles/c1ljg7v0vmpo,BBC,United Kingdom,Technology
15,Thousand of bikers turnout for 'joyous' Dave Day 2,Dave Myers' widow Lili says bikers 'just keep coming' to the celebration of her husband's life. ,"Sat, 21 Jun 2025 17:59:18 GMT",https://www.bbc.com/news/articles/c20rlpjdnj8o,BBC,United Kingdom,General
16,Sunken Bayesian superyacht raised from seabed near Sicily,"The cause of the sinking, which killed seven of the 22 people on board, is still under investigation.","Sat, 21 Jun 2025 12:28:08 GMT",https://www.bbc.com/news/articles/czjk7z0r178o,BBC,United Kingdom,Technology
17,Prince William celebrates birthday with puppy photo,Kensington Palace posts an image of the Prince of Wales playing with his dog Orla's litter.,"Sat, 21 Jun 2025 08:59:37 GMT",https://www.bbc.com/news/articles/crk645er1kpo,BBC,United Kingdom,General
18,'Dad's killing won't drive us from our home',"Susan Kohli's father Bhim Kohli, 80, was fatally attacked just yards from the family home.","Sat, 21 Jun 2025 06:20:13 GMT",https://www.bbc.com/news/articles/cdr3j4z267yo,BBC,United Kingdom,General
19,Lime bikes dumped in rivers 'posing pollution risk',The Canal and River Trust says eight or nine are being pulled out a week in one city alone.,"Sat, 21 Jun 2025 00:01:13 GMT",https://www.bbc.com/news/articles/c8d1528yvy2o,BBC,United Kingdom,General
20,Girl's message in a bottle gets reply 31 years later,The primary pupil from Moray in the north east of Scotland sent out her message in 1994 and it finally turned up across the North Sea in Norway.,"Sat, 21 Jun 2025 08:02:48 GMT",https://www.bbc.com/news/articles/cgmwgeykr8xo,BBC,United Kingdom,General
21,Steps star Ian 'H' Watkins honoured at LGBT awards ,He was recognised for his work organising pride events and his advocacy for same-sex parents. ,"Fri, 20 Jun 2025 21:30:07 GMT",https://www.bbc.com/news/articles/cx2k8xr4x1no,BBC,United Kingdom,General
22,King's Midwinter message to Antarctic researchers,"King Charles is the first monarch to take part in the annual BBC broadcast, which sends a morale-raising message to scientists on remote research bases.","Sat, 21 Jun 2025 05:05:36 GMT",https://www.bbc.com/news/articles/cn9yxv2lvl0o,BBC,United Kingdom,Technology
23,River Island set to close 33 shops,"The retailer blames the rise of online shopping for its decision, which risks hundreds of jobs.","Fri, 20 Jun 2025 16:28:30 GMT",https://www.bbc.com/news/articles/cr4wlw0w31ko,BBC,United Kingdom,Technology
24,Man dies 12 years after arrest left him paralysed,Julian Cole was seriously injured following an arrest that has seen three police officers dismissed.,"Fri, 20 Jun 2025 15:35:38 GMT",https://www.bbc.com/news/articles/cgq7y3k2e71o,BBC,United Kingdom,General
25,Arrests as two assaulted outside Iranian embassy,"The altercation involved protesters supporting and opposing the Iranian monarchy, police believe.","Fri, 20 Jun 2025 15:25:51 GMT",https://www.bbc.com/news/articles/c5y2r27jn24o,BBC,United Kingdom,General
26,Sister charged with murder in missing Rolex case,A 69-year-old woman appeared before Highbury Magistrates' Court and was remanded into custody.,"Fri, 20 Jun 2025 15:21:24 GMT",https://www.bbc.com/news/articles/cy5wl3ddek7o,BBC,United Kingdom,General
27,Council leader sorry for 'poor people' social post,"Kay Mason Billig says her Facebook post showing a steak and wine dinner was ""a private joke"".","Fri, 20 Jun 2025 14:17:43 GMT",https://www.bbc.com/news/articles/c0rvg14v54ko,BBC,United Kingdom,Politics
28,Yungblud festival draws fans from across the world,"People travel from as far as Canada for Bludfest, a music and arts event founded by the rockstar.","Sat, 21 Jun 2025 20:01:23 GMT",https://www.bbc.com/news/videos/c7vre6ggeqeo,BBC,United Kingdom,Politics
29,Watch: Thousands celebrate summer solstice at Stonehenge,People gathered across the UK to celebrate the summer solstice - marking the longest day of the year. ,"Sat, 21 Jun 2025 13:47:56 GMT",https://www.bbc.com/news/videos/c4g8vnqqn89o,BBC,United Kingdom,General
30,Watch: BBC looks at how activists breached RAF base Brize Norton,"Footage posted online by Palestine Action on Friday showed two people inside the Oxfordshire airbase in darkness, spraying a plane with red paint.","Fri, 20 Jun 2025 16:16:31 GMT",https://www.bbc.com/news/videos/czxwvp7lykko,BBC,United Kingdom,Technology
31,MPs set out their views as assisted dying debate begins,"
MPs are debating the third reading of the Terminally Ill Adults (End of Life) Bill.
","Fri, 20 Jun 2025 11:20:23 GMT",https://www.bbc.com/news/videos/c2d0le0rx07o,BBC,United Kingdom,General
32,Grooming gangs report author 'blisteringly angry' at findings,"Baroness Casey told the BBC that ""we need to reset"" the commitment to looking after children.","Mon, 16 Jun 2025 17:21:52 GMT",https://www.bbc.com/news/videos/ckg32vvxn4lo,BBC,United Kingdom,General
33,'We sold our house and possessions to travel the world with our child',"Joe and Emma say they are ""sick of the grind"" and are in Thailand with daughter Tilly, 12.","Sun, 22 Jun 2025 06:03:04 GMT",https://www.bbc.com/news/articles/c5y5wy33501o,BBC,United Kingdom,Technology
34,The Papers: 'Spy plot arrest' and 'my pal Wills',"From the ongoing conflict in Iran to the NHS, a wide range of stories feature on Sunday's front pages.","Sun, 22 Jun 2025 03:56:32 GMT",https://www.bbc.com/news/articles/cql05vwe0wwo,BBC,United Kingdom,Politics
35,From gold heist to murder - the unsolved case of John 'Goldfinger' Palmer,"Ten years on, the killing of the notorious Brink's-Mat suspect at his home in Essex remains unsolved.","Sun, 22 Jun 2025 05:31:31 GMT",https://www.bbc.com/news/articles/cdx5rvkeg94o,BBC,United Kingdom,Technology
36,Huge dilemmas lie ahead for UK over Iran,"Sources question if UK diplomacy will make any difference, writes Laura Kuenssberg.","Sat, 21 Jun 2025 11:55:52 GMT",https://www.bbc.com/news/articles/c3vdkk5gp1qo,BBC,United Kingdom,General
37,Shorts at work: Can men now get their legs out in the office?,"Whether shorts are ever appropriate for the office remains a contentious topic, so what should you do?","Fri, 20 Jun 2025 23:56:52 GMT",https://www.bbc.com/news/articles/crlj0g43n18o,BBC,United Kingdom,Technology
38,Windrush campaigners urge ministers to save Carnival,Ministers are being urged to back the event amid calls for more funding to address safety issues.,"Sun, 22 Jun 2025 09:29:42 GMT",https://www.bbc.com/news/articles/c86gwge7zxgo,BBC,United Kingdom,Technology
39,Teenager arrested over fire at former primary school,An eyewitness describes a 'tornado of fire and smoke' coming from the former Balhousie Primary School.,"Sun, 22 Jun 2025 09:43:43 GMT",https://www.bbc.com/news/articles/cz7lqlelw8do,BBC,United Kingdom,General
40,Workers who lost pensions call for surplus to be used ,Ex-steel plant workers who lost pensions when it went bust say cash is available to compensate them.,"Sun, 22 Jun 2025 06:07:52 GMT",https://www.bbc.com/news/articles/cz9kxnv50yko,BBC,United Kingdom,Technology
41,Two rescued from flat after arson attack,A man and a woman are treated for smoke inhalation following a fire at a flat in County Tyrone.,"Sun, 22 Jun 2025 10:18:42 GMT",https://www.bbc.com/news/articles/ceq7ly78z5eo,BBC,United Kingdom,Politics
42,Trump takes huge gamble putting US at heart of Iran-Israel conflict,"As well as retaliation against US troops, a president who styled himself as ""peacemaker"" could face party dissent.","Sun, 22 Jun 2025 03:36:18 GMT",https://www.bbc.com/news/articles/cvg86pd63j8o,BBC,United States,Technology
43,What we know about US strikes on Iran's nuclear facilities,"Three nuclear facilities in Iran have been bombed, including the uranium enrichment facility at Fordo. ","Sun, 22 Jun 2025 09:51:08 GMT",https://www.bbc.com/news/articles/cvg9r4q99g4o,BBC,United States,General
44,Watch: Trump says strikes on Iran a 'spectacular military success' in address,The US president warns Iran of future attacks if they retaliate.,"Sun, 22 Jun 2025 02:52:36 GMT",https://www.bbc.com/news/videos/c93k8nvdnqpo,BBC,United States,General
45,Trump calls US strikes on Iran's nuclear facilities 'spectacular success',"In a televised address, Trump called on Iran to make peace or threatened further attacks.","Sun, 22 Jun 2025 02:36:40 GMT",https://www.bbc.com/news/articles/c39z01m93r4o,BBC,United States,General
46,Freed activist says Trump administration failed to suppress pro-Palestinian voices,"After his release from more than three months in immigration detention, Mahmoud Khalil shouts: ""Free Palestine!""","Sat, 21 Jun 2025 18:46:36 GMT",https://www.bbc.com/news/articles/c70r839kxd9o,BBC,United States,Technology
47,"Minnesota shootings suspect was a 'prepper', FBI says","After shooting two local politicians, Vance Boelter texted his wife ""prepare for war"", say investigators.","Sat, 21 Jun 2025 17:33:54 GMT",https://www.bbc.com/news/articles/c89ev9j955ko,BBC,United States,General
48,Pakistan to nominate Trump for Nobel Peace Prize,"Islamabad says Trump helped end recent fighting with India, but New Delhi denies he played any role. ","Sat, 21 Jun 2025 16:58:22 GMT",https://www.bbc.com/news/articles/cwyx5yw8y28o,BBC,United States,General
49,Hundreds of Voice of America reporters fired as Trump guts outlet,The majority of VOA - some 85% of the workforce - has been laid off since Trump ordered it dismantled.,"Sat, 21 Jun 2025 15:32:44 GMT",https://www.bbc.com/news/articles/cgrx0e98peeo,BBC,United States,Technology
50,Dodgers say immigration agents denied entry to Los Angeles stadium,The baseball team announced $1 million to help immigrant families impacted by the raids in LA.,"Sat, 21 Jun 2025 00:44:43 GMT",https://www.bbc.com/news/articles/cp86m3j10vpo,BBC,United States,Technology
51,Retired University of Alberta professor killed in Banff rockfall,Three people were also injured after rock gave way on a popular hiking trail in the Canadian Rockies.,"Fri, 20 Jun 2025 23:19:05 GMT",https://www.bbc.com/news/articles/crenznxy18po,BBC,Canada,Technology
52,Man accused of forcing US congressman off road turns himself in,Ohio Congressman Max Miller alleges a man threatened him in an antisemitic attack earlier this week. The suspect has pleaded not guilty. ,"Sat, 21 Jun 2025 02:07:20 GMT",https://www.bbc.com/news/articles/c80pl1ljkd8o,BBC,United States,Politics
53,Watch: Americans divided on possible US involvement in Iran,President Donald Trump is weighing whether the US will join Israel's strikes on Iran as the two Middle Eastern countries continue attacks.,"Wed, 18 Jun 2025 22:05:56 GMT",https://www.bbc.com/news/videos/c335v1gy4rxo,BBC,United States,Politics
54,Watch: Trump's awkward encounter with Juventus footballers,"The US president asked the men's players if ""a woman could make the team"" as they visited the White House.","Thu, 19 Jun 2025 12:07:17 GMT",https://www.bbc.com/sport/football/videos/cg4rqpk3z51o,BBC,United States,Politics
55,Watch: Cheers erupt outside court as Karen Read found not guilty,"Read had pleaded not guilty to the charges, with her lawyers arguing that she was being framed for her boyfriend's death.","Wed, 18 Jun 2025 19:59:05 GMT",https://www.bbc.com/news/videos/cz6gw39x2yxo,BBC,Unknown,Politics
56,"'It's horrible, it's mind-numbing': Murdered US lawmaker's family speaks",The parents and brother of Democratic state lawmaker Melissa Hortman spoke out for the first time since the shooting last week.,"Wed, 18 Jun 2025 14:11:54 GMT",https://www.bbc.com/news/videos/c5yg38nx0vgo,BBC,United States,Politics
57,Watch: Trump installs enormous US flags at the White House ,"According to the president, the two flag poles are 100ft (30.5m) tall and paid for out of his own pocket.","Wed, 18 Jun 2025 19:26:14 GMT",https://www.bbc.com/news/videos/ckg3n1yl5k8o,BBC,United States,Technology
58,'Spectacular' moment an enormous tornado crosses a rainbow,"Stormchasers captured footage of the major twister swirling near Dickens, Nebraska.","Wed, 18 Jun 2025 03:21:31 GMT",https://www.bbc.com/news/videos/c5yk8nn21kpo,BBC,United States,Technology
59,How one US weapon could change the course of the Israel-Iran conflict,Iran's Fordo nuclear site is one of the most heavily fortified. There's only one conventional weapon that could destroy it - and only the US is known to have it.,"Tue, 17 Jun 2025 17:47:47 GMT",https://www.bbc.com/news/videos/c70r3n5g8k9o,BBC,United States,General
60,Trump's Iran dilemma exposes bitter split in president's circle,The conflict has pitted the isolationist and hawkish wings of the US leader's party against one another.,"Wed, 18 Jun 2025 20:52:01 GMT",https://www.bbc.com/news/articles/c1wp72224jzo,BBC,United States,Technology
61,US moves 30 jets as Iran attack speculation grows,"At least 30 US military planes have moved from bases in America to Europe, flight tracking data shows.","Wed, 18 Jun 2025 15:09:52 GMT",https://www.bbc.com/news/articles/ce8zdl8zdzgo,BBC,United States,Technology
62,The vicious tone of national politics pollutes Minnesota after shooting,"In a place that prides itself on politeness and respect, people are reeling after the targeted assassination of a popular politician.","Wed, 18 Jun 2025 00:33:59 GMT",https://www.bbc.com/news/articles/c2le1r24py1o,BBC,United States,General
63,"Trade, a sudden exit, Middle East conflict - five takeaways from G7","This year's summit in Canada did not go as planned, but leaders of the world's wealthiest nations still secured some wins.","Wed, 18 Jun 2025 01:50:53 GMT",https://www.bbc.com/news/articles/cpqnjx1qw9po,BBC,Canada,General
64,Venice activists plan to disrupt Jeff Bezos's wedding,"The Amazon founder and Lauren Sánchez are due to tie the knot next week - as activists say Venice is being turned into an ""asset"" for the rich and famous.","Tue, 17 Jun 2025 15:19:12 GMT",https://www.bbc.com/news/articles/cp3kd7qz6n1o,BBC,United States,Politics
65,Carney heads to Europe with military spending on the agenda,Prime Minister Mark Carney departs Sunday to meet with European and NATO allies amid heightened tension in the Middle East and mere hours after the United States joined Israel's war with Iran.,"Sun, 22 Jun 2025 04:00:23 EDT",https://www.cbc.ca/news/politics/carney-europe-nato-summit-1.7566864?cmp=rss,CBC,Iran,Politics
66,Canada is facing a housing crisis. Could it take a page from Europe?,"While Europe struggles with similar trends to Canada of rising rents and skyrocketing home prices, experts say social housing models like Austria’s are among the best defence against a growing affordability crisis.","Sun, 22 Jun 2025 04:00:16 EDT",https://www.cbc.ca/news/world/europe-social-housing-models-1.7565611?cmp=rss,CBC,United States,Technology
67,"As corporate sponsors walk away from Pride, some call for a return to its activist roots","Organizations across Canada are grappling with a chilled enthusiasm among sponsors and donors this year, forcing organizers to search for the delicate balance between growing its audience and staying true to its activist roots fighting for 2SLGBTQ+ rights.","Sun, 22 Jun 2025 04:00:00 EDT",https://www.cbc.ca/radio/day6/pride-corporate-sponsors-nicki-ward-1.7566948?cmp=rss,CBC,United States,General
68,He left the Moscow symphony in protest. Now he's helping a small B.C. town take centre stage,"When Russia invaded Ukraine in February 2022, Arthur Arnold felt he had no choice but to quit his job as music director for the prestigious Moscow Symphony Orchestra. It’s given him more time for his work in what might seem like an unlikely location: Powell River, B.C., once a thriving paper-mill town, where residents hope arts and culture could be the future.","Sun, 22 Jun 2025 04:00:00 EDT",https://www.cbc.ca/radio/thecurrent/he-left-the-moscow-symphony-in-protest-now-he-s-helping-a-small-b-c-town-take-centre-stage-1.7565484?cmp=rss,CBC,United Kingdom,Technology
69,Calgary teen with severe regressive autism defies presumptions by earning Grade 12 diploma,A Calgary family celebrates a major milestone for their son — a dream they were never encouraged to believe was possible. Ishaan Holloway has severe regressive autism and this month he's going to graduate from high school.,"Sat, 21 Jun 2025 08:00:00 EDT",https://www.cbc.ca/news/canada/calgary/calgary-autism-student-graduates-high-school-1.7549789?cmp=rss,CBC,Unknown,General
70,"Accused in deadly Amqui, Que., truck crash found guilty of murder","Steeve Gagnon has been found guilty of first-degree murder after running down and killing three people with his pickup truck in Amqui, Que., in March 2023.","Sat, 21 Jun 2025 19:39:00 EDT",https://www.cbc.ca/news/canada/montreal/amqui-quebec-truck-crash-murder-1.7567183?cmp=rss,CBC,United States,Politics
71,"Sunrise ceremonies, celebrations across Canada mark National Indigenous Peoples Day",,"Sat, 21 Jun 2025 07:44:31 EDT",https://www.cbc.ca/news/canada/national-indigenous-peoples-day-1.7567778?cmp=rss,CBC,United States,Politics
72,4 people are missing after helicopter crashes on Quebec's North Shore,"The crash happened near Natashquan Friday night. One person was rescued and transported to hospital with non-life-threatening injuries, according to provincial police, the Sûreté du Québec (SQ).","Sat, 21 Jun 2025 11:30:24 EDT",https://www.cbc.ca/news/canada/montreal/helicopter-crash-natashquan-1.7567811?cmp=rss,CBC,Canada,Health
73,"Deadly opioid 40 times more powerful than fentanyl smuggled into Canada inside PlayStations, basketballs",A CBC News investigation reveals that highly potent and potentially deadly restricted substances can be purchased with ease online and delivered to Canada.,"Fri, 20 Jun 2025 04:00:00 EDT",https://www.cbc.ca/news/canada/nitazene-online-ads-1.7564656?cmp=rss,CBC,Canada,General
74,Young and looking for that first job? Good luck,,"Sat, 21 Jun 2025 13:41:31 EDT",https://www.cbc.ca/player/play/video/9.6806608?cmp=rss,CBC,Unknown,Politics
75,Transport Minister Chrystia Freeland slams B.C. Ferries deal with Chinese company,B.C. Ferries has drawn the ire of federal Transport Minister Chrystia Freeland for its decision to contract a Chinese state-owned shipyard to build four new vessels for its passenger fleet.,"Fri, 20 Jun 2025 23:23:29 EDT",https://www.cbc.ca/news/canada/british-columbia/freeland-letter-bc-ferries-chinese-contract-1.7567723?cmp=rss,CBC,China,General
76,How Montreal Victoire's Erin Ambrose is using fashion to stand up for the 2SLGBTQ+ community,"The Montreal Victoire player's Pride apparel line with CCM Hockey is back and bolder than ever, as Ambrose looks for ways to bring together hockey and the 2SLGBTQ+ community.","Sat, 21 Jun 2025 04:00:59 EDT",https://www.cbc.ca/sports/hockey/pwhl/pwhl-erin-ambrose-pride-apparel-line-1.7567322?cmp=rss,CBC,United States,Politics
77,"Pinball museum in Alfred, Ont., a 'portal back to the mid-70s'",The Canadian Pinball Museum opens this Saturday. Visitors are invited to travel back in time to the golden era of arcade games.,"Sat, 21 Jun 2025 04:00:00 EDT",https://www.cbc.ca/news/canada/ottawa/pinball-museum-in-alfred-ont-a-portal-back-to-the-mid-70s-1.7565329?cmp=rss,CBC,United States,Sports
78,Sask. NDP and ALS society calling on province to investigate Moose Jaw health centre,,"Sat, 21 Jun 2025 09:56:58 EDT",https://www.cbc.ca/news/canada/saskatchewan/goodenowe-als-society-moose-jaw-health-centre-ndp-1.7567311?cmp=rss,CBC,Unknown,Health
79,Spy agency says it 'improperly' shared Canadians' data with international partners,"Canada’s cyber spies shared identifying information about Canadians with international partners, according to the office that reviews intelligence agency actions.","Sat, 21 Jun 2025 04:00:00 EDT",https://www.cbc.ca/news/politics/cse-intelligence-commissioner-shared-information-1.7566777?cmp=rss,CBC,Canada,Technology
80,"National vaccine registry needed amid measles resurgence, Canada's outgoing top doctor says","As Dr. Theresa Tam retires from her role as Canada’s chief public health officer, she says there’s an urgent need for a national vaccine registry to help prevent and manage crises like the resurgence of measles that the country is now facing.","Sat, 21 Jun 2025 04:00:00 EDT",https://www.cbc.ca/radio/whitecoat/theresa-tam-national-vaccine-registry-1.7566745?cmp=rss,CBC,Canada,Health
81,IN PHOTOS | It's Gay Ol' Times at this Toronto seniors' home,"Once a month, drag queen Minhi Wang has been showing up in full makeup, wigs and heels to perform Gay Ol' Times for residents, their loved ones and staff at The Gardens at Kensington Health, a long-term care home in Toronto.","Sat, 21 Jun 2025 04:00:00 EDT",https://www.cbc.ca/news/canada/toronto/photos/kensington-gardens-photo-scroller-1.7566854?cmp=rss,CBC,Canada,Health
82,"Big grocery wants Ontario to lift ban on 'private label' wine, beer","Premier Doug Ford’s next move to reform alcohol retail in Ontario could be allowing supermarket chains to sell their own private-label wine and beer, such as Costco’s Kirkland Signature brand. CBC News has learned that big retailers are lobbying for the province to end its ban on grocery stores selling their own-brand alcohol products.","Sat, 21 Jun 2025 06:00:00 EDT",https://www.cbc.ca/news/canada/toronto/ontario-wine-grocery-supermarket-private-label-own-brand-1.7567258?cmp=rss,CBC,Unknown,Technology
83,"Measles 'out of control,' experts warn, as Alberta case counts surpass 1,000","Alberta's measles outbreaks have now eclipsed the 1,000 case milestone and infectious diseases specialists are warning the virus is likely ""impossible to contain,"" given the current level of transmission.","Sat, 21 Jun 2025 06:00:00 EDT",https://www.cbc.ca/news/canada/calgary/alberta-measles-cases-pass-1000-1.7567488?cmp=rss,CBC,United States,Technology
