id,title,description,date,url,source,country,category
250, Astronomers create dazzling map of nearby galaxy in thousands of colors,"Astronomers have revealed a nearby spiral galaxy in all its brilliant glory, shining in thousands of colors","Wed, 18 Jun 2025 13:42:17 -0400",https://abcnews.go.com/Technology/wireStory/astronomers-create-dazzling-elaborate-map-nearby-galaxy-thousands-122962932,ABC,United States,Technology
251, Volcanic eruption in Indonesia forces evacuations and flight cancelations,"Indonesia&rsquo;s Mount Lewotobi Laki Laki has erupted with giant ash and smoke plumes again after forcing evacuations of villages and flight cancelations, including to and from the resort island of Bali","Wed, 18 Jun 2025 02:47:11 -0400",https://abcnews.go.com/Technology/wireStory/volcanic-eruption-indonesia-forces-evacuations-flight-cancelations-122957765,ABC,South Africa,Technology
252, Musk's X sues New York over requirement to show how social media platforms handle problematic posts,Elon Musk&rsquo;s X has sued to try to stop New York from requiring reports on how social media platforms define and handle problematic posts,"Tue, 17 Jun 2025 18:46:29 -0400",https://abcnews.go.com/Technology/wireStory/musks-sues-new-york-requirement-show-social-media-122950444,ABC,United States,Technology
253, Senate Republicans double down and target clean energy in draft tax bill,A proposal by Senate Republicans would adjust the pace at which some crucial home energy efficiency and electric vehicle tax credits are phased out in timelines different from what House Republicans proposed in the multitrillion-dollar tax bill they pa...,"Tue, 17 Jun 2025 20:30:29 -0400",https://abcnews.go.com/Technology/wireStory/senate-republicans-double-target-clean-energy-draft-tax-122942601,ABC,United States,Technology
254, Iran asks its people to delete WhatsApp from their devices,"Iranian state television has urged people to remove WhatsApp from their smart phones, alleging without specific evidence that the messaging app gathered user information to send to Israel","Tue, 17 Jun 2025 22:06:21 -0400",https://abcnews.go.com/Technology/wireStory/iran-asks-people-delete-whatsapp-devices-122941626,ABC,United States,Technology
255, Eruption of Indonesia's Mount Lewotobi Laki Laki volcano creates ash plume visible 90 miles away,"Mount Lewotobi Laki Laki volcano in south-central Indonesia has erupted, spewing towering columns of hot ash","Wed, 18 Jun 2025 00:06:16 -0400",https://abcnews.go.com/Technology/wireStory/eruption-indonesias-mount-lewotobi-laki-laki-volcano-creates-122952933,ABC,Indonesia,Technology
256, Danish military using robotic sailboats for surveillance in Baltic and North seas,Four uncrewed robotic sailboats known as &ldquo;Voyagers&rdquo; have been put into service by the Danish Armed Forces for a three-month trial,"Tue, 17 Jun 2025 06:54:20 -0400",https://abcnews.go.com/Technology/wireStory/danish-military-robotic-sailboats-surveillance-baltic-north-seas-122892796,ABC,United States,Technology
257, WhatsApp to start showing ads to users in some parts of the messaging app,"WhatsApp says that users will start seeing ads in some parts of the app, as owner Meta Platforms moves to a cultivate a new revenue stream by tapping the billions of people that use the messaging service","Mon, 16 Jun 2025 11:12:53 -0400",https://abcnews.go.com/Technology/wireStory/whatsapp-start-showing-ads-users-parts-messaging-app-122891842,ABC,United States,Technology
258, How two satellites are mimicking total solar eclipses in space,A pair of European satellites have created the first artificial solar eclipses through precise and fancy formation flying,"Mon, 16 Jun 2025 10:38:36 -0400",https://abcnews.go.com/Technology/wireStory/satellites-mimicking-total-solar-eclipses-space-122891224,ABC,South Africa,Technology
259," Trump family announces another venture, a mobile phone company","The Trump family company says it's launching a mobile phone company, the latest in a string of ventures that have been announced while Donald Trump is in the White House","Mon, 16 Jun 2025 09:17:20 -0400",https://abcnews.go.com/Technology/wireStory/trump-family-announces-venture-mobile-phone-company-122887548,ABC,United States,Technology
260, How Prime Video's 'Burn Bar' is changing the way we watch NASCAR,"NASCAR fans have grown accustomed to seeing speed, throttle and braking on broadcasts for years","Sat, 14 Jun 2025 06:30:26 -0400",https://abcnews.go.com/Technology/wireStory/prime-videos-burn-bar-changing-watch-nascar-122839816,ABC,United States,Technology
261," Republican enthusiasm for Musk cools after his feud with Trump, a new poll finds",A new poll finds Elon Musk has lost some of his luster with Republicans since his public falling-out with President Donald Trump,"Fri, 13 Jun 2025 08:02:03 -0400",https://abcnews.go.com/Technology/wireStory/republican-enthusiasm-musk-cools-after-feud-trump-new-122807132,ABC,United States,Technology
