id,title,description,date,url,source,country,category
1,Tenugui: Traditional Japanese Hand Towels,"Versatile ItemsTraditional Japanese hand towels known as tenugui can be put to all kinds of uses. The light, cotton towels have been popular since the Edo period (1603&ndash;1868) for wiping hands or ...",,https://www.nippon.com/en/guide-to-japan/cs00010/,Nippon.com,Japan,Culture
2,Ōnosato on Top: The Meteoric Rise of a Talented New Sumō Champ,"A Record-Breaking AdvanceWhen Ōnosato debuted at the makushita level of pro sumō in May 2023&mdash;a feat he accomplished in a surprisingly short time, due to his prowess in amateur competition&mdash;...",,https://www.nippon.com/en/in-depth/d01142/,Nippon.com,Japan,General
3,A Rare Recovery for Ishiba? June Poll Numbers Halt Slide for His Administration,"Improvement, But Not Positive Territory YetIn the monthly public opinion surveys run by eight of Japan&rsquo;s major media organizations, fully seven of them found growing support for the administrati...",,https://www.nippon.com/en/japan-data/h30013/,Nippon.com,Japan,Elections
4,Senegal Pavilion: Connecting People Toward Sustainable and Equitable Development,Rising Toward the FutureThe theme of the Senegal pavilion is &ldquo;a hub connecting people toward sustainable and equitable development.&rdquo; Videos and display panels highlight the country&rsquo;s...,,https://www.nippon.com/en/guide-to-japan/expo2025091/,Nippon.com,Japan,Legal
5,Angola Pavilion: Education for Health,"The Rhythm and Beat of LifeThe pavilion for Angola, located on the southwestern coast of Africa, finally fully opened on June 26, after having been closed since the Expo opened on April 13, due to tec...",,https://www.nippon.com/en/guide-to-japan/expo2025093/,Nippon.com,Japan,Health
6,International Organization Pavilion,"A Focus on Furthering Humanity Beyond BordersFive international organizations are participating as co-exhibitors at the Osaka Expo: the World Expo Museum, ASEAN (Association of Southeast Asian Nations...",,https://www.nippon.com/en/guide-to-japan/expo2025092/,Nippon.com,Japan,Culture
7,Bangladesh Pavilion: A Symphony of Tradition and Innovation,Celebrating Textile Culture as a Cornerstone for Economic GrowthBangladesh has a population of more than 170 million in a land area approximately 40% that of Japan&rsquo;s. Predominantly an agricultur...,,https://www.nippon.com/en/guide-to-japan/expo2025090/,Nippon.com,Japan,Culture
8,Mozambique Pavilion: Expanding Horizons,"The Attraction of Beautiful Seas and Colorful PatternsLocated in the southeastern part of Africa, the amazing coastline of Mozambique stretches for 2,500 kilometers along the Indian Ocean. Visitors ar...",,https://www.nippon.com/en/guide-to-japan/expo2025089/,Nippon.com,Japan,Entertainment
9,Algeria Pavilion: Discover the Lights of Algeria,"A Long History and a Vision of a Bright FutureAlgeria, the largest country on the African continent, has more than 3,000 years of history, dating back to the indigenous Berber people. The Sahara Deser...",,https://www.nippon.com/en/guide-to-japan/expo2025088/,Nippon.com,Japan,General
10,Shaped by Conflict: Japanese Literature After World War II,"The second of a series on Japanese literature in the Shōwa era (1926&ndash;89) mainly considers books written from 1945 to 1954 (Shōwa 20&ndash;29), as the country recovered from and reflected on Worl...",,https://www.nippon.com/en/japan-topics/c15202/,Nippon.com,Japan,Conflict
11,"Keeping the Sea Clean: Japanese Efforts to Recover Oil from Wartime Wrecks in Chuuk, Micronesia","Pristine Waters with a Concealed ThreatThe waters of the lagoon shift from deep blue through azure, with dazzlingly colored fish darting just below the surface and coral visible in the shallows.Chuuk,...",,https://www.nippon.com/en/japan-topics/g02528/,Nippon.com,Japan,General
12,Japan’s Ultimate High-Altitude Adventures Ranked,A survey by the tourism website Jalan News (managed by Recruit) ranked Japan&rsquo;s high-altitude activities as follows in the list below.1: Bridge World Experience on Akashi Kaikyō Bridge (Hyōgo Pre...,,https://www.nippon.com/en/japan-data/h02458/,Nippon.com,Japan,General
13,Rise in Incidents Affecting Climbers of Mount Fuji and Mount Takao,"In 2024, there were 2,946 hiking and mountain-climbing incidents in Japan, down 180, or 5.8% year on year. These involved 3,357 people, which is 211, or 5.9%, less than the previous year. The number o...",,https://www.nippon.com/en/japan-data/h02448/,Nippon.com,Japan,General
14,Donki Devotion: How Don Quijote Stores Became Such a Hit with Visitors to Japan,"Repeat CustomersNeedless to say, when people in Japan talk about Don Quijote, they are not referring to the classic novel by Cervantes, but the chain of discount stores, instantly recognizable by thei...",,https://www.nippon.com/en/japan-topics/g02527/,Nippon.com,Japan,Culture
15,Delicious Ways to Enjoy the Versatility of Shiso,"Chicken Cheese KatsuThis is popular as a side dish in bentō lunches, as well as a snack to accompany alcohol. The person who thought to combine shiso and cheese was a genius!(&copy;&nbsp;Pixta)Mentaik...",,https://www.nippon.com/en/japan-topics/c153030/,Nippon.com,Japan,Health
16,Survey Finds a Third of Japanese Firms Have Experienced a Cyberattack,"Cyber ThreatsA May 2025 survey by Teikoku Databank found that around a third of Japanese companies had experienced a cyberattack. The online survey was aimed at 26,389 companies nationwide, receiving ...",,https://www.nippon.com/en/japan-data/h02455/,Nippon.com,Japan,Business
17,Tanzaku: Making Tanabata Wishes on Colorful Paper,"Make a WishLong, narrow strips of colorful paper known as tanzaku are one of the symbols of the Tanabata festival on July 7 each year. People write their wishes on the paper and hang them on bamboo br...",,https://www.nippon.com/en/guide-to-japan/cs00009/,Nippon.com,Japan,Culture
18,Kataoka Folding Screens: Japanese Tradition Made to Order,"Folding Screens Made to OrderOrnate folding screens called byōbu have been part of Japanese interior d&eacute;cor since the Nara period (710&ndash;94). Today, Kataoka Byōbu, a specialty shop in the Mu...",,https://www.nippon.com/en/guide-to-japan/gu900307/,Nippon.com,Japan,Culture
19,"The Sunlight and Moonlight Bodhisattvas at Tōdaiji, Nara",These two images of the Bodhisattva of Sunlight (Nikkō/Suryaprabha) and Moonlight (Gekkō/Candraprabha) from Nara&rsquo;s Tōdaiji temple form a representative masterpiece of figurative sculpture made u...,,https://www.nippon.com/en/japan-topics/b10926/,Nippon.com,Japan,General
20,"Over 1,000 Earthquakes in Less than Two Weeks Shake Japan’s Southern Tokara Islands","More than 1,000 earthquakes have shaken the Tokara Islands in Kagoshima Prefecture since June 21, in a continued period of seismic activity. Most have been minor, but July 3 in particular saw larger t...",,https://www.nippon.com/en/japan-data/h02467/,Nippon.com,Japan,General
21,Han Kuang military exercises begin,,2025-07-10,https://www.taipeitimes.com/News/front/archives/2025/07/10/2003840040,Taipei Times,Taiwan,Conflict
22,China bans dual-use exports to Taiwanese entities,,2025-07-10,https://www.taipeitimes.com/News/front/archives/2025/07/10/2003840041,Taipei Times,Taiwan,Conflict
23,Inventory to assess planned policy to allow public use of school gear,,2025-07-10,https://www.taipeitimes.com/News/front/archives/2025/07/10/2003840042,Taipei Times,Taiwan,Politics
24,Malaysian PM warns over trade issues,,2025-07-10,https://www.taipeitimes.com/News/front/archives/2025/07/10/2003840043,Taipei Times,Taiwan,Politics
25,Cargo ship sinks after attack in Red Sea; five rescued,,2025-07-10,https://www.taipeitimes.com/News/front/archives/2025/07/10/2003840044,Taipei Times,Taiwan,Conflict
26,Judicial head nominee to tackle court overwork,,2025-07-10,https://www.taipeitimes.com/News/taiwan/archives/2025/07/10/2003840051,Taipei Times,Taiwan,Legal
27,"Civil groups to protest KMT, TPP members",,2025-07-10,https://www.taipeitimes.com/News/taiwan/archives/2025/07/10/2003840052,Taipei Times,Taiwan,Conflict
28,"KMT, TPP responsible for farm fund cuts: DPP",,2025-07-10,https://www.taipeitimes.com/News/taiwan/archives/2025/07/10/2003840053,Taipei Times,Taiwan,Conflict
29,Minister hails Lithuania relations as delegation visits,,2025-07-10,https://www.taipeitimes.com/News/taiwan/archives/2025/07/10/2003840054,Taipei Times,Taiwan,General
30,"Air-raid shelters must open to public during alerts, interior ministry says",,2025-07-10,https://www.taipeitimes.com/News/taiwan/archives/2025/07/10/2003840055,Taipei Times,Taiwan,General
31,THSR Yilan extension passes initial EIA,,2025-07-10,https://www.taipeitimes.com/News/taiwan/archives/2025/07/10/2003840056,Taipei Times,Taiwan,Legal
32,Taiwan to expand Mandarin learning centers abroad,,2025-07-10,https://www.taipeitimes.com/News/taiwan/archives/2025/07/10/2003840057,Taipei Times,Taiwan,General
33,All CAL passengers to enjoy free Wi-Fi onboard,,2025-07-10,https://www.taipeitimes.com/News/taiwan/archives/2025/07/10/2003840058,Taipei Times,Taiwan,Technology
34,Father blames judicial negligence for deaths,,2025-07-10,https://www.taipeitimes.com/News/taiwan/archives/2025/07/10/2003840059,Taipei Times,Taiwan,Conflict
35,Taiwanese composer becomes 1st Asian winner at Apulia Soundtrack Awards,,2025-07-10,https://www.taipeitimes.com/News/taiwan/archives/2025/07/10/2003840061,Taipei Times,Taiwan,General
36,Overseas English teaching volunteer service program starts in Taichung,,2025-07-10,https://www.taipeitimes.com/News/taiwan/archives/2025/07/10/2003840062,Taipei Times,Taiwan,Education
37,"Honey yields this season are top quality, official says",,2025-07-10,https://www.taipeitimes.com/News/taiwan/archives/2025/07/10/2003840063,Taipei Times,Taiwan,General
38,Taiwan News Quick Take,,2025-07-10,https://www.taipeitimes.com/News/taiwan/archives/2025/07/10/2003840064,Taipei Times,Taiwan,General
39,Cleaning up,,2025-07-10,https://www.taipeitimes.com/News/taiwan/archives/2025/07/10/2003840065,Taipei Times,Taiwan,Environment
40,Culinary mix,,2025-07-10,https://www.taipeitimes.com/News/taiwan/archives/2025/07/10/2003840066,Taipei Times,Taiwan,Culture
41,Asustek rides rising AI server tide,,2025-07-10,https://www.taipeitimes.com/News/biz/archives/2025/07/10/2003840021,Taipei Times,Taiwan,Technology
42,Wistron’s revenue soars 135.6%,,2025-07-10,https://www.taipeitimes.com/News/biz/archives/2025/07/10/2003840022,Taipei Times,Taiwan,Technology
43,Fulgent Sun’s Q2 revenue surges 31.96 percent,,2025-07-10,https://www.taipeitimes.com/News/biz/archives/2025/07/10/2003840023,Taipei Times,Taiwan,Business
44,"Taipei’s top office market shows signs of slowing, JLL says",,2025-07-10,https://www.taipeitimes.com/News/biz/archives/2025/07/10/2003840024,Taipei Times,Taiwan,Business
45,Machinery exports grow 3.7 percent on front-loading,,2025-07-10,https://www.taipeitimes.com/News/biz/archives/2025/07/10/2003840025,Taipei Times,Taiwan,Business
46,Copper market in turmoil as Trump touts 50% tariff on US imports,,2025-07-10,https://www.taipeitimes.com/News/biz/archives/2025/07/10/2003840026,Taipei Times,Taiwan,Conflict
47,Loading up,,2025-07-10,https://www.taipeitimes.com/News/biz/archives/2025/07/10/2003840027,Taipei Times,Taiwan,General
48,EDITORIAL: When local becomes international,,2025-07-10,https://www.taipeitimes.com/News/editorials/archives/2025/07/10/2003840028,Taipei Times,Taiwan,General
49,"Farewell, 1945 Republic of China",,2025-07-10,https://www.taipeitimes.com/News/editorials/archives/2025/07/10/2003840029,Taipei Times,Taiwan,General
50,Taiwan’s quiet intelligence posture,,2025-07-10,https://www.taipeitimes.com/News/editorials/archives/2025/07/10/2003840030,Taipei Times,Taiwan,Culture
51,China’s threats to global security,,2025-07-10,https://www.taipeitimes.com/News/editorials/archives/2025/07/10/2003840031,Taipei Times,Taiwan,Conflict
52,EDITORIAL CARTOON,,2025-07-10,https://www.taipeitimes.com/News/editorials/archives/2025/07/10/2003840032,Taipei Times,Taiwan,General
53,Macron’s UK state visit underlines effort to move on from Brexit nightmare,,2025-07-10,https://www.taipeitimes.com/News/editorials/archives/2025/07/10/2003840033,Taipei Times,Taiwan,Politics
54,Von der Leyen’s moment of truth,,2025-07-10,https://www.taipeitimes.com/News/editorials/archives/2025/07/10/2003840034,Taipei Times,Taiwan,General
55,Israeli minister pushing forced displacement,,2025-07-10,https://www.taipeitimes.com/News/editorials/archives/2025/07/10/2003840035,Taipei Times,Taiwan,Conflict
56,Pedro brace sends Chelsea into final,,2025-07-10,https://www.taipeitimes.com/News/sport/archives/2025/07/10/2003840045,Taipei Times,Taiwan,General
57,Bailey makes history with in-park homer,,2025-07-10,https://www.taipeitimes.com/News/sport/archives/2025/07/10/2003840046,Taipei Times,Taiwan,Sports
58,Rising star Nakatani determined to knock out Inoue,,2025-07-10,https://www.taipeitimes.com/News/sport/archives/2025/07/10/2003840047,Taipei Times,Taiwan,Conflict
59,Speeding likely cause of Diogo Jota crash: police,,2025-07-10,https://www.taipeitimes.com/News/sport/archives/2025/07/10/2003840048,Taipei Times,Taiwan,Conflict
60,‘Big adrenalin’ propels Pogacar to 100th career win,,2025-07-10,https://www.taipeitimes.com/News/sport/archives/2025/07/10/2003840049,Taipei Times,Taiwan,Sports
61,Wimbledon line tech fails again as Fritz reaches semis,,2025-07-10,https://www.taipeitimes.com/News/sport/archives/2025/07/10/2003840050,Taipei Times,Taiwan,Technology
62,PKK head outlines key for Turkey deal,,2025-07-10,https://www.taipeitimes.com/News/world/archives/2025/07/10/2003840067,Taipei Times,Taiwan,Conflict
63,Rubio impersonated in messages,,2025-07-10,https://www.taipeitimes.com/News/world/archives/2025/07/10/2003840068,Taipei Times,Taiwan,General
64,Israel PM pushes goals for Gaza,,2025-07-10,https://www.taipeitimes.com/News/world/archives/2025/07/10/2003840069,Taipei Times,Taiwan,Conflict
65,Mattel launches Barbie doll with type 1 diabetes,,2025-07-10,https://www.taipeitimes.com/News/world/archives/2025/07/10/2003840070,Taipei Times,Taiwan,Health
66,Recordings suggest that Hasina ordered crackdown,,2025-07-10,https://www.taipeitimes.com/News/world/archives/2025/07/10/2003840071,Taipei Times,Taiwan,Conflict
67,World News Quick Take,,2025-07-10,https://www.taipeitimes.com/News/world/archives/2025/07/10/2003840072,Taipei Times,Taiwan,General
68,The long slow death of Norway’s wild salmon,,2025-07-10,https://www.taipeitimes.com/News/feat/archives/2025/07/10/2003840036,Taipei Times,Taiwan,Environment
69,South Korea battles ‘lovebug’ invasion,,2025-07-10,https://www.taipeitimes.com/News/feat/archives/2025/07/10/2003840037,Taipei Times,Taiwan,Conflict
70,Russian copycats of Mcdonald’s and Starbucks prepare to defend their turf,,2025-07-10,https://www.taipeitimes.com/News/feat/archives/2025/07/10/2003840038,Taipei Times,Taiwan,Conflict
71,Dutch art sleuth recovers stolen trove of UNESCO-listed documents,,2025-07-10,https://www.taipeitimes.com/News/feat/archives/2025/07/10/2003840039,Taipei Times,Taiwan,Culture
72,"SPEAK UP: G-Dragon, Jody Chiang, Mayday launch tours (1/2) 天王GD、天后江蕙、天團五月天開唱（上）",,2025-07-10,https://www.taipeitimes.com/News/lang/archives/2025/07/10/2003840020,Taipei Times,Taiwan,Entertainment
73,Learnmore Jonasi fans made to wait longer…as homecoming show postponed,"Mbulelo Mpofu, Zimpapers Arts and Entertainment Hub COMEDIAN Learnmore Jonasi’s exploits at America’s Got Talent (AGT) made him a darling to many comedy lovers in Zimbabwe and abroad. This increased… The post Learnmore Jonasi fans made to wait longer…as homecoming show postponed appeared first on herald .",2025-07-10,https://www.heraldonline.co.zw/learnmore-jonasi-fans-made-to-wait-longer-as-homecoming-show-postponed-2/,The Herald,Zimbabwe,Entertainment
74,SFAAZ hosts 19th annual conference in Bulawayo,"Sikhulekelani Moyo,Zimpapers Business Hub The Shipping and Forwarding Agent’s Association of Zimbabwe (SFAAZ) is holding its two-day 19th Annual Conference in Bulawayo today, bringing together various government ministries, departments, and… The post SFAAZ hosts 19th annual conference in Bulawayo appeared first on herald .",2025-07-10,https://www.heraldonline.co.zw/sfaaz-hosts-19th-annual-conference-in-bulawayo/,The Herald,Zimbabwe,Business
75,WATCH: Highlanders need quality signings to break championship drought – Ngwenya,"Lovemore Dube, Zimpapers Sports Hub FORMER Highlanders board member Thomas Ngwenya has urged the club to buy players during this transfer window. He said results may continue to elude Bosso… The post WATCH: Highlanders need quality signings to break championship drought – Ngwenya appeared first on herald .",2025-07-10,https://www.heraldonline.co.zw/watch-highlanders-need-quality-signings-to-break-championship-drought-ngwenya-2/,The Herald,Zimbabwe,Sports
76,Mobile IDs drive brings relief to remote Binga families,"BONGANI NDLOVU IN BINGA OBTAINING a birth certificate is an easy exercise for many people in urban areas, but not so for those in remote and hard to-reach communities due… The post Mobile IDs drive brings relief to remote Binga families appeared first on herald .",2025-07-10,https://www.heraldonline.co.zw/mobile-ids-drive-brings-relief-to-remote-binga-families-2/,The Herald,Zimbabwe,General
77,Renowned author to release book on absent fathers,"Langalakhe Mabena, Zimpapers Arts and Entertainment Hub Female author Nonduduzo Ncube is set to release a book titled Isihlalo Sika Baba on July 18, which focuses on the social,… The post Renowned author to release book on absent fathers appeared first on herald .",2025-07-10,https://www.heraldonline.co.zw/renowned-author-to-release-book-on-absent-fathers-2/,The Herald,Zimbabwe,Social Issues
78,Clement Magwaza’s new album ready,"Langalakhe Mabena, Zimpapers Arts and Entertainment Hub Multi-award-winning Tshibilika musician Clement Magwaza is set to return to the music scene with a new album set to be released on… The post Clement Magwaza’s new album ready appeared first on herald .",2025-07-10,https://www.heraldonline.co.zw/clement-magwazas-new-album-ready-2/,The Herald,Zimbabwe,Entertainment
79,Government orders truck company to repair Trabablas Interchange damage,"Don Makanyanga-Online writer The Ministry of Transport and Infrastructure Development has ordered Tika Chem Investments, a local truck company, to repair the damage caused by one of its trucks at… The post Government orders truck company to repair Trabablas Interchange damage appeared first on herald .",2025-07-10,https://www.heraldonline.co.zw/government-orders-truck-company-to-repair-trabablas-interchange-damage/,The Herald,Zimbabwe,Business
80,‘Torai kupfuya tsuro sebhizimusi’,"Kingstone Mapupu VARIMI vanopfuya tsuro munyika vokurudzirwa kuti vatore basa iri sebhizimusi kuitira kuti vakwanise kuwana pundutso uye kusimudzira chikamu ichi, icho chinobatsira nekuwanisa nyama nezvimwe zvakasiyana-siyana kune voruzhinji. Kurudziro… The post ‘Torai kupfuya tsuro sebhizimusi’ appeared first on herald .",2025-07-10,https://www.heraldonline.co.zw/torai-kupfuya-tsuro-sebhizimusi/,The Herald,Zimbabwe,General
81,Interior minister rebuts rumours about President Zardari ‘resigning’ from office,"Interior Minister Mohsin Naqvi on Thursday rebutted rumours of President Asif Ali Zardari being asked to resign, terming it a “malicious campaign”. “We are fully aware of who is behind the malicious campaign targeting President Asif Ali Zardari, Prime Minister Shahbaz Sharif, and the chief of army staff,” Naqvi wrote on X. “I have categorically stated that there has been no discussion, nor does any such idea exist about the president being asked to resign or the COAS aspiring to assume the presidency,” he asserted. “The president of Pakistan enjoys a strong and respectful relationship with the leadership of the armed forces,” the minister said. He quoted President Zardari as having “clearly” stated: “I know who is spreading these falsehoods, why they are doing so, and who stands to benefit from this propaganda.” Naqvi stressed that the “sole focus” of Chief of Army Staff Field Marshal Asim Munir was Pakistan’s strength and stability, and “nothing else”. “To those involved in this narrative, do whatever you wish in collaboration with hostile foreign agencies. As for us, we will do whatever is necessary to make Pakistan strong again, InshAllah,” Naqvi added. Over the past couple of years, social media campaigns against the army have escalated, reflecting broader tensions within the country’s political and social fabric. The government , as well as the military, have repeatedly warned about “ fake news and propaganda ” proliferating on social media, with military spokesperson Ahmed Sharif Chaudhry saying that not enough was being done against “ digital terrorism ” under the laws. More to follow",2025-07-10,https://www.dawn.com/news/1923280/interior-minister-rebuts-rumours-about-president-zardari-resigning-from-office,Dawn,Pakistan,Politics
82,"Pakistan, China agree on joint media cooperation against fake news","Pakistan and China on Thursday agreed to further enhance ties and joint broadcasting projects between their state broadcasters to tackle fake news and disinformation, Radio Pakistan reported. Pakistan and China share a longstanding strategic partnership rooted in mutual trust, economic cooperation, and regional connectivity. Over the decades, ties have expanded across different sectors, including trade, energy, infrastructure, and media collaboration, with initiatives like the China-Pakistan Economic Corridor (CPEC) symbolising a shared vision for development. The government as well as the military have previously warned about “fake news and propaganda” proliferating on social media, with Inter-Services Public Relations Director General Lieutenant General Ahmed Sharif Chaudhry saying that not enough was being done against “digital terrorism” under the law. The decision was made during a meeting in Beijing between Minister for Information and Broadcasting Attaullah Tarar and Cao Shumin, Deputy Head of the Publicity Department of the Communist Party of China (CPC) Central Committee and Minister and Party Secretary of the National Radio and Television Administration (NRTA). “Both leaders also agreed on a joint narrative against fake news and emphasised technical training and institutional collaboration,” the report said. “They described the ongoing partnership in the media as a reflection of mutual trust and longstanding friendship.” It added that the two sides also held talks related to a proposed agreement between China Central Television (CCTV) and Pakistan Television (PTV) to promote the exchange of information and cooperation. The information minister said Pakistan was ready to translate bilateral media cooperation into practical steps and that state-run media entities — PTV , Radio Pakistan and Associated Press of Pakistan — were playing a crucial role in communicating stories of China’s development, the Belt and Road Initiative , CPEC, cultural ties, and bilateral cooperation to the people of both countries. Per the report, Tarar said PTV was building intellectual and cultural bridges between the two nations by broadcasting Chinese programmes, documentaries and news reports in Urdu. He said APP’s “China News Service” had crossed a significant milestone in effectively conveying Pakistan’s narrative to Chinese readers. Referring to the recent Pakistan-India tensions, the information minister said the youth of China and Pakistan expressed strong solidarity with each other, which went viral on social media. The meeting also discussed exchange visits of digital influencers from both Pakistan and China. Tarar said in the digital age, exchanges between influencers and social media representatives of both countries can inject new energy into bilateral relations. Shumin said China considered Pakistan a trustworthy partner. “Media organisations of Pakistan and China can come closer through the exchange of experiences,” she was quoted as saying in the report. Both sides agreed that media, culture, and people-to-people relations can introduce new dimensions to the Pakistan-China friendship, and these efforts will be further strengthened under a joint strategy. In February, Chinese Ambassador to Pakistan, Jiang Zaidong said , “We are ready to expand cooperation with Pakistan in education, media, think tanks, youth exchanges, and the film and television industries, to foster mutual learning between civilisations and strengthen cultural and people-to-people ties.”",2025-07-10,https://www.dawn.com/news/1923261/pakistan-china-agree-on-joint-media-cooperation-against-fake-news,Dawn,Pakistan,Politics
