id,title,description,date,url,source,country,category
1370,Relationships under strain as Dutch take on England,"ZURICH - Netherlands striker Vivianne Miedema goes up against her English partner Beth Mead on Wednesday when the two countries meet in a key clash at the Women’s European Championship in Zurich, but it is not a subject they are talking about.",2025-07-09,https://www.straitstimes.com/sport/football/relationships-under-strain-as-dutch-take-on-england,The Straits Times,United Kingdom,Sports
1371,Germany and Sweden reach Women’s Euro 2025 quarters,The two teams will face off in Zurich on July 12 to decide who top Group C.,2025-07-09,https://www.straitstimes.com/sport/football/germany-and-sweden-reach-euro-2025-quarters-with-match-to-spare,The Straits Times,Germany,Sports
1372,No scares for Carlos Alcaraz as he blazes past Cameron Norrie into Wimbledon semis,Alcaraz will face American Taylor Fritz in the semi-final after two days of rest.,2025-07-09,https://www.straitstimes.com/sport/tennis/no-scares-for-carlos-alcaraz-as-he-blazes-past-cameron-norrie-into-wimbledon-semis,The Straits Times,United States,Sports
1373,Botafogo appoint Davide Ancelotti as manager,"Botafogo have appointed Davide Ancelotti, the son of Brazil head coach Carlo Ancelotti, as their new manager, the Brazilian club announced on Tuesday.",2025-07-09,https://www.straitstimes.com/sport/football/botafogo-appoint-davide-ancelotti-as-manager,The Straits Times,Brazil,Sports
1374,Lesson from French Open final helps Sabalenka overcome Siegemund,LONDON - World number one Aryna Sabalenka may well have lost to 104th-ranked Laura Siegemund in their Wimbledon quarter-final on Tuesday had the Belarusian not had a period of reflection following her French Open final defeat last month.,2025-07-09,https://www.straitstimes.com/sport/tennis/lesson-from-french-open-final-helps-sabalenka-overcome-siegemund,The Straits Times,United Kingdom,Sports
1375,Aunt Anisimova rocks with Jackson after reaching Wimbledon semis,"LONDON - A year after Amanda Anisimova's attempt to qualify for Wimbledon ended in failure, the American cradled her young nephew on Court One to celebrate a remarkable turnaround in fortunes as she reached the All England Club semi-finals for the first time.",2025-07-09,https://www.straitstimes.com/sport/tennis/aunt-anisimova-rocks-with-jackson-after-reaching-wimbledon-semis,The Straits Times,United Kingdom,Sports
1376,Rallying-Dakar Rally champion Al-Rajhi eyes September return after accident,"Saudi Arabia's Yazeed Al-Rajhi, the reigning Dakar Rally champion, aims to resume competitive racing by September following a serious accident in Jordan that left him with two broken vertebrae.",2025-07-09,https://www.straitstimes.com/sport/rallying-dakar-rally-champion-al-rajhi-eyes-september-return-after-accident,The Straits Times,Jordan,Sports
1377,Daniel Bennett urges fans to come and watch ‘real football’ at inaugural Soccer7sSeries,Several ex-Singapore internationals will be featuring in the July 25-27 tournament at the Jalan Besar Stadium.,2025-07-09,https://www.straitstimes.com/sport/football/daniel-bennett-urges-fans-to-come-and-watch-real-football-at-inaugural-soccer7s-series,The Straits Times,Unknown,Sports
1378,Singapore U-16 girls given footballing lesson in first match of inaugural Lion City Cup girls’ tournament,"They are outclassed 9-0 by South Korea at the Jalan Besar Stadium, with five goals coming in the first half.",2025-07-09,https://www.straitstimes.com/sport/football/singapore-u-16-girls-given-footballing-lesson-in-first-match-of-inaugural-lion-city-cup-girls,The Straits Times,Singapore,Sports
1379,"England must be fearless to get past the Netherlands, says Russo","ZURICH - England will need to be fearless in their crucial Group D match against the Netherlands at the Women's Euros on Wednesday, said striker Alessia Russo, who insisted the team's confidence had not wavered since the 2-1 loss to France in their opener.",2025-07-09,https://www.straitstimes.com/sport/football/england-must-be-fearless-to-get-past-the-netherlands-says-russo,The Straits Times,United Kingdom,Sports
1380,Tadej Pogacar beats Mathieu van der Poel to win Tour de France’s Stage 4 in 100th career victory,The sprint finish was between the top three in the overall standings as Jonas Vingegaard came in third.,2025-07-08,https://www.straitstimes.com/sport/tadej-pogacar-beats-mathieu-van-der-poel-to-win-tour-de-frances-stage-4-in-100th-career-victory,The Straits Times,France,Sports
1381,Sabalenka survives Siegemund spell to reach Wimbledon semis,LONDON - Aryna Sabalenka was dragged into a bygone era on Tuesday and tormented for almost three hours on Wimbledon’s Centre Court before finally imposing her 21st-century power game to beat mesmeric Laura Siegemund for a place in the semi-finals.,2025-07-08,https://www.straitstimes.com/sport/tennis/sabalenka-survives-siegemund-spell-to-reach-wimbledon-semis,The Straits Times,United Kingdom,Sports
1382,Aryna Sabalenka survives Laura Siegemund spell to reach Wimbledon semis,"In the men’s draw, fifth seed Taylor Fritz reached the semi-finals after coming through a four-setter against Karen Khachanov.",2025-07-08,https://www.straitstimes.com/sport/tennis/aryna-sabalenka-survives-laura-siegemund-spell-to-reach-wimbledon-semis,The Straits Times,Unknown,Sports
1383,Wales team unharmed but cancel Euro 2025 training after bus crash,Wales coach Rhian Wilkinson said her players were shaken but otherwise fine after their bus crashed on the way to Stadion St Gallen for training on Tuesday ahead of their Women's Euro 2025 match against France.,2025-07-08,https://www.straitstimes.com/sport/football/wales-team-unharmed-but-cancel-euro-2025-training-after-bus-crash,The Straits Times,France,Sports
1384,Fritz into Wimbledon semis after holding off Khachanov comeback,"LONDON -Fifth seed Taylor Fritz reached the Wimbledon semi-finals for the first time on Tuesday after coming through a topsy-turvy four-setter against Karen Khachanov where the American seemed to be cruising, but then had to show all his fighting spirit.",2025-07-08,https://www.straitstimes.com/sport/tennis/fritz-into-wimbledon-semis-after-holding-off-khachanov-comeback,The Straits Times,United Kingdom,Sports
1385,"Djokovic, Swiatek eye Wimbledon last four as Sinner faces injury worry","Novak Djokovic continues his quest for a record 25th Grand Slam title against Flavio Cobolli and Poland's Iga Swiatek looks to get past Liudmila Samsonova, while Jannik Sinner battles an injury going into the quarter-finals at Wimbledon.",2025-07-08,https://www.straitstimes.com/sport/tennis/djokovic-swiatek-eye-wimbledon-last-four-as-sinner-faces-injury-worry,The Straits Times,Poland,Sports
1386,Buoyant India unperturbed by prospect of spicy Lord's pitch,"LONDON - India expect England to roll out a challenging track for the third test at Lord's but are confident their in-form batters can master it, batting coach Sitanshu Kotak said on Tuesday.",2025-07-08,https://www.straitstimes.com/sport/buoyant-india-unperturbed-by-prospect-of-spicy-lords-pitch,The Straits Times,India,Sports
1387,Ton up for Le Roux against Italy as Springboks pick three new caps,"South Africa fullback Willie le Roux will earn his 100th cap when he starts in Saturday’s second test against Italy in Gqeberha, with Springbok coach Rassie Erasmus also naming three uncapped players among the replacements.",2025-07-08,https://www.straitstimes.com/sport/ton-up-for-le-roux-against-italy-as-springboks-pick-three-new-caps,The Straits Times,Italy,Sports
1388,Speeding likely cause of Diogo Jota car crash: Police,An ongoing investigation is examining “the marks left by one of the vehicle’s wheels” at the accident site in Spain.,2025-07-08,https://www.straitstimes.com/sport/football/speeding-likely-cause-of-diogo-jota-car-crash-police,The Straits Times,Spain,Sports
1389,"Who willingly dives into water from 27m? Brilliant, mad artists, of course","It’s one thing to climb into the sky, another to fall from it.",2025-07-08,https://www.straitstimes.com/sport/who-willingly-dives-into-water-from-27m-brilliant-mad-artists-of-course,The Straits Times,Unknown,Sports
1390,South Africa complete easy victory over Zimbabwe to win test series,"BULAWAYO, Zimbabwe - South Africa completed an innings and 236-run victory over hosts Zimbabwe on the third day of the second test on Tuesday to convincingly sweep the two-match series at Queens Sports Club.",2025-07-08,https://www.straitstimes.com/sport/south-africa-complete-easy-victory-over-zimbabwe-to-win-test-series,The Straits Times,South Africa,Sports
1391,Wimbledon expansion plan under fire from local campaigners,LONDON - Wimbledon's plans to expand the grounds for the world's oldest and most prestigious Grand Slam in tennis came under scrutiny on Tuesday as campaigners' challenge to the expansion began at the High Court in London.,2025-07-08,https://www.straitstimes.com/sport/tennis/wimbledon-expansion-plan-under-fire-from-local-campaigners,The Straits Times,United Kingdom,Sports
1392,Wales lock Carter out of Japan tour after suffering concussion,Wales lock Ben Carter's tour to Japan lasted all of 27 seconds as he was released from the squad on Tuesday after suffering a concussion in Saturday's first test defeat.,2025-07-08,https://www.straitstimes.com/sport/wales-lock-carter-out-of-japan-tour-after-suffering-concussion,The Straits Times,Japan,Sports
1393,Young forward Agyemang hoping to help England take off at Euro 2025,"ZURICH - England's Michelle Agyemang made a big impression in less than 10 minutes at Euro 2025, and she hopes she can make the most of anytime on the pitch when the Lionesses face the Netherlands in a must-win Group D game on Wednesday.",2025-07-08,https://www.straitstimes.com/sport/young-forward-agyemang-hoping-to-help-england-take-off-at-euro-2025,The Straits Times,United Kingdom,Sports
1394,Influencing without the influencers: How fashion and lifestyle brands are taking back social media,"Instead of relying on celebrities, brands are controlling the message by making their own social media videos.",2025-07-10,https://www.straitstimes.com/life/style/influencing-without-the-influencers-how-fashion-and-lifestyle-brands-are-taking-back-social-media,The Straits Times,United States,Culture
1395,All that glitters: Singapore International Jewelry Expo bets on keen luxury spending in 20th edition,A 100-carat diamond will be shown for the first time at Singapore's longest-running gemstone fair.,2025-07-10,https://www.straitstimes.com/life/style/all-that-glitters-singapore-international-jewelry-expo-bets-on-keen-luxury-spending-in-20th-edition,The Straits Times,Singapore,Culture
1396,Singapore coffee brand Alchemist opens its first Japan outlets in Tokyo,"Beyond the Aoyama and Asakusa stores, Alchemist plans to open 10 more across the city by end-2028.",2025-07-10,https://www.straitstimes.com/life/food/singapore-coffee-brand-alchemist-opens-its-first-japan-outlets-in-tokyo,The Straits Times,Singapore,General
1397,"Ne Zha 2, blockbuster Chinese animated film, will get English version",The English-language version will feature the voice of Malaysian actress Michelle Yeoh.,2025-07-10,https://www.straitstimes.com/life/entertainment/ne-zha-2-blockbuster-chinese-animated-film-will-get-english-version,The Straits Times,United States,Entertainment
1398,Ed Sheeran showcases debut collection of Jackson Pollock-esque art,"The abstract pieces will be available to buy, with part of the proceeds going to the Ed Sheeran Foundation.",2025-07-10,https://www.straitstimes.com/life/entertainment/ed-sheeran-showcases-debut-collection-of-jackson-pollock-esque-art,The Straits Times,Unknown,Culture
1399,"Style News: Puma’s Squid Game-inspired collection, K-beauty favourite Amuse now at Watsons",Cosplay as Player 456 in the jerseys and sneakers that hide discreet details recalling Season 3's games.,2025-07-10,https://www.straitstimes.com/life/style/style-news-pumas-squid-game-inspired-collection-k-beauty-favourite-amuse-now-at-watsons,The Straits Times,United States,Sports
1400,"Arts Picks: DnA Fest, Hannes Schmid, NLB Read30",Here is where to get your arts fix this weekend (July 11 to 13).,2025-07-10,https://www.straitstimes.com/life/arts/arts-picks-dna-fest-hannes-schmid-nlb-read30,The Straits Times,Unknown,General
1401,Podcast host and entrepreneur Steven Bartlett will bring his speaking tour to S’pore,"The British entrepreneur became a millionaire at 23, and is also the author of The Diary Of A CEO: The 33 Laws Of Business & Life (2023).",2025-07-10,https://www.straitstimes.com/life/entertainment/podcast-host-and-entrepreneur-steven-bartlett-will-bring-his-speaking-tour-to-spore,The Straits Times,United States,Business
1402,"Show Picks: Concerts by NuNew, Doyoung and My First Story",Actor-singer NuNew rose to fame playing a university student in the Thai romance drama Cutie Pie.,2025-07-10,https://www.straitstimes.com/life/entertainment/show-picks-concerts-by-nunew-doyoung-and-my-first-story,The Straits Times,South Africa,Entertainment
1403,"Film Picks: Superman, The Way We Talk","The new old Superman finally flies in, clad in glory and red underwear.",2025-07-10,https://www.straitstimes.com/life/entertainment/film-picks-superman-the-way-we-talk,The Straits Times,Unknown,Entertainment
1404,My Perfect Weekend with actress Hong Ling,She recently picked up pickleball which she enjoys playing with her friends.,2025-07-10,https://www.straitstimes.com/life/entertainment/my-perfect-weekend-with-actress-hong-ling,The Straits Times,Unknown,Sports
1405,Food Picks: $25.80++ weekday lunch buffet from Hey Kee HK Seafood,"Diners can pick from over 30 Hong Kong-style dishes spanning appetisers, meats, vegetables, rice, noodles and desserts.",2025-07-10,https://www.straitstimes.com/life/food/food-picks-25-80-weekday-lunch-buffet-from-hey-kee-hk-seafood,The Straits Times,Hong Kong,Culture
1406,"Crowdfunding saves Singapore Fringe Festival, which returns in January 2026",The festival organised by The Necessary Stage lost its title sponsor M1 in 2025 after its 21st edition.,2025-07-10,https://www.straitstimes.com/life/arts/crowdfunding-saves-singapore-fringe-festival-which-returns-in-january-2026,The Straits Times,Singapore,General
1407,Food picks: Expanded a la carte menu at Altro Zafferano,The Italian restaurant has dropped its dinner set menus in favour of an expanded range of a la carte options.,2025-07-10,https://www.straitstimes.com/life/food/food-picks-expanded-a-la-carte-menu-at-altro-zafferano,The Straits Times,United States,Culture
1408,Food Picks: Contemporary Asian flavours at one-Michelin-starred Willow,"The $228++ dinner menu is influenced by Chinese, Japanese and Peranakan cuisines.",2025-07-10,https://www.straitstimes.com/life/food/food-picks-contemporary-asian-flavours-at-one-michelin-starred-willow,The Straits Times,China,Culture
1409,Celebrating SG60: Explore Singapore history through 60 objects,"From Lee Kuan Yew’s red box to Joseph Schooling’s shorts, ST's interactive graphic celebrates the things that make Singapore.",2025-07-10,https://www.straitstimes.com/life/arts/explore-singapore-history-through-60-objects,The Straits Times,Singapore,General
1410,Celebrating SG60: 12 key objects from Singapore’s 60-year history,"As Singapore approaches its 60th birthday, here is a look at some items that defined its history.",2025-07-10,https://www.straitstimes.com/life/arts/celebrating-sg60-12-key-objects-from-singapores-60-year-history,The Straits Times,Singapore,General
1411,Best Amazon Prime Day home and kitchen deals for easier cooking and cleaning,Get $20 off your first order.,2025-07-10,https://www.straitstimes.com/life/best-amazon-prime-day-home-kitchen-deals,The Straits Times,Unknown,Technology
1412,KFC launches chilli crab-inspired meals in celebration of National Day,They will be available from July 23 to Sept 2.,2025-07-09,https://www.straitstimes.com/life/kfc-launches-chilli-crab-inspired-meals-in-celebration-of-national-day,The Straits Times,Unknown,General
1413,US star Scarlett Johansson is highest-grossing lead actor globally,The 40-year-old actress surpasses Marvel stars Samuel L. Jackson and Robert Downey Jr.,2025-07-09,https://www.straitstimes.com/life/entertainment/us-star-scarlett-johansson-is-highest-grossing-lead-actor-globally,The Straits Times,United States,Entertainment
1414,Actor Chen Bo-lin to wed girlfriend after dating for 13 years,The couple are planning to hold a wedding in New Zealand in late 2025.,2025-07-09,https://www.straitstimes.com/life/entertainment/actor-chen-bo-lin-to-wed-girlfriend-after-dating-for-13-years,The Straits Times,New Zealand,Entertainment
1415,"'We're AI', popular indie rock band Velvet Sundown admit",The digital group has generated ferocious online discussion after racking up hundreds of thousands of listens.,2025-07-09,https://www.straitstimes.com/life/entertainment/were-ai-popular-indie-rock-band-velvet-sundown-admits,The Straits Times,United States,Technology
1416,Mattel launches Barbie doll with diabetes,The new doll wears a CGM – a small device that continuously measures a person’s blood sugar.,2025-07-09,https://www.straitstimes.com/life/mattel-launches-barbie-doll-with-diabetes,The Straits Times,United States,General
1417,Can reheated Superman and The Fantastic Four make superhero comic-book movies great again?,Film studios are counting on these brand names from big-screen reboots in July to revive the genre.,2025-07-09,https://www.straitstimes.com/life/entertainment/can-reheated-superman-and-the-fantastic-four-make-superhero-comic-book-movies-great-again,The Straits Times,South Africa,Entertainment
1418,"We could be heroes: Cast, director of rebooted Superman want to bring back hope and optimism",Writer-director James Gunn’s version stars David Corenswet and is the first movie in the new DC Universe.,2025-07-09,https://www.straitstimes.com/life/entertainment/we-could-be-heroes-cast-director-of-rebooted-superman-want-to-bring-back-hope-and-optimism,The Straits Times,Unknown,Culture
1419,Netflix hit Stranger Things returns for 13th edition of USS Halloween Horror Nights,This is Universal Studios Singapore's fourth collaboration with Netflix.,2025-07-09,https://www.straitstimes.com/life/entertainment/netflix-hit-stranger-things-returns-for-13th-edition-of-uss-halloween-horror-nights,The Straits Times,United States,Entertainment
1420,At The Movies: Netflix sequel The Old Guard 2 squanders immortal potential,The immortal fighters led by Charlize Theron are back in the supernatural action movie.,2025-07-09,https://www.straitstimes.com/life/entertainment/at-the-movies-netflix-sequel-the-old-guard-2-squanders-immortal-potential,The Straits Times,Unknown,Entertainment
1421,"At The Movies: Dreams (Sex Love) a Nordic Bridget Jones’s Diary, Heads Of State is cheerfully insane",Reviews of the Norwegian queer romance and John Cena-Idris Elba buddy comedy.,2025-07-09,https://www.straitstimes.com/life/entertainment/at-the-movies-dreams-sex-love-a-nordic-bridget-joness-diary-heads-of-state-is-cheerfully-insane,The Straits Times,South Africa,Entertainment
1422,"Kit Chan, Taufik Batisah and more to perform at free National Day concert at Gardens by the Bay","The show will take place at The Meadow, Gardens by the Bay, on Aug 3.",2025-07-08,https://www.straitstimes.com/life/entertainment/kit-chan-taufik-batisah-and-more-to-perform-at-free-national-day-concert-at-gardens-by-the-bay,The Straits Times,Unknown,Entertainment
1423,"Actor Lee Lung Kei, 74, welcomes fiancee, 37, with 60 roses after her release from jail",Their relationship has been in the spotlight due to their huge age gap.,2025-07-08,https://www.straitstimes.com/life/entertainment/actor-lee-lung-kei-74-welcomes-fiancee-37-with-60-roses-after-her-release-from-jail,The Straits Times,South Africa,Entertainment
1424,Actor Shane Pow’s sub-$100 Star Awards 2025 get-up was from Taobao,Pow was nominated for the BYD Favourite Male Character Award for his role in Unforgivable.,2025-07-08,https://www.straitstimes.com/life/entertainment/actor-shane-pows-sub-100-star-awards-2025-get-up,The Straits Times,Unknown,Entertainment
1425,Almost 300-year-old tree moved to make way for road widening,"Environmentalists fear ancient quebracho tree in Villa Allende, near Córdoba, will not survive transplant operation ordered by municipal government to allow road expansion. Leer más",2025-07-10,https://www.batimes.com.ar/news/argentina/almost-300-year-old-tree-moved-to-make-way-for-road-widening.phtml,Buenos Aires Times,Argentina,Environment
1426,Trump unveils 50% Brazil levy in response to Bolsonaro trial,US President Donald Trump announces 50% tariff targeting Brazil as he blasted the trial of the country's ex-leader Jair Bolsonaro. Leer más,2025-07-10,https://www.batimes.com.ar/news/latin-america/trump-unveils-50-brazil-levy-in-response-to-bolsonaro-trial.phtml,Buenos Aires Times,Brazil,Politics
1427,New Carlos Menem series hits the small screen,"Amazon’s Prime Video streaming service premieres new series about Argentina’s former president Carlos Menem, who led the nation from 1989 to 1999, on Independence Day. Leer más",2025-07-09,https://www.batimes.com.ar/news/culture/new-carlos-menem-series-hits-the-small-screen.phtml,Buenos Aires Times,Argentina,Entertainment
1428,Trips to Miami or living month-to-month – Argentina’s ‘rift’ hits consumers,"The disparity in purchasing power in Argentina has accentuated in the past year, according to a private study. One sector travels to Miami and the other can’t make it to the end of the month. What happened? Leer más",2025-07-09,https://www.batimes.com.ar/news/economy/trips-to-miami-or-living-month-to-month-argentinas-rift-hits-consumers.phtml,Buenos Aires Times,Argentina,Conflict
1429,"La Libertad Avanza, PRO ink alliance in Buenos Aires Province","Parties led by Macri and Milei agree to join forces in key battleground region for September 7 election; Alliance, formalised by Ritondo and Pareja, offers a united front against Kirchnerism on Peronism’s home turf. Leer más",2025-07-09,https://www.batimes.com.ar/news/argentina/la-libertad-avanza-pro-ink-alliance-in-buenos-aires-province.phtml,Buenos Aires Times,South Africa,Politics
1430,Boca Juniors fans called to La Bombonera for Leandro Paredes’ coming home party,"""Thursday, 6pm, La Bombonera,"" read a message on the club’s official X account posted Tuesday. Leer más",2025-07-09,https://www.batimes.com.ar/news/sports/boca-juniors-fans-called-to-la-bombonera-for-leandro-paredes-coming-home-party.phtml,Buenos Aires Times,United States,General
1431,Milei's approval rating holds as Argentines worry more about jobs,Milei’s approval rating and positive image remains well above domestic peers even as Argentines became increasingly worried about the job market. Leer más,2025-07-08,https://www.batimes.com.ar/news/argentina/mileis-approval-rating-holds-as-argentines-worry-more-about-jobs.phtml,Buenos Aires Times,Unknown,Business
1432,Prices in Buenos Aires City rose 2.1 percent in June,"Monthly inflation picks up slightly; Housing, transport and financial services drive cost-of-living up, rising half a point from May. Leer más",2025-07-08,https://www.batimes.com.ar/news/economy/prices-in-buenos-aires-city-rose-21-percent-in-june.phtml,Buenos Aires Times,United States,Business
1433,"Milei shutters agencies, looks private for roads, road safety","State agencies in charge of roads and highways will be shuttered to make way for a new entity created to oversee private road construction; Several other bodies, including institutes dedicated to industrial tech, agricultural development and wine also eliminated as special delegated powers expire. Leer más",2025-07-08,https://www.batimes.com.ar/news/economy/milei-shutters-agencies-looks-private-for-roads-road-safety.phtml,Buenos Aires Times,United States,Technology
1434,"Santiago Caputo, Milei’s secret weapon, disrupts domestic politics","Top adviser is upending Argentine politics amid rumoured tension with the President’s sister, Karina Milei, ahead of crucial midterm vote. Leer más",2025-07-08,https://www.batimes.com.ar/news/opinion-and-analysis/santiago-caputo-mileis-secret-weapon-disrupts-domestic-politics.phtml,Buenos Aires Times,United States,Politics
1435,Emotional Ángel Di María finally returns home to boyhood side Rosario Central,“This is more than I ever dreamed of” – Argentina’s World Cup hero breaks down in tears as he rejoins his boyhood club after 18 seasons in Europe. Leer más,2025-07-08,https://www.batimes.com.ar/news/sports/emotional-angel-di-maria-finally-returns-home-to-boyhood-side-rosario-central.phtml,Buenos Aires Times,Unknown,Entertainment
1436,Abuelas de Plaza de Mayo identify 140th grandchild born in dictatorship captivity,Rights group announces discovery of new grandchild of disappeared parents; Child of Graciela Romero and Raúl Metz was born in a secret detention centre in 1977. Leer más,2025-07-07,https://www.batimes.com.ar/news/argentina/abuelas-de-plaza-de-mayo-identify-140th-grandchild-born-in-dictatorship-captivity.phtml,Buenos Aires Times,South Africa,Science
1437,"Trump, Brazil's Lula clash over politically charged coup trial","US-Brazil relations slide into crisis after Trump criticised the high-profile coup trial of right-wing ally, ex-president Jair Bolsonaro, and Lula snaps back. Leer más",2025-07-07,https://www.batimes.com.ar/news/latin-america/trump-brazils-lula-clash-over-politically-charged-coup-trial.phtml,Buenos Aires Times,Brazil,Conflict
