id,title,description,date,url,source,country,category
371,Sri Lanka approach BCCI for limited-overs series after Bangladesh tour gets cancelled,"Sri Lanka Cricket has proposed a six-match white-ball series against India in August 2025, following the postponement of India's tour to Bangladesh. The BCCI is evaluating the proposal, considering the Asia Cup schedule and consulting with players and coaches, including discussions during the Lord's Test.",2025-07-10,https://timesofindia.indiatimes.com/sports/cricket/news/cricket-sri-lanka-approach-bcci-for-limited-overs-series-after-bangladesh-tour-gets-cancelled-says-report/articleshow/122355204.cms,Times of India,India,Sports
372,MLC: Boult stars with the bat as MI NY edge Unicorns in Eliminator,"Trent Boult's stellar performance with both bat and ball propelled MI New York to a thrilling victory over the San Francisco Unicorns in the Major League Cricket Eliminator. Boult's unbeaten 22, including crucial sixes, secured the win after MI NY bowlers initially dismantled SFU's top order.",2025-07-10,https://timesofindia.indiatimes.com/sports/cricket/major-league-cricket/mlc-2025-trent-boult-stars-with-the-bat-as-mi-new-york-edge-san-francisco-unicorns-in-eliminator/articleshow/122358106.cms,Times of India,India,Sports
373,"Momentum the keyword as India, England eye series lead at Lord's","India and England are set to clash in the crucial third Test at Lord's, with the series tied 1-1. India, led by Shubman Gill, carries momentum from their Edgbaston victory. Vice-captain Rishabh Pant emphasized the importance of maintaining this momentum despite the short turnaround.",2025-07-10,https://timesofindia.indiatimes.com/sports/cricket/india-tour-of-england/ind-vs-eng-3rd-test-momentum-the-keyword-as-india-england-eye-series-lead-at-lords/articleshow/122353516.cms,Times of India,India,Sports
374,India women register first-ever T20I series win in England; take 3-1 lead,"In a historic moment, the Indian women's cricket team clinched their first T20I series victory in England on July 9, 2025, mirroring India's first ODI series win on the same date 26 years prior. India secured a dominant six-wicket win at Old Trafford, Manchester, with Jemimah Rodrigues hitting the winning runs.",2025-07-10,https://timesofindia.indiatimes.com/sports/cricket/news/india-women-register-first-ever-t20i-series-win-in-england-take-unassailable-3-1-lead/articleshow/122354861.cms,Times of India,India,Sports
375,"T20 WC Qualifier: Italy shock Scotland, close in on maiden spot in extravaganza","Italy are on the cusp of their first T20 World Cup qualification after a crucial 12-run victory over Scotland in the Europe Regional Final. Led by Joe Burns, Italy's strong net run rate gives them a significant advantage. Also in contention are Netherlands and Jersey.",2025-07-10,https://timesofindia.indiatimes.com/sports/cricket/news/t20-world-cup-qualifier-italy-shock-scotland-close-in-on-maiden-spot-in-extravaganza-in-india-sri-lanka/articleshow/122356355.cms,Times of India,India,Sports
376,"HCA president, four others arrested; Azharuddin demands investigation","Telangana CID detained Hyderabad Cricket Association president A Jagan Mohan Rao and four other officials for questioning, following Sunrisers Hyderabad's allegations of blackmail for complimentary tickets during the 2025 IPL season.",2025-07-10,https://timesofindia.indiatimes.com/sports/cricket/news/hyderabad-cricket-association-president-four-others-arrested-in-ipl-ticket-controversy-mohammed-azharuddin-demands-hca-be-disbanded/articleshow/122354850.cms,Times of India,India,Sports
377,"Sunil Gavaskar turns 76: Celebrating the first man to 10,000 Test runs","Sunil Gavaskar, the Indian cricket legend, celebrates his 76th birthday, revered as one of the greatest batters. Gavaskar's remarkable achievements, including being the first to reach 10,000 Test runs and his stunning debut series against the West Indies, laid the foundation for India's cricketing prowess. His courage and consistency inspired a nation, proving India could compete with the world's best.",2025-07-10,https://timesofindia.indiatimes.com/sports/cricket/news/sunil-gavaskar-turns-76-celebrating-the-first-man-to-10000-test-runs/articleshow/122353763.cms,Times of India,India,Sports
378,"Ajit Agarkar, Gautam Gambhir don’t get enough credit: Yuvraj Singh","At a charity event in London, former cricket stars lauded India's Edgbaston victory, with Yuvraj Singh crediting selectors Ajit Agarkar and coach Gautam Gambhir for the team's success. Singh praised Shubman Gill's leadership and Rishabh Pant's resilience. Virat Kohli humorously acknowledged his age while Ravi Shastri attributed India's aggressive Test approach to Kohli's influence.",2025-07-10,https://timesofindia.indiatimes.com/sports/cricket/news/ajit-agarkar-gautam-gambhir-dont-get-enough-credit-yuvraj-singh/articleshow/122355153.cms,Times of India,India,Sports
379,Jasprit Bumrah vs Jofra Archer at Lord’s adds fire to India-England Test clash,"The highly anticipated Lord's Test between India and England is set to ignite with the expected return of pace spearheads Jasprit Bumrah and Jofra Archer. Both teams have been carefully managing their prized assets, with Bumrah returning under a workload plan and Archer ready for full throttle.",2025-07-10,https://timesofindia.indiatimes.com/sports/cricket/india-tour-of-england/ind-vs-eng-3rd-test-jasprit-bumrah-vs-jofra-archer-at-lords-adds-fire-to-india-england-test-clash/articleshow/122355927.cms,Times of India,India,Sports
380,IND vs ENG 3rd Test: Lord’s pitch under spotlight as India eye momentum shift,"Ahead of the crucial third Test at Lord's, the greener pitch has sparked discussions, contrasting with the flat tracks of previous matches. India, buoyed by their Edgbaston victory, appeared relaxed, with Pant emphasizing adaptability over focusing on England's strategies.",2025-07-10,https://timesofindia.indiatimes.com/sports/cricket/india-tour-of-england/ind-vs-eng-3rd-test-lords-pitch-under-spotlight-as-india-eye-momentum-shift/articleshow/122356300.cms,Times of India,India,Sports
381,'England have got plans': Ben Stokes on stopping Shubman Gill,"Shubman Gill's incredible form, highlighted by twin centuries in the second Test, propelled India to a dominant victory over England, leveling the series 1-1. As Gill aims to continue his stellar run at Lord's, England captain Ben Stokes acknowledges the challenge and reveals Jofra Archer's return to the playing XI, hoping his presence will shift the momentum.",2025-07-09,https://timesofindia.indiatimes.com/sports/cricket/india-tour-of-england/england-have-got-plans-ben-stokes-on-stopping-run-machine-shubman-gill-ind-vs-eng-3rd-test-to-start-july-10/articleshow/122342994.cms,Times of India,India,Sports
382,"Live: Blues, Voss try to turn terrible week into Lions upset","Following another week of turmoil at Carlton, the Blues and coach Michael Voss go to Docklands, looking to turn things round against the defending premiers. Follow all the action in our live blog.",2025-07-10,https://www.abc.net.au/news/2025-07-10/afl-round-18-blues-lions-live-blog/105512594,ABC Australia,Australia,Sports
383,Former Melbourne great Brian Dixon dies aged 89,"Remembered for an iconic public health campaign and for making Victoria a leader in road safety, the AFL Hall of Famer also racked up more than 250 games for Melbourne and five premierships.",2025-07-10,https://www.abc.net.au/news/2025-07-10/brian-dixon-death-afl-politician/105517750,ABC Australia,Australia,Health
384,Magpies member banned for five years over Voss threat,"The AFL, the MCG and Collingwood have punished an unnamed Magpies member who sent a threatening message about Carlton coach Michael Voss.",2025-07-10,https://www.abc.net.au/news/2025-07-10/afl-collingwood-member-banned-for-michael-voss-death-threats/105518690,ABC Australia,Australia,Sports
385,Paralympians express upset and disappointment over swimming venues for LA28,"Paralympians have taken to social media to express their anger over separate Olympic and Paralympic swimming venues, at LA in 2028.",2025-07-10,https://www.abc.net.au/news/2025-07-10/paralympic-swimming-la28-olympics-venues-swimming/105515476,ABC Australia,Australia,Sports
386,I should 'most definitely' stay NSW's coach: Daley,Laurie Daley insists he is the right man to coach NSW in 2026 after his comeback State of Origin series ended in capitulation.,2025-07-10,https://www.abc.net.au/news/2025-07-10/blues-coach-laurie-daley-says-he-should-stay-on-state-of-origin/105516538,ABC Australia,Australia,Conflict
387,"After Origin III, Tom Dearden walks with Queensland legends","State of Origin is about rising to the occasion, but Tom Dearden's performance in the decider proved that rising above it is what makes Queensland heroes.",2025-07-10,https://www.abc.net.au/news/2025-07-10/tom-dearden-queensland-state-of-origin/105516524,ABC Australia,Australia,Sports
388,Gigante takes giant leap with Giro Donne stage win,"Sarah Gigante rebounds from iliac artery surgery to claim the biggest win of her stop-start career, soloing to victory on stage four at the Giro d'Italia Donne.",2025-07-10,https://www.abc.net.au/news/2025-07-10/sarah-gigante-claims-giro-d-italia-donne-stage-four-win/105515888,ABC Australia,Australia,General
389,Why the Cats are again in the hunt for the AFL flag,"Geelong's game plan evolves each season, but there are common elements that make the Cats finals contenders on a regular basis.",2025-07-10,https://www.abc.net.au/news/2025-07-10/afl-geelong-cats-in-hunt-for-afl-flag-2-25/105515444,ABC Australia,Australia,Sports
390,Horner says leading Red Bull was 'biggest privilege',Christian Horner gives an emotional farewell to staff after being sacked as Red Bull's Formula 1 boss.,2025-07-09,https://www.abc.net.au/news/2025-07-10/formula-1-red-bull-christian-horner-speaks-after-sacking/105515192,ABC Australia,Australia,General
391,Were you paying attention to last night's State of Origin decider?,This year's State of Origin series is done and dusted. But were you paying attention?,2025-07-09,https://www.abc.net.au/news/2025-07-10/state-of-origin-game-three-quiz/105515032,ABC Australia,Australia,Sports
392,Cleary admits he has not delivered in Origin as Blues reflect on series loss,"Nathan Cleary concedes his doubters are right to question his track record at State of Origin level, admonishing himself following the Blues' loss in the series decider.",2025-07-09,https://www.abc.net.au/news/2025-07-10/state-of-origin-nathan-cleary-blues-lose-to-maroons/105514890,ABC Australia,Australia,Sports
393,"Evenepoel wins Tour de France time trial, Pogačar takes yellow jersey",Remco Evenepoel lives up to his favourite's tag in the individual time trial by winning stage five of the Tour de France as defending champion Tadej Pogačar's tops the general classification.,2025-07-09,https://www.abc.net.au/news/2025-07-10/tour-de-france-remco-evenepoel-tadej-pogacar/105514764,ABC Australia,Australia,Legal
394,Djokovic survives early scare to set up Wimbledon clash with Sinner,"Chasing a 25th major singles title, Novak Djokovic gets past Flavio Cobolli in the quarterfinals, while world number one Jannik Sinner also wins through to the last four.",2025-07-09,https://www.abc.net.au/news/2025-07-10/wimbledon-djokovic-cobolii-sinner-shelton/105514716,ABC Australia,Australia,General
395,Świątek reaches first Wimbledon semi and Bencic snaps Swiss drought,Former world number one Iga Świątek achieves a career first at the All-England Club as she sets up a semifinal date with unseeded Swiss Belinda Bencic.,2025-07-09,https://www.abc.net.au/news/2025-07-10/wimbledon-swiatek-bencic-samsonova-andreeva-quarterfinals/105514694,ABC Australia,Australia,General
396,Papali'i's heroic Origin return capped by touching moment with son,"After Josh Papali'i returns for one last glorious State of Origin hurrah, on a night when family means everything, his son Noah steals the show with a gorgeous, heartwarming moment.",2025-07-09,https://www.abc.net.au/news/2025-07-10/josh-papalii-origin-return-capped-by-touching-moment-with-son/105514490,ABC Australia,Australia,Sports
397,Queensland's shock decider victory impossible and entirely predictable,"If ever there was a game that proved all the State of Origin hyperbole and jabber were true, Queensland's victory to seal the 2025 series was it.",2025-07-09,https://www.abc.net.au/news/2025-07-10/state-of-origin-iii-decider-queensland-maroons-analysis/105507810,ABC Australia,Australia,Sports
398,Munster finds moments among grief and noise for his mightiest match,"Cameron Munster has enough legendary State of Origin performances to put him among the all-time greats, but this one felt like it was just for him, his family and his mates.",2025-07-09,https://www.abc.net.au/news/2025-07-09/state-of-origin-iii-decider-queensland-maroons-cameron-munster/105513524,ABC Australia,Australia,Sports
399,"For a Blues team that was supposed to be different, it was the same old story","After what they did together last year, this New South Wales team was supposed to be different. But in the aftermath of Origin III, it's the same old story for the battered Blues.",2025-07-09,https://www.abc.net.au/news/2025-07-09/state-of-origin-game-three-nsw-blues-lose-their-way/105513656,ABC Australia,Australia,Sports
400,Five quick hits — how one man dominated and went down in Maroons folklore,Tom Dearden etches his name in Queensland folklore in one of the most complete performances in Origin history.,2025-07-09,https://www.abc.net.au/news/2025-07-09/five-quick-hits-game-3-maroons-tom-dearden/105513188,ABC Australia,Australia,Sports
401,Red Bull sacks team principal Christian Horner with 'immediate effect',"Red Bull has sacked team principal Christian Horner after 20 years in the position, the Formula 1 team has announced.",2025-07-09,https://www.abc.net.au/news/2025-07-09/red-bull-sacks-team-principal-christian-horner/105513672,ABC Australia,Australia,Sports
402,Crows players fined after ignoring directions to not wear metal studs,The AFL fines Ben Keays and Josh Rachele after the two Adelaide players repeatedly ignored directions to not wear metal studs on their boots.,2025-07-09,https://www.abc.net.au/news/2025-07-09/ben-keays-and-josh-rachele-fined-over-metal-studs/105513640,ABC Australia,Australia,Sports
403,Injury worries grow for Lions during win over resilient Brumbies,"A full-strength British and Irish Lions have maintained their unbeaten run in Australia, with a 36-24 win over the ACT Brumbies.",2025-07-09,https://www.abc.net.au/news/2025-07-09/british-and-irish-lions-live-act-brumbies-tour-match-canberra/105498642,ABC Australia,Australia,Sports
404,'One proud dad sitting up there': Slater in awe of Munster's Origin display,An emotional Queensland team stuns New South Wales to win for grieving skipper Cameron Munster in the decider in Sydney.,2025-07-09,https://www.abc.net.au/news/2025-07-09/state-of-origin-game-3-live-nsw-blues-vs-queensland-maroons/105506802,ABC Australia,Australia,Sports
405,Ready for State of Origin Game III? Here's what to know ahead of kick-off,The State of Origin series is still anyone's game as we head into a blockbuster decider. Here's what to know about the series finale.,2025-07-09,https://www.abc.net.au/news/2025-07-09/state-of-origin-game-iii-kick-off-team-lists/105513098,ABC Australia,Australia,Sports
406,Wallabies urged to inject experience into Test squad after Lolesio injury,"The Wallabies are encouraged to include an experienced playmaker, such as James O'Connor, in their squad for the upcoming British and Irish Lions Test series.",2025-07-09,https://www.abc.net.au/news/2025-07-09/wallabies-james-o-connor-noah-lolesio-british-and-irish-lions/105512190,ABC Australia,Australia,Sports
407,Export ban for Taiwan firms a stern warning for separatist forces: Beijing,"Beijing has banned the export of dual-use items to eight Taiwan-based aerospace and shipbuilding companies, including suppliers to the Taiwanese military.
The move, announced by the Ministry of Commerce on Wednesday, was described by the mainland’s Taiwan Affairs Office (TAO) as a “stern warning against repeated provocations by separatist forces”.
According to the ministry, the companies, which include defence supplier Aerospace Industrial Development Corporation (AIDC), have been placed on an...",2025-07-09,https://www.scmp.com/news/china/politics/article/3317470/taiwan-aerospace-shipbuilding-hit-beijing-export-ban?utm_source=rss_feed,South China Morning Post,China,Politics
408,China tried to cut lavish spending. Now some officials fear ordering coffee,"This is the first story in a three-part series exploring the domestic economic challenges China faces as it navigates an unprecedented trade war with the United States. In this piece, we explore Beijing’s drive to rein in wasteful government spending – and its unintended consequences.
Wang, a civil servant from a small town in northeastern China, is too scared to go to restaurants these days. He even skipped his niece’s wedding due to his fear of being seen at a banquet.
An avid foodie, the...",2025-07-08,https://www.scmp.com/economy/china-economy/article/3317362/china-told-its-officials-tighten-their-belts-did-they-go-notch-too-far?utm_source=rss_feed,South China Morning Post,China,Politics
409,China needs to help young students facing unique pressures in age of AI,"Suicide rates among adolescents in China reveal an unusual pattern: some studies show that those from more affluent families and with better-educated parents are at a higher risk of taking their own lives compared with those from less privileged backgrounds.
This stands in stark contrast to trends observed in many other countries, where children from poorer families and those exposed to domestic violence are more likely to attempt suicide.
However, this does not imply that children from poorer...",2025-07-08,https://www.scmp.com/news/china/politics/article/3317433/chinas-youth-facing-unique-academic-pressures-age-ai-need-helping-hand?utm_source=rss_feed,South China Morning Post,China,Politics
410,‘Treated like servants’: Taiwan on edge as US tariff deadline passes,"Anxiety is running high in Taiwan as the island nervously awaits the outcome of its tariff negotiations with the United States, amid growing concern it could be hit with duties of 25 per cent or higher – well above the 10 per cent rate Taipei had hoped for.
The worry stems from US President Donald Trump’s sweeping tariff regime, announced in April, which gave trade partners 90 days to negotiate new terms or face tariffs mirroring those imposed on US exports.
With the grace period now over,...",2025-07-08,https://www.scmp.com/news/china/politics/article/3317425/taiwan-edge-trumps-tariff-deadline-passes-out-bargaining-chips?utm_source=rss_feed,South China Morning Post,China,Politics
411,8 detained in China after high lead levels detected in kindergarten children,"Police have detained eight people accused of lead poisoning after more than 200 children in a kindergarten in the northwestern province of Gansu were found to have elevated lead levels in their blood, sparking widespread public outrage and concern.
The principal of the kindergarten in Maiji district in Tianshui, surnamed Zhu, was detained together with a local investor named Li and six canteen staff on suspicion of “producing toxic and harmful food”.
Two others have been placed on police bail...",2025-07-08,https://www.scmp.com/news/china/politics/article/3317413/8-detained-china-lead-poisoning-after-high-levels-detected-kindergarten-children?utm_source=rss_feed,South China Morning Post,China,Politics
412,Wuhan mayor who defended city’s slow response to Covid faces corruption probe,"The former mayor of Wuhan, whose handling of the early stages of the Covid-19 outbreak was widely criticised, has been placed under investigation for corruption.
On Tuesday, the Central Commission for Discipline Inspection, the country’s top anti-corruption body, said Zhou Xianwang was being investigated for suspected “serious violations of discipline and law” – the standard euphemism for corruption.
Zhou was best known for defending the city authorities’ widely criticised response to the early...",2025-07-08,https://www.scmp.com/news/china/politics/article/3317377/wuhan-mayor-best-known-defending-citys-slow-response-covid-faces-corruption-probe?utm_source=rss_feed,South China Morning Post,China,Politics
413,Alarms ring in Taipei as Beijing activates another Taiwan Strait flight route,"Beijing’s sudden activation of another civilian air route near the Taiwan Strait’s unofficial median line has renewed alarm in Taipei, with defence experts and lawmakers warning the move could raise the risk of miscalculation in an already tense air corridor.
The mainland’s Civil Aviation Administration activated the last of three branches off the M503 north-south flight path through the strait on Sunday.
The M503 and its offshoots were established in 2015 to connect various cities along the...",2025-07-08,https://www.scmp.com/news/china/politics/article/3317268/alarms-ring-taipei-beijing-activates-another-taiwan-strait-flight-route?utm_source=rss_feed,South China Morning Post,China,Politics
414,China protests over Indian PM Narendra Modi’s birthday greetings to Dalai Lama,"China has protested to India over birthday greetings sent to the Dalai Lama by Prime Minister Narendra Modi.
“India should fully appreciate the great sensitivity of Tibet-related issues, recognise the separatist nature, honour the commitments it has made to China related to Tibet-related issues, and act prudently, and stop using these issues to meddle in China’s internal affairs,” Chinese foreign ministry spokeswoman Mao Ning said on Monday afternoon.
She added that Beijing had lodged a protest...",2025-07-07,https://www.scmp.com/news/china/politics/article/3317261/china-protests-narendra-modis-birthday-greeting-dalai-lama?utm_source=rss_feed,South China Morning Post,China,Politics
415,New Communist Party rules hint Xi Jinping is delegating more power to deputies,"New rules on certain Communist Party organs suggest China’s ruling party is aiming to standardise its decision-making process and that President Xi Jinping might be delegating more of his power, according to observers.
The 24-member Politburo, the party’s top echelon, on Monday reviewed new rules that would apply to the various “party coordinative institutes” – organisations aimed at coordinating cross-agency policies in a specific area.
Specifically, these refer to party “central commissions”...",2025-07-06,https://www.scmp.com/news/china/politics/article/3317101/new-communist-party-rules-hint-chinas-xi-jinping-delegating-more-power-deputies?utm_source=rss_feed,South China Morning Post,China,Politics
416,Is Taiwan’s Lai rewriting ROC history ahead of WWII anniversary?,"As Taiwan prepares to mark the 80th anniversary of the end of World War II, controversy is hanging over the administration of Taiwanese leader William Lai Ching-te as it faces criticism over its handling of the Republic of China’s (ROC) wartime legacy.
The Lai government has used commemorations under the theme “Resist Aggression, Protect the Homeland” to warn retired ranking officers – many affiliated with the main opposition Kuomintang (KMT) – not to attend Beijing’s September 3 military...",2025-07-05,https://www.scmp.com/news/china/politics/article/3316999/taiwan-caught-wwii-revisionist-dilemma-lai-reshapes-wartime-legacy?utm_source=rss_feed,South China Morning Post,China,Politics
417,Beijing taps personnel veteran Xu Qifang for Hong Kong and Macau post,"Beijing has appointed Xu Qifang, a former Communist Party personnel official, to the second-most senior position in the top body managing Hong Kong and Macau affairs.
Xu, 60, the former deputy chief of the party’s Organisation Department has become the executive deputy director of the Hong Kong and Macau Affairs Office, according to several sources.
The sources said Xu would be promoted from deputy ministerial to full ministerial rank. As the office’s executive director, Xu reports to director...",2025-07-04,https://www.scmp.com/news/china/politics/article/3316942/beijing-taps-personnel-veteran-xu-qifang-hong-kong-and-macau-post?utm_source=rss_feed,South China Morning Post,China,Politics
418,China tells EU it does not want to see Russia lose its war in Ukraine: sources,"Chinese Foreign Minister Wang Yi told the European Union’s top diplomat on Wednesday that Beijing did not want to see a Russian loss in Ukraine because it feared the United States would then shift its whole focus to Beijing, according to several people familiar with the exchange.
The comment, to the EU’s Kaja Kallas, would confirm what many in Brussels believe to be Beijing’s position but jar with China’s public utterances. The foreign ministry regularly says China is “not a party” to the war....",2025-07-03,https://www.scmp.com/news/china/diplomacy/article/3316875/china-tells-eu-it-cannot-afford-russian-loss-ukraine-war-sources-say?utm_source=rss_feed,South China Morning Post,China,Politics
