id,title,description,date,url,source,country,category
800,"Canadian wildfire smoke ruining Americans' summer, says letter from Congress members",,2025-05-05,https://www.cbc.ca/news/world/canadian-wildfire-smoke-ruining-americans-summer-1.7580738?cmp=rss,CBC,United States,Conflict
801,Day school survivors legacy fund now open for funding requests,,2025-07-09,https://www.cbc.ca/news/indigenous/day-school-legacy-fund-opens-1.7581070?cmp=rss,CBC,Unknown,Education
802,Blue Jays fall short of matching franchise's all-time win streak in loss to White Sox,"Adrian Houser tossed seven solid innings, and the Chicago White Sox stopped Toronto's 10-game winning streak, beating the Blue Jays 2-1 on Wednesday.",2025-07-09,https://www.cbc.ca/sports/baseball/mlb/toronto-blue-jays-chicago-white-sox-recap-july-9-1.7581212?cmp=rss,CBC,United States,Sports
803,B.C. report urges greater support for community organizers in aftermath of Lapu-Lapu Day festival tragedy,,2025-04-27,https://www.cbc.ca/news/canada/british-columbia/festival-safety-report-1.7580850?cmp=rss,CBC,Unknown,Social Issues
804,Canadian cyclist calls for improved rider safety after latest crash-riddled start to Tour de France,"Following a chaotic, crash-riddled start to the Tour de France, Canadian cyclist Michael Woods has publicly shared his thoughts on rider safety and how the subject can better be addressed by organizers.",2025-07-09,https://www.cbc.ca/sports/olympics/summer/cycling/michael-woods-blog-rider-safety-tour-de-france-1.7580998?cmp=rss,CBC,Canada,Sports
805,"Woman, 76, found dead in Charlottetown apartment elevator shaft, police confirm","A 76-year-old woman was found dead in the bottom of an elevator shaft of a Charlottetown apartment building last month, Charlottetown Police Services confirmed on Wednesday.",2025-07-09,https://www.cbc.ca/news/canada/prince-edward-island/pei-senior-elevator-death-1.7580715?cmp=rss,CBC,Unknown,General
806,Ex-MLSE boss Tim Leiweke indicted in U.S. arena bid-rigging scheme,"Former chief executive officer and president of Maple Leaf Sports & Entertainment Tim Leiweke has been indicted by the U.S. Department of Justice for allegedly orchestrating a conspiracy to rig the bidding process for an arena at a public university in Austin, Texas.",2025-07-09,https://www.cbc.ca/sports/tim-leiweke-indicted-1.7581188?cmp=rss,CBC,"Virgin Islands, U.S.",Politics
807,Ex-NHLer Nick Tarnasky cleared by RCMP in Alberta golf course fight,RCMP said it has concluded an investigation into a fight on an Alberta golf course involving former NHL player Nick Tarnasky.,2025-07-09,https://www.cbc.ca/news/canada/edmonton/fight-tarnasky-1.7581011?cmp=rss,CBC,Canada,Sports
808,"Winnipeg family doctor accused of losing, mismanaging medical files in 'pig pen' clinic","A Winnipeg family physician is accused of mishandling, losing or delaying the transfer of medical files, sometimes resulting in delayed access to medical care.",2025-07-09,https://www.cbc.ca/news/canada/manitoba/winnipeg-doctor-mismanged-medical-files-allegations-1.7576634?cmp=rss,CBC,United States,Health
809,Student pilot from India identified as 1 of 2 killed in southern Manitoba mid-air plane crash,,2025-07-09,https://www.cbc.ca/news/canada/manitoba/plane-crash-mid-air-steinbach-1.7580865?cmp=rss,CBC,India,Education
810,Summer McIntosh's willingness to further challenge herself may lead to more history at upcoming worlds,Three-time Olympic champion Summer McIntosh has her sights set on wins in five events at the upcoming world aquatics championships in Singapore.,2025-07-09,https://www.cbc.ca/sports/olympics/summer/aquatics/swimming/summer-mcintosh-swimming-world-championshps-1.7581009?cmp=rss,CBC,Singapore,Sports
811,"Defund universities that allow anti-Semitism, says Australia envoy",Migrants would face deportation for espousing anti-Jewish sentiment under sweeping plan.,2025-07-10,https://www.aljazeera.com/news/2025/7/10/defund-universities-that-allow-anti-semitism-australia-envoy-says?traffic_source=rss,Al Jazeera,Australia,Conflict
812,Zelenskyy seeking to bolster Ukraine’s air defences at Rome conference,"Fourth conference on Ukraine reconstruction comes as Russia escalates attacks on country, amid doubts over US support.",2025-07-10,https://www.aljazeera.com/news/2025/7/10/zelenskyy-seeking-to-bolster-ukraines-air-defences-at-rome-conference?traffic_source=rss,Al Jazeera,Ukraine,Conflict
813,What is Grok and why has Elon Musk’s chatbot been accused of anti-Semitism?,"Elon Musk’s AI chatbot Grok, designed to be 'unfiltered', has sparked global backlash over some of its responses.",2025-07-10,https://www.aljazeera.com/news/2025/7/10/what-is-grok-and-why-has-elon-musks-chatbot-been-accused-of-anti-semitism?traffic_source=rss,Al Jazeera,United States,Technology
814,Texas mourns flood victims at vigil as search continues for dozens missing,"Texans gather in Kerrville to mourn more than 120 flood victims and pray for 160, at least, still missing.",2025-07-10,https://www.aljazeera.com/news/2025/7/10/texas-mourns-flood-victims-at-vigil-as-search-continues-for-dozens-missing?traffic_source=rss,Al Jazeera,United States,General
815,"Armenia, Azerbaijan leaders meet for peace talks in UAE","Draft deal to end bitter decades-long conflict agreed 4 months ago, but timeline for sealing it remains uncertain.",2025-07-10,https://www.aljazeera.com/news/2025/7/10/draft-deal-to-end-bitter-conflict-agreed-4-months-ago-but-timeline-for-sealing-complex-deal-remains-uncertain?traffic_source=rss,Al Jazeera,Armenia,Conflict
816,Why is India forcing 80 million people to justify their right to vote?,"Amid raids targeting Muslims, an electoral roll revision in India’s poorest state has become a political flashpoint.",2025-07-10,https://www.aljazeera.com/features/2025/7/10/why-is-india-forcing-80-million-people-to-justify-their-right-to-vote?traffic_source=rss,Al Jazeera,India,Politics
817,South Korea’s Yoon detained for a second time over martial law,"The arrest comes after the court authorises former leader's arrest, citing concerns he may destroy evidence.",2025-07-10,https://www.aljazeera.com/news/2025/7/10/south-koreas-yoon-detained-for-second-time-over-martial-law?traffic_source=rss,Al Jazeera,South Korea,Conflict
818,UK parliamentary committee seeks answers over US firm BCG’s role in Gaza,Boston Consulting Group questioned over involvement in establishing the controversial Gaza Humanitarian Foundation.,2025-07-10,https://www.aljazeera.com/news/2025/7/10/uk-parliamentary-committee-seeks-answers-over-us-firm-bcgs-role-in-gaza?traffic_source=rss,Al Jazeera,Uganda,Business
819,More than 100 premature babies in Gaza at risk as hospitals run out of fuel,Officials say fuel shortages caused by Israel's siege threaten to cut off electricity to al-Shifa and Nasser hospitals.,2025-07-10,https://www.aljazeera.com/news/2025/7/10/more-than-100-premature-babies-at-risk-in-gaza-as-hospitals-run-out-of-fuel?traffic_source=rss,Al Jazeera,"Palestine, State of",Conflict
820,"Trump assails ex-FBI, CIA heads amid reports of criminal probe",US president attacks John Brennan and James Comey amid reports two men are under investigation over Trump-Russia probe.,2025-07-10,https://www.aljazeera.com/news/2025/7/10/trump-assails-ex-fbi-cia-heads-amid-reports-of-criminal-probe?traffic_source=rss,Al Jazeera,United States,Politics
821,"Russia-Ukraine war: List of key events, day 1,232","Here are the key events on day 1,232 of Russia’s war on Ukraine.",2025-07-10,https://www.aljazeera.com/news/2025/7/10/chk_russia-ukraine-war-list-of-key-events-day-1232?traffic_source=rss,Al Jazeera,Russian Federation,Conflict
822,"If Trump wants Gaza ceasefire, he must pressure Netanyahu, experts say",Analysts say Trump's call for ceasefire is incomplete without using US leverage to push Israel to conclude negotiations.,2025-07-10,https://www.aljazeera.com/news/2025/7/10/if-trump-wants-gaza-ceasefire-he-must-pressure-netanyahu-experts-say?traffic_source=rss,Al Jazeera,"Palestine, State of",Conflict
823,Trump singles out Brazil for 50 percent tariffs over Bolsonaro trial,US president pointed to the criminal trial of far-right leader Jair Bolsonaro as the reason for the steep tariff hike.,2025-07-09,https://www.aljazeera.com/news/2025/7/9/trump-singles-out-brazil-for-fifty-percent-tariffs-citing-political-motives?traffic_source=rss,Al Jazeera,Brazil,Conflict
824,PSG hammer Real Madrid 4-0 to reach FIFA Club World Cup final,A Fabian Ruiz double helps Paris Saint-Germain thump Real Madrid to set up FIFA Club World Cup final against Chelsea.,2025-07-09,https://www.aljazeera.com/sports/2025/7/9/psg-hammer-real-madrid-4-0-to-reach-fifa-club-world-cup-final?traffic_source=rss,Al Jazeera,France,Sports
825,Palestinian children killed at GHF aid sites in Gaza,Over 700 Palestinians have been killed while trying to collect aid from the US- and Israel-backed GHF aid sites.,2025-07-09,https://www.aljazeera.com/video/newsfeed/2025/7/9/palestinian-children-killed-at-ghf-aid-sites-in-gaza?traffic_source=rss,Al Jazeera,"Palestine, State of",Conflict
826,"As Texas floodwaters recede, lawmakers grapple with emergency preparedness",County officials had pressed the state for flood warning systems for nearly a decade but without luck.,2025-07-09,https://www.aljazeera.com/economy/2025/7/9/as-texas-floodwaters-recede-lawmakers-grapple-with-emergency?traffic_source=rss,Al Jazeera,United States,General
827,Hamas agrees to release 10 captives as Israeli attacks kill 74 in Gaza,Hamas says ongoing talks remain 'tough' as Trump sees a ‘good chance’ of reaching ceasefire deal within days.,2025-07-09,https://www.aljazeera.com/news/2025/7/9/hamas-agrees-to-release-captives-as-israeli-attacks-kill-in-gaza?traffic_source=rss,Al Jazeera,"Palestine, State of",Conflict
828,Why are Indian workers angry with Narendra Modi?,Millions of people have gone on strike in India against new government labour and business policies.,2025-07-09,https://www.aljazeera.com/video/inside-story/2025/7/9/why-are-indian-workers-angry-with-narendra-modi?traffic_source=rss,Al Jazeera,India,Conflict
829,‘Never touched a gun’: Colombia fighters step up child soldier recruitment,"As Colombia’s conflicts continue to escalate, criminal organisations rely on young soldiers to bolster ranks.",2025-07-09,https://www.aljazeera.com/news/2025/7/9/never-touched-a-gun-colombia-fighters-step-up-child-soldier-recruitment?traffic_source=rss,Al Jazeera,Colombia,Conflict
830,Keep your shoes on: What to know about the TSA rule change at US airports,The TSA required travellers to remove their shoes during airport security screenings for nearly two decades.,2025-07-09,https://www.aljazeera.com/news/2025/7/9/keep-your-shoes-on-what-to-know-about-the-tsa-rule-change-at-us-airports?traffic_source=rss,Al Jazeera,United States,Education
831,Trump: ‘Very good chance’ of Gaza ceasefire this week or next,Donald Trump says there’s a “very good chance” of a Gaza ceasefire within days after meeting Israeli PM Netanyahu.,2025-07-09,https://www.aljazeera.com/video/newsfeed/2025/7/9/trump-very-good-chance-of-gaza-ceasefire-this-week-or-next?traffic_source=rss,Al Jazeera,"Palestine, State of",Politics
832,US sanctions UN expert Francesca Albanese over Israel criticism,"UN rapporteur appears to dismiss the Trump administration penalties, calling them 'mafia-style intimidation techniques'.",2025-07-09,https://www.aljazeera.com/news/2025/7/9/us-sanctions-un-expert-albanese-over-israel-criticism?traffic_source=rss,Al Jazeera,United States,Conflict
833,T-Mobile to end DEI programme as it seeks regulatory approval,"The wireless carrier, which is seeking FCC approval on two deals, bowed the pressure from the White House.",2025-07-09,https://www.aljazeera.com/economy/2025/7/9/t-mobile-to-end-dei-programme-as-it-seeks-regulatory-approval?traffic_source=rss,Al Jazeera,United States,Politics
834,‘Shoot their legs’: Kenya’s President Ruto rails against looters,Kenyan President William Ruto said anyone looting or vandalising businesses should be shot in their legs.,2025-07-09,https://www.aljazeera.com/video/newsfeed/2025/7/9/shoot-their-legs-kenyas-president-ruto-rails-against-looters?traffic_source=rss,Al Jazeera,Kenya,Politics
835,Bridge collapse in Gujarat kills 10,"At least 10 people died after a portion of the Gambhira Bridge collapsed into the Mahisagar River in Gujarat, India.",2025-07-09,https://www.aljazeera.com/video/newsfeed/2025/7/9/bridge-collapse-in-gujarat-kills-10?traffic_source=rss,Al Jazeera,India,General
836,Texas flooding live updates: State death toll jumps to 120,"Over 100 people have died after heavy rain pounded Kerr County, Texas, early Friday, leading to ""catastrophic"" flooding, the sheriff said.",2025-07-09,https://abcnews.go.com/US/live-updates/texas-flooding-updates-13-dead-20-campers-unaccounted/?id=123488468,ABC,United States,Culture
837,LIVE:  ABC News Live,24/7 coverage of breaking news and live events,2025-07-09,https://abcnews.go.com/Live/video/abcnews-live-41463246,ABC,Unknown,General
838,At least 31 workers rescued after tunnel collapse in Los Angeles: LAFD,"At least 31 tunnel workers have been rescued from a tunnel collapse in Los Angeles, according to the Los Angeles Fire Department.",2025-07-10,https://abcnews.go.com/US/15-workers-trapped-tunnel-collapse-los-angeles-lafd/story?id=123633018,ABC,Unknown,General
839,'I think this is it': Dad leaves harrowing voicemails before dying in Texas flood,"In his final moments before floodwaters overtook his camper in Kerrville, Texas, Jeff Ramsey left a voicemail for his children.",2025-07-09,https://abcnews.go.com/US/dad-left-goodbye-messages-kids-dying-texas-floods/story?id=123622289,ABC,United States,General
840,WATCH:  David Muir speaks with Texas son still searching for parents after flooding,"Along the banks of the Guadalupe River, David Muir meets with Robert Brake Jr. as he searches for his parents who were washed away by the rapidly rising floods.",2025-07-09,https://abcnews.go.com/WNT/video/david-muir-speaks-texas-son-searching-parents-after-123606653,ABC,United States,Health
841,WATCH:  House swept away by rushing floodwaters in New Mexico,"Visitors to a local brewery in Ruidoso, New Mexico, were stunned to see a house swept away by rushing floodwaters on Tuesday as they waited out the danger.",2025-07-09,https://abcnews.go.com/US/video/house-swept-rushing-floodwaters-new-mexico-123606457,ABC,United States,General
842,WATCH:  Homeland Security ends mandatory shoe removal at airport screening,Homeland Security Secretary Kristi Noem has announced that the TSA and its nearly two-decade mandate for passengers to remove their shoes at airport screening is officially over.,2025-07-09,https://abcnews.go.com/Travel/video/homeland-security-ends-mandatory-shoe-removal-airport-screening-123606340,ABC,United States,General
843,WATCH:  Rescue and recovery efforts ongoing in Texas after floods,ABC News Chief National Correspondent Matt Gutman is at one location along the Guadalupe River where officials are performing rescue and recovery missions.,2025-07-08,https://abcnews.go.com/US/video/rescue-recovery-efforts-ongoing-texas-after-floods-123587764,ABC,United States,General
844,WATCH:  Coast Guard rescue swimmer who saved 165 from Camp Mystic speaks out,Scott Ruskin joined “GMA” to detail his rescue operation amid deadly flooding in Texas.,2025-07-07,https://abcnews.go.com/US/video/coast-guard-rescue-swimmer-saved-165-camp-mystic-123547838,ABC,United States,Health
845,WATCH:  Cyndi Lauper talks being inducted into Rock & Roll Hall of Fame,"The musician reflected on a full-circle moment on ""GMA.""",2025-07-08,https://abcnews.go.com/GMA/Culture/video/cyndi-lauper-talks-inducted-rock-roll-hall-fame-123574974,ABC,United States,General
846,WATCH:  Viral dog with narcolepsy passes out whenever he gets too excited,The condition is harmless and made Dozer go viral -- and eventually helped him get adopted.,2025-07-07,https://abcnews.go.com/GMA/Culture/video/viral-dog-narcolepsy-passes-gets-excited-123547721,ABC,Unknown,General
847,"WATCH:  Lewis Capaldi chooses his first, last and best concert",The singer shared his favorite music memories with “GMA.”,2025-07-07,https://abcnews.go.com/GMA/Culture/video/lewis-capaldi-chooses-best-concert-123547535,ABC,United States,Entertainment
848,WATCH:  Moment a Utah strip mall explodes after vehicle crash,Eyewitness video captured the dramatic moment when a large explosion tore through a strip mall in Utah.,2025-07-06,https://abcnews.go.com/US/video/moment-utah-strip-mall-explodes-after-vehicle-crash-123516993,ABC,United States,General
849,WATCH:  Man in patriotic bathing suit chases runaway beach umbrella,A man in a stars-and-stripes bathing suit gave beachgoers in South Carolina a show as he sprinted across the sand chasing after a runaway beach umbrella just before the Fourth of July.,2025-07-05,https://abcnews.go.com/US/video/man-patriotic-bathing-suit-chases-runaway-beach-umbrella-123494414,ABC,United States,Entertainment
850,WATCH:  Amazon truck loses control and veers off road,"Dramatic video shows the moment an Amazon truck driver in Iowa lost control and swerved off the road into some trees. While there was some property damage, nobody was hurt in the crash, police said.",2025-07-04,https://abcnews.go.com/US/video/amazon-truck-loses-control-veers-off-road-123466521,ABC,United States,Technology
851,WATCH:  Incredible footage captures moment a huge tornado touched down in rural South Dakota,"A storm chaser captured the moment a huge tornado touched down near the town of Clear Lake, South Dakota.",2025-07-03,https://abcnews.go.com/US/video/incredible-footage-captures-moment-huge-tornado-touched-rural-123468524,ABC,United States,General
852,WATCH:  Fireworks warehouse catches fire and explodes in California,Eyewitness video captured the moment when a fireworks warehouse caught fire and exploded in California.,2025-07-02,https://abcnews.go.com/US/video/fireworks-warehouse-catches-fire-explodes-california-123405655,ABC,United States,General
853,WATCH:  Diddy trial: Could you be a fair juror?,"ABC News asked New Yorkers if they think they could be a fair juror in the case against Sean ""Diddy"" Combs, who has pleaded not guilty on charges of sex trafficking and racketeering.",2025-07-01,https://abcnews.go.com/US/video/diddy-trial-fair-juror-123354158,ABC,United States,Health
854,WATCH:  Annie Murphy and Christine Baranski on playing mother and daughter,The actresses talked about building a bond for their characters on “Nine Perfect Strangers.”,2025-07-01,https://abcnews.go.com/Entertainment/video/annie-murphy-christine-baranski-playing-mother-daughter-123389662,ABC,Unknown,General
855,WATCH:  Shonda Rhimes on 20 years of ‘Grey’s Anatomy’,Rhimes celebrated two decades of Shondaland by discussing some of the show’s iconic quotes.,2025-07-01,https://abcnews.go.com/Entertainment/video/shonda-rhimes-20-years-greys-anatomy-123389952,ABC,United States,Culture
856,WATCH:  Penguin joins swimmers at the beach in Brazil,"A Magellanic penguin was spotted at the beach in Rio de Janeiro over the weekend, drawing attention from beachgoers who shared images of the rare visitor on social media.",2025-07-02,https://abcnews.go.com/International/video/penguin-joins-swimmers-beach-brazil-123397760,ABC,Brazil,Health
857,WATCH:  Mountain deck covered with 'lovebugs' in South Korea,"Swarms of “lovebugs” are back in South Korea, blanketing a mountain peak, entering houses and sticking to car windows.",2025-07-01,https://abcnews.go.com/International/video/mountain-deck-covered-lovebugs-south-korea-123373087,ABC,South Korea,General
858,WATCH:  Nosy moose sticks head into car,Motorists in Canada were in for an unusual traffic stop when a large moose moseyed up and stuck its nose in their vehicle's window.,2025-06-30,https://abcnews.go.com/Travel/video/nosy-moose-sticks-head-car-123344985,ABC,Canada,Entertainment
859,WATCH:  Florida woman speaks out after tornado lifts home off ground with her inside,"Seventy-six-year-old Deborah Mettler survived the EF-1 tornado that ripped through Largo, Florida.",2025-06-28,https://abcnews.go.com/US/video/florida-woman-speaks-after-tornado-lifts-home-off-123291493,ABC,United States,General
860,Samsung unveils its new line of foldable devices at Unpacked,"Samsung introduced several updates to its foldable devices lineup on Wednesday, with the new Galaxy Z Fold 7, Z Flip 7, and the new Z Flip 7 FE taking stage at the latest Unpacked event",2025-07-09,https://abcnews.go.com/Technology/wireStory/samsung-unveils-new-line-foldable-devices-unpacked-123612726,ABC,South Korea,Technology
861,Chipmaker Nvidia becomes most valuable company in the world at $4 trillion,Chipmaker Nvidia became the first public company to top $4 trillion in value on Wednesday after two-year investor frenzy,2025-07-09,https://abcnews.go.com/Technology/wireStory/chipmaker-nvidia-valuable-company-world-4-trillion-123610115,ABC,Unknown,Technology
862,"Nvidia surpassed $4 trillion in market valuation, the first company ever to do so","The chipmaker Nvidia surpassed $4 trillion in market valuation, the first company ever to do so",2025-07-09,https://abcnews.go.com/Technology/wireStory/chipmaker-nvidia-surpassed-4-trillion-market-valuation-company-123609163,ABC,Unknown,Technology
863,"A 'click-to-cancel' rule, intended to make cancelling subscriptions easier, is blocked","A “click-to-cancel” rule, which would have required businesses to make it easy for consumers to cancel unwanted subscriptions and memberships, has been blocked by a court days before it was set to go into effect",2025-07-09,https://abcnews.go.com/Technology/wireStory/click-cancel-rule-intended-make-cancelling-subscriptions-easier-123605577,ABC,United States,Technology
864,Musk's AI company scrubs inappropriate posts after chatbot makes antisemitic comments,"Elon Musk’s artificial intelligence company is taking down antisemitic comments and other “inappropriate posts” made by its Grok chatbot, including some praising Adolf Hitler",2025-07-10,https://abcnews.go.com/Technology/wireStory/musks-ai-company-scrubs-inappropriate-posts-after-grok-123602757,ABC,United States,Technology
865,Turkish court orders ban on Elon Musk's AI chatbot Grok for offensive content,A Turkish court has banned Elon Musk’s AI chatbot Grok from operating in Turkey,2025-07-09,https://abcnews.go.com/Technology/wireStory/turkish-court-orders-ban-elon-musks-ai-chatbot-123599913,ABC,United States,Technology
866,Video game performers vote on contract that could end nearly 3-year battle over AI,Union members have until July 9 at 5 p.m. Pacific to vote on a tentative contract between video game performers and their employers,2025-07-09,https://abcnews.go.com/Technology/wireStory/video-game-performers-vote-contract-end-year-long-123597408,ABC,Saint Kitts and Nevis,Technology
867,"'Lord of the Rings' director backs long shot de-extinction plan, starring lost bird",Filmmaker Peter Jackson's fascination with a large extinct New Zealand bird has led to an unusual partnership with a biotech company known for its grand and controversial plans to bring back lost species,2025-07-08,https://abcnews.go.com/Technology/wireStory/lord-rings-director-backs-long-shot-de-extinction-123579057,ABC,New Zealand,Technology
868,What to know about a potential deal to keep TikTok running in US,"Less than a month after extending a deadline to ban TikTok for the third time, President Donald Trump told reporters late Friday night that, “We pretty much have a deal,” on TikTok",2025-07-07,https://abcnews.go.com/Technology/wireStory/potential-deal-tiktok-running-us-123548448,ABC,United States,Technology
869,How a GOP rift over tech regulation doomed a ban on state AI laws in Trump's tax bill,A stark disagreement over regulating AI in Republicans’ tax cut and spending bill is the latest tension among conservatives about whether to let states continue to put guardrails on emerging technologies or minimize such interference,2025-07-03,https://abcnews.go.com/Technology/wireStory/gop-rift-tech-regulation-doomed-ban-state-ai-123437927,ABC,United States,Technology
870,Company's carbon credits raise questions about unproven ocean technology to fight global warming,"A startup called Gigablue claims to have reached a milestone by selling 200,000 carbon credits for its ocean-based carbon capture technology",2025-07-03,https://abcnews.go.com/Technology/wireStory/companys-carbon-credits-raise-questions-unproven-ocean-technology-123437379,ABC,Unknown,Technology
871,Astronomers track object that may have originated outside the solar system,Astronomers are monitoring an object headed our way that may have wandered over from another star system,2025-07-02,https://abcnews.go.com/Technology/wireStory/astronomers-track-object-originated-solar-system-123423583,ABC,Unknown,Technology
872,Shriners Children's to open $153M medical research facility in Atlanta,A charitable hospital system say it will open a $153 million medical research facility in Atlanta,2025-07-02,https://abcnews.go.com/Technology/wireStory/shriners-childrens-open-153m-medical-research-facility-atlanta-123422293,ABC,Unknown,Technology
873,Australian airline Qantas says customer data stolen by cybercriminal,"Australian airline Qantas said that a hacker made off with a trove of customers’ personal data including passenger names, emails, phone numbers, birth dates and frequent flyer numbers",2025-07-02,https://abcnews.go.com/Technology/wireStory/australian-airline-qantas-customer-data-stolen-cybercriminal-123417815,ABC,United States,Technology
874,Ancient DNA shows genetic link between Egypt and Mesopotamia,Ancient DNA has revealed links between the cultures of Egypt and Mesopotamia,2025-07-02,https://abcnews.go.com/Technology/wireStory/ancient-dna-shows-genetic-link-egypt-mesopotamia-123415314,ABC,Egypt,Technology
